cluster_id,sequence_order,lat,lon,cumulative_distance_km,store_name
484,1,2.8083837,102.405653,110.3576,"BK FRESH & FROZEN FOOD MARKET (Open everyday 4am-12pm)"
485,1,2.821538,102.410069,110.3595,"GREEN APPLE STORE SDN. BHD."
486,1,2.808397,102.405753,110.3676,"CHOP KWONG LOONG"
487,1,2.808211,102.405889,110.3886,"GUANG HENG MARKETING SDN BHD (Received goods: 11am-4pm)"
488,1,2.439583577,102.1842288,110.6977,"RR NANING ENTERPRISE"
489,1,3.450564203,102.4113123,110.9631,"SIONG HING HANG MARKETING SDN BHD"
490,1,4.0091815,100.9929692,111.0244,"PASAR MINI INTAN BARU SDN BHD"
491,1,2.809592,102.412444,111.0284,"SUN DA TRADING (DELIVERY BEFORE 12 NOON)"
492,1,2.8095216,102.4125039,111.0373,"ISHAK BIN BUSAH (Open 8am-8pm)"
493,1,2.8124569,102.4139396,111.0844,"THAAM ENTERPRISE (Please call before delivery)"
494,1,2.474924165,102.2213142,111.0932,"ECONSAVE CASH & CARRY (BW) SDN BHD - TAMPIN"
495,1,4.0240042,101.0186324,111.1819,"PERNIAGAAN YONG KI"
496,1,4.0248429,101.0186845,111.2628,"PRK SPICE & HERBS"
497,1,2.356359,102.103392,111.3781,"PASAR MINI SON HUAT"
498,1,4.0262088,101.018853,111.3905,"GUAN WENG HUAT ENTERPRISE SDN BHD - PERAK"
499,1,2.7976227,102.420711,112.3286,"KEDAI RUNCIT BAHAU (Fri close)"
500,1,2.469735,102.231805,112.3524,"JATI FROZEN SDN BHD (TAMPIN BRANCH) - OPEN 7AM - 9PM"
501,1,2.458855,102.223937,112.4894,"BAIDURI MART (CALL B4 DELIVERY)"
502,1,2.462522738,102.2317066,112.8691,"MYDIN MOHAMED HOLDINGS BERHAD - PSH"
503,1,2.7943941,102.4255772,112.9570,"CANDY CRUM SDN. BHD. - POPCORN BAHAU (Open 10am-5.30pm|Sun close)"
504,1,4.018622443,101.9723922,113.8294,"SYARIKAT LEAN TRADING"
505,1,3.9064538,100.7743682,115.5516,"SAI STORE"
506,1,2.9473873,102.4926511,115.8692,"FADZILLAH BINTI A AZIZ"
507,1,2.9475377,102.4945562,116.0746,"MD MARIHAN BORHAN TRADING (Open 7am-9pm|Rest 1pm-3.30pm)"
508,1,2.9457585,102.4959275,116.2592,"ARD ASIAH ENTERPRISE (Open 7am-8pm|1pm-4pm rest)"
509,1,2.9457585,102.4959275,116.2592,"PASAR MINI BORONG BARKATH MOHD NOOR"
510,1,2.9426231,102.4999387,116.7592,"DARUSSALAM MART"
511,1,2.9427019,102.5002101,116.7873,"NUR MINI MART"
512,1,2.3828824,102.2117659,117.2964,"RZ MAJU SDN BHD ( 10 AM-4 PM , FRI 12 PM-2 PM OFF )"
513,1,2.370658,102.1994272,117.3050,"MRZ SERUMPUN"
514,1,2.9486899,102.5066804,117.3786,"MINI MARKET GATCO RC (Open: 7am-6pm)"
515,1,2.6611064,102.4169152,117.8072,"PUJAAN MINI MART SDN BHD-TAMAN SRI INTAN"
516,1,3.943073,100.7756027,118.5396,"PASAR MINI GREEN MART"
517,1,2.296981519,102.1340607,118.6501,"CK FROZEN MART SDN BHD (9.30am-7pm) (Sunday Off)"
518,1,2.8876407,102.5077558,118.8455,"MUHIBAH FROZEN FOOD SDN. BHD."
519,1,2.2909466,102.1318586,119.0218,"MART ON TWELFTH"
520,1,2.371754432,102.2262391,119.3086,"XUN FA MINI MARKET - small lorry"
521,1,2.294969385,102.1420199,119.3794,"ECONSAVE CASH & CARRY (SU) SDN BHD *"
522,1,2.8769164,102.5218768,120.6455,"CHE LAH BIN ISMAIL (Open 8am-8pm|Rest: 1pm-3.30pm)"
523,1,2.3285346,102.2084634,121.3968,"NKR CONVENIENT MART"
524,1,3.9904696,100.7863881,121.8672,"CHOP CHIN TAI"
525,1,2.2611787,102.1407431,122.2343,"RECRON (MALAYSIA) SDN BHD - MELAKA HOSTEL"
526,1,3.99128,100.7803244,122.3548,"KEDAI RUNCIT SONG LIM"
527,1,2.28698,102.181069,122.8333,"PASAR MINI TAQWA (JUMAAT TUTUP)"
528,1,2.25497,102.144617,123.0436,"RECRON (MALAYSIA) SDN BHD - MELAKA PHASE 3"
529,1,2.536812,102.404748,123.3884,"JATI FROZEN SDN BHD (GEMENCHEH BRANCH) (OPEN 9 AM - 8:30 PM)"
530,1,2.536896,102.404814,123.3896,"GREEN APPLE STORE (GEMENCHEH) SDN. BHD. (no receiving on saturday)"
531,1,2.5382376,102.405752,123.3982,"BIG 10 GROCER (GEMENCHEH) SDN BHD"
532,1,2.5383217,102.4058174,123.3994,"PUJAAN MINI MART SDN BHD-TAMAN MUHIBBAH"
533,1,2.253817,102.151588,123.6209,"RECRON (MALAYSIA) SDN BHD - MELAKA PHASE 1"
534,1,2.5272594,102.4014604,123.6515,"MEKAR FRESH & FROZENMART (GEMENCHEH)"
535,1,2.5444836,102.4149912,123.9022,"KEONG MAJU JELAI (Mon-Fri: 8am-8pm|Weekend close)"
536,1,2.7050538,102.4983261,124.0425,"GUNA MINI MARKET"
537,1,2.2498111,102.155748,124.2567,"HONG MOH CASH & CARRY"
538,1,2.251184,102.158799,124.3463,"PASAR MINI SINAR GEMILANG - TAMAN TANGGA BATU PERDANA"
539,1,2.3284949,102.2495103,124.5454,"PASAR MINI AASVINS"
540,1,2.244598,102.160315,125.0259,"PASARAYA TOP MAX (DELIVERY: Mon - Fri : 1PM - 5PM)"
541,1,2.2404353,102.1575033,125.1983,"PASARAYA ONE FAMILY (TANJUNG KLING)"
542,1,2.262822,102.191563,125.6386,"PASAR MINI SINAR GEMILANG (Small Lorry) - TAMAN RAMBAI UTAMA"
543,1,2.2808712,102.2149152,125.8083,"NUR UKHWAH ENTERPRISE"
544,1,2.320073379,102.2592336,125.9703,"AHMAD KHANAPI BIN HJ UMAR (FRIDAY off 12pm - 4pm)"
545,1,2.260321702,102.1965873,126.2104,"ALINAH KARIM ENTERPRISE"
546,1,2.2574983,102.1954667,126.3709,"PASAR MINI PERMAI SETIA"
547,1,2.297577,102.2432,126.5460,"CH CASH & CARRY (Rest 1pm-2pm|Call before delivery|No delivery lunch time)"
548,1,2.2967923,102.2457699,126.8048,"PASAR MINI KKS ONE"
549,1,2.25244,102.1958688,126.8313,"OPPA MART SDN BHD"
550,1,2.297555,102.248375,126.9410,"TOP MAX MINI MARKET (DELIVERY : Mon - Fri : 1pm - 5pm)"
551,1,2.2522965,102.1982322,127.0117,"RS FAMILY MARKET ( OPEN 11AM, SMALL LORRY )"
552,1,2.2733184,102.226459,127.2873,"SYAMID ENTERPRISE ( FRIDAY OFF )"
553,1,2.304469955,102.2681748,127.9058,"CHOONG HOE TRADING (Mon-Fri ONLY 10am-1pm, 2pm-5pm)"
554,1,2.302969,102.266971,127.9324,"CHOONG HOE CASH & CARRY SDN BHD (Mon-Fri 10.30am open, 12pm-2pm rehat)"
555,1,2.2686719,102.2365765,128.4211,"YOU 2 MART"
556,1,2.2729766,102.2465509,128.8088,"OPPA MART MARKETING SDN BHD - BATU BERENDAM"
557,1,2.272701867,102.2464235,128.8218,"CHIN MC MINI MARKET"
558,1,2.275961752,102.253667,129.0986,"ECONSAVE CASH & CARRY (BB) SDN BHD *"
559,1,2.2415936,102.2151965,129.1351,"HELLO MINI MARKET"
560,1,2.7890154,102.578274,129.2625,"SAI MINI MARKET (Open 8am-8pm)"
561,1,2.269922417,102.2501243,129.3273,"GOH TIAM CHUAN TRADING"
562,1,2.2608017,102.2411053,129.4089,"MUSTAQIM MINI MARKET"
563,1,2.259639,102.2405041,129.4610,"JIA XIN CASH & CARRY"
564,1,2.249955,102.230469,129.5329,"U-BESMART WHOLESALE MARKET SDN BHD"
565,1,2.255564,102.238183,129.6288,"PERNIAGAAN WAH SING (N.S.) SDN. BHD. (Open 4am-4pm)"
566,1,2.252079,102.237504,129.8696,"CB FROZEN FOOD SDN BHD- MELAKA 7AM-4PM"
567,1,2.253597,102.240167,129.9387,"JATI FROZEN SDN BHD ( BATU BERENDAM BRANCH) (OPEN 6 AM - 4 PM)"
568,1,2.652916,102.5339046,129.9598,"PRABHAKAR A/L RAMAN (3pm-12am|Sun close)"
569,1,2.2466351,102.232629,129.9690,"HARJUT ALI ENTERPRISE (8AM-9PM EVERYDAY)"
570,1,2.652717,102.5340178,129.9803,"PASAR MINI TOK HASSAN (Call before arrange for delivery)"
571,1,2.2463928,102.2335208,130.0543,"SHREE PATHMA STORE"
572,1,2.245917365,102.2347278,130.1822,"ABDUL SALAM A/L KADER IBRAHIM"
573,1,2.256400051,102.2505753,130.4755,"G PLUS CONVENIENCE STORE (Open everyday 7:30AM-2.00AM) (Tuesday 4pm onward)"
574,1,2.248418112,102.2438813,130.6435,"LAI LAI BAK KUT TEH"
575,1,2.8977939,102.6192924,130.7137,"KOPERASI PENEROKA FELDA PALONG SEMBILAN BERHAD (Mon-Sat: 7am-6pm|12pm-3pm rest)"
576,1,2.230711643,102.2274848,130.9407,"ECONSAVE CASH & CARRY (ML) SDN BHD *"
577,1,2.241015,102.240733,131.0315,"BKS FROZEN TRADING"
578,1,2.239889,102.2401,131.0797,"LEONG HUAT TIEN GUAN TRADING SDN BHD"
579,1,2.879303,102.6190336,131.1064,"KEDAI RUNCIT SITI HALINA MAJU (Open 7am-8.30pm)"
580,1,2.281623,102.294542,131.7698,"MELAKA WONDERLAND SDN BHD (Tue to Sun : 10am-1pm & 2pm-5pm)"
581,1,2.232541938,102.2415204,131.8003,"ARAS DUA ENTERPRISE (FRIDAY open 3.00pm)"
582,1,2.6791673,102.5690676,132.4046,"PASAR MINI KEMART (Open everyday: 7am-9pm|Rest: 1pm-4pm)"
583,1,2.2090979,102.2222802,132.4155,"LUCKY CITY MART"
584,1,2.240938969,102.2595423,132.4208,"BAKERS CHOICE INGREDIENTS STORE"
585,1,2.2385664,102.2569486,132.4261,"GOLD COIN MINIMARKET"
586,1,2.2397331,102.2585394,132.4467,"KEDAI RUNCIT CHUAN LEE LAI"
587,1,2.2147922,102.2299478,132.4715,"UNGGUL MINI MART"
588,1,2.2708462,102.2936051,132.5573,"MYDIN MOHAMED HOLDINGS BERHAD - MLH **"
589,1,2.2542479,102.2769851,132.6303,"RESTORAN ASRI ROS MERAH SDN BHD"
590,1,2.245286,102.271852,132.9781,"SYARIKAT M.B.ABDUL NASER (FRIDAY OFF DAY)"
591,1,2.2462188,102.2729204,132.9815,"LIAN HONG TRADING CO. (Delivery after 11am)"
592,1,2.2448935,102.2742263,133.1882,"HONG TECK KEE"
593,1,2.2230731,102.2498471,133.2018,"MYDIN MOHAMED HOLDINGS BERHAD - MMM"
594,1,2.2589138,102.2899483,133.2361,"STARS MART NETWORKS (*FRIDAY OFF)"
595,1,2.2197265,102.2514698,133.6013,"MYDIN MELAKA BAZAAR SDN BHD"
596,1,2.2135708,102.2447177,133.6329,"SNM KEJORA ENTERPRISE (NASI KEJORA)"
597,1,2.251848748,102.2889253,133.7300,"MINI MARKET MUZAR FASHAH"
598,1,2.2519873,102.2895094,133.7632,"P N A NAINA MOHAMED STORE (DELIVERY 11AM-5PM)"
599,1,2.251105,102.288957,133.7928,"MALLA ROHANA ENTERPRISE"
600,1,2.265187,102.306337,133.9933,"KOPERASI WAWASAN BUKIT MAS KELANTAN BERHAD"
601,1,2.1976457,102.2316617,134.0611,"GOLDEN SOUTH CULINARY SDN BHD (11am - 11pm)"
602,1,2.198427,102.233106,134.0960,"HASIL LAUTAN HONG KEE SDN BHD"
603,1,2.198274,102.232944,134.0977,"KUIH CANTIK ENTERPRISE"
604,1,2.215923,102.254725,134.1578,"MD NUR CORNER *-deliver after 3pm"
605,1,2.196966,102.2369484,134.4931,"NETS CONVENIENT SHOP  (khamis tutup)"
606,1,2.2054708,102.2522094,134.8583,"RESTAURANT L.T.P SDN BHD (Break Time : 2.30-5.30pm no receiving)"
607,1,2.199395,102.247781,135.0564,"SEE LEONG SOON TRADING"
608,1,2.2133371,102.2641562,135.0616,"KELUARGAKU (M) SDN BHD"
609,1,2.242322,102.299844,135.3327,"PASAR MINI IQBAL & NAYZIER"
610,1,2.241961,102.299653,135.3474,"PANGKOR VILLAGE SEAFOOD RESTAURANT (Mon close)"
611,1,2.214852373,102.269957,135.3593,"BIG 10 GROCER (BUKIT BARU) SDN BHD"
612,1,2.197021,102.249353,135.3709,"PERNIAGAAN KPM MOHAMAD"
613,1,2.196983,102.249403,135.3777,"HOCK SENG (MALACCA) TRADING SDN BHD"
614,1,2.1952995,102.248807,135.4785,"STAR KRIS TRADING SDN BHD"
615,1,2.206902,102.262782,135.5021,"TAI GUAN CHAN SDN BHD - RECEIVING 9AM - 3:30PM"
616,1,3.934803899,102.3819548,135.5894,"ECONSAVE CASH & CARRY (BM) SDN. BHD.- JERANTUT"
617,1,2.198778,102.255933,135.6933,"GAN HUP HUAT SDN BHD"
618,1,2.5868531,102.5605831,135.7720,"PASAR MINI YAKIN MAJU - PEKAN PASIR BESAR"
619,1,2.2433159,102.3140411,136.3380,"PASAR MINI MADINAH (FRI OFF)"
620,1,2.18642736,102.2504714,136.3543,"FIRST ORCHID SDN BHD (MAHKOTA HOTEL MELAKA)"
621,1,2.2423793,102.313382,136.3627,"TIGA TIGA LAPAN MINI MARKET"
622,1,2.1881789,102.2527341,136.3657,"XING HONG KI RESTAURANT (Monday to Saturday 11am-9pm)"
623,1,2.191554055,102.2605726,136.6394,"GARDENS FRESH MARKET (SMALL LORRY)"
624,1,2.2223258,102.2996632,136.9477,"YEONG LONG"
625,1,2.585941,102.573108,137.0644,"JATI FROZEN SDN BHD (GEMAS BRANCH) (OPEN 9 AM - 8:30 PM)"
626,1,2.183472861,102.2608145,137.3435,"EAT REAL ENTERPRISE - LUTAN 21 (Open 8am|Receiving: Prefer in morning)"
627,1,2.187853,102.26679,137.4002,"NEW DIAN HUAT ENTERPRISE (Tue close)"
628,1,2.1874931,102.2677525,137.5000,"SUKARIA SELECTION (M) SDN BHD"
629,1,4.321857,101.136288,137.5766,"HOCK KIM BEE SDN. BHD."
630,1,3.782717222,102.5201301,137.8328,"MUIP SUPERMARKET TEMERLOH SDN BHD (BANDAR TUN RAZAK JENGKA)"
631,1,2.226727592,102.317883,137.9692,"BISMI NETWORKS"
632,1,2.1910791,102.2792256,138.0281,"ONE ONE RETAIL ENTERPRISE (Deliver after 11.30AM)"
633,1,4.0534234,100.6304048,138.3790,"KEDAI RUNCIT LOGASWARY"
634,1,2.589383,102.588734,138.4581,"PASARAYA G-MART SDN BHD"
635,1,2.319691,102.413697,138.5530,"KESAVAN A/L GUNASEKAREN (PASAR MINI KESAVAN)"
636,1,2.2377456,102.3446832,139.1542,"SOON ONG"
637,1,2.5855542,102.5951649,139.2864,"SOLFAZ SDN. BHD. - AL ZIYA FATHIMA RESTORAN"
638,1,3.772896291,102.5437491,139.5036,"MYDIN MOHAMED HOLDINGS BERHAD - JENGKA HYPERMARKET ( FRIDAY HOLIDAY )"
639,1,2.190469,102.300023,139.6031,"BERKAT GLOBAL MAKMUR ENTERPRISE (PLS CALL B4 DELIVER)"
640,1,2.280553,102.3918187,139.6181,"MYDIN MOHAMED HOLDINGS BERHAD - JSH"
641,1,2.582941,102.602409,140.1375,"JATI FROZEN SDN BHD (PD - JLN RAJA AMAN SHAH BRANCH) Open 6am - 2pm"
642,1,2.287328,102.405298,140.2214,"JASIN POINT"
643,1,2.295592477,102.4194626,140.7902,"KWANG CHEONG (M) SDN BHD (Monday to Friday - 9am-4pm)"
644,1,3.772145267,102.5721571,142.1768,"ECONSAVE CASH & CARRY (JK) SDN. BHD."
645,1,2.165529,102.320288,143.1720,"CHOP PENG SENG"
646,1,2.1612237,102.3216632,143.6317,"WARISAN URAZ"
647,1,3.9911569,100.4979515,143.9207,"MURUGAN STORE"
648,1,4.1936839,100.6997864,145.7063,"KEDAI ING ANG TONG"
649,1,4.1948213,100.7011338,145.7220,"PASAR MINI KAMPUNG KOH"
650,1,2.345739396,102.524503,146.3850,"TANGKAK BEE HONG ENTERPRISE SDN BHD (Monday to Friday -  8:30am-5.00pm)"
651,1,4.2170092,100.6970882,147.9931,"FOOK LYE SON TRADING"
652,1,4.2156413,100.6848573,148.6552,"MEGA MUHIBBAH ENTERPRISE"
653,1,2.144482,102.373431,148.8674,"ABM FOOD INDUSTRY (CALL BEFORE DELIVER)"
654,1,2.1583464,102.3973861,149.5670,"RIZA RICH FOOD INDUSTRIES (FRIDAY 12PM - 3PM OFF)"
655,1,2.1673378,102.432371,151.5761,"PASARAYA ONE FAMILY (MERLIMAU)"
656,1,4.2118217,100.5629408,156.5935,"KEDAI BARANG2 RUNCIT GUAN SANG"
657,1,4.2197533,100.5409691,158.8355,"GUAN SENG"
658,1,3.594852572,102.829885,160.1104,"MUIP SUPERMARKET GROUP SDN BHD - PDM MART MARAN"
659,1,2.549331816,102.7914542,160.7828,"METRO EMPIRE SDN. BHD. - RESTORAN AL MASYUR"
660,1,2.199784341,102.6058914,163.4913,"PASAR MINI SIANG HOCK"
661,1,2.172082,102.596017,164.6177,"PASAR MINI AL NIYAZ"
662,1,2.170657,102.595328,164.6618,"GREEN APPLE STORE (SG. MATI) SDN. BHD."
663,1,2.189339,102.620761,165.5058,"CHONG KIAW TRADING COMPANY (SATURDAY NO DELIVERY)"
664,1,3.378511246,102.9380768,165.8622,"ANJUNG SATU ENTERPRISE (Inform sales person for confirmation before delivery)"
665,1,4.5588398,101.0287957,166.2066,"MYDIN MOHAMED HOLDINGS BHD - TAMAN GOPENG"
666,1,2.503588395,102.8259477,166.3631,"ECONSAVE CASH & CARRY (SG) SDN BHD"
667,1,2.212933184,102.6513516,166.5365,"ECONSAVE CASH & CARRY (GB) SDN BHD-SAT OFF"
668,1,2.185887,102.630707,166.6055,"LAKBA ENTERPRISE *-FRIDAY CLOSE"
669,1,3.379330959,102.9507857,167.2684,"D FALAH ENTERPRISE"
670,1,2.08462672,102.5891308,170.5059,"GREEN APPLE STORE (MUAR) SDN BHD (10am-5.30pm Mon-Fri)"
671,1,2.056636615,102.5647206,170.6907,"MCD MARKETERS SDN BHD"
672,1,2.498196531,102.8674594,170.8079,"BIG 10 GROCER (SEGAMAT) SDN BHD"
673,1,2.049499774,102.5731223,171.9131,"JT TRADING SDN BHD (855251-H)  (MUAR)"
674,1,4.6236121,101.0666287,171.9826,"MYDIN MANJOI HYPERMARKET"
675,1,2.070783787,102.642238,175.8980,"ECONSAVE CASH & CARRY (MU) SDN BHD"
676,1,4.6714118,101.0729717,176.9498,"MYDIN MOHAMED HOLDINGS BERHAD - -MRH"
677,1,1.999195299,102.5955496,177.6180,"LEANG SENG TRADING"
678,1,4.6951252,101.0988369,178.8330,"HAROLDS BREAD (FACTORY) SDN BHD - CHEMOR"
679,1,2.041680701,102.6564027,179.2384,"ARAKHAN RAHAMAT SDN BHD"
680,1,3.054452896,103.0873698,180.3157,"PASARAYA GEMILANG MUADZAM SDN BHD"
681,1,4.717982,101.1209591,180.7748,"HOCK HUAT"
682,1,4.7185385,101.1213573,180.8260,"CHOP WENG SENG"
683,1,1.957535214,102.6445849,184.7474,"HENG HENG HONG KEE SDN BHD (DELIVERY 8.30AM-5.30PM)"
684,1,1.957631717,102.6450248,184.7744,"HENG HENG (M) SDN BHD (DEL : 8.30am - 5.30pm)"
685,1,2.094347872,102.7858315,186.4285,"ECONSAVE CASH & CARRY (BKR) SDN BHD"
686,1,3.652004474,103.0839221,188.8691,"LEPAR HILIR TRADING ( FRIDAY HOLIDAY )"
687,1,3.745457867,103.1695574,201.2243,"SBP MAJU SDN BHD"
688,1,3.763513501,103.1993558,205.0176,"H&Y WHOLESALE TRADING"
689,1,3.755955639,103.2022689,205.0346,"PASAR MINI DING YI - 9am open. Close 7pm"
690,1,3.769790035,103.2473429,210.2613,"ENG HONG (JLN. GAMBANG) SDN BHD (Sunday delivery need to inform Mr Goh)"
691,1,3.769185986,103.2477537,210.2815,"BIG 10 GROCER (GAMBANG) SDN BHD"
692,1,3.771202135,103.2559684,211.2151,"PANTAI SELAMAT VALUE MART SDN BHD"
693,1,3.759736778,103.2624028,211.4622,"SYARIKAT PERNIAGAAN HAP SOON LEE ( 11AM- 8PM )"
694,1,3.863638866,103.2448154,213.7548,"CHOP SENG FONG -  9am to 5pm delivery everyday. Monday to sunday"
695,1,3.762586399,103.2833456,213.7604,"SEKOLAH MENENGAH CHONG HWA KUANTAN"
696,1,3.863809081,103.2504871,214.3439,"KA LONG MINI MARKET"
697,1,3.82828927,103.2754028,215.4496,"OONG HIING ENTERPRISE"
698,1,3.831459028,103.2745832,215.4920,"THEONG HIN ENTERPRISE ( CALL BEFORE SEND )"
699,1,3.731242367,103.324526,216.9832,"CUMI MAJU ENTERPRISE (FRI 12-3PM CLOSE)"
700,1,2.010622232,103.0671934,217.1010,"ECONSAVE CASH & CARRY (YP) SDN BHD"
701,1,3.803536521,103.3019198,217.2337,"YUYI MINI MARKET (Receiving 11am to 6 pm)"
702,1,3.806020794,103.3034081,217.4839,"MUIP SUPERMARKET GROUP SDN BHD - PDM MART SETONGKOL"
703,1,3.791768451,103.3107151,217.7048,"GCH RETAIL (MALAYSIA) SDN BHD- (KUANTAN) SUPERSTORE FRIDAY HOLIDAY"
704,1,3.491915511,103.3938371,217.8793,"SYARIKAT PERNIAGAAN MOOI LONG - Mon to sat 8.30 to 5.30 delivery"
705,1,3.489678649,103.3954852,218.0135,"MYDIN MOHAMED HOLDINGS BERHAD - PEKAN EMPORIUM"
706,1,3.808904058,103.3097612,218.2562,"PERNIAGAAN DAGANG SAHIHAN SDN BHD"
707,1,3.800547817,103.3141946,218.3992,"HIN HIN MINI MARKET"
708,1,3.541521817,103.3942997,219.0132,"GEDUNG ENG HONG (PEKAN) SDN BHD"
709,1,3.808226868,103.3187438,219.1658,"KAFE KAMPUNG TENGAH"
710,1,3.807930584,103.3233654,219.6361,"RESTORAN PING XIANG"
711,1,3.811219109,103.3225185,219.6735,"KEDAI RUNCIT HOCK JOO"
712,1,3.808958963,103.323537,219.6932,"ASD SUNMOON SDN BHD"
713,1,3.811229883,103.3256137,219.9963,"MYDIN MOHAMED HOLDINGS BERHAD - KUANTAN EMPORIUM"
714,1,3.805725763,103.3285147,220.0891,"V AQUARIUM"
715,1,3.816303343,103.3321029,220.8666,"GCH RETAIL (MALAYSIA) SDN BHD- KUANTAN MEGAMALL SUPERMARKET FRIDAY HOLIDAY"
716,1,3.83246032,103.3283805,221.1066,"PASAR MINI SETALI"
717,1,3.830747889,103.3293359,221.1387,"OI FOOD SUPPLY SDN BHD (SAT CLOSE)"
718,1,3.826135304,103.3373058,221.7872,"RESTORAN NASI KANDAR KUALITI"
719,1,3.831780669,103.3364068,221.9134,"STAR BBQ RESTAURANT"
720,1,3.832287293,103.3366871,221.9623,"RESTORAN TONG SENG BARU DUA"
721,1,3.847332857,103.3314838,222.0168,"EJH FOOD INDUSTRIES SDN BHD"
722,1,3.846365747,103.3319114,222.0226,"KILANG MAKANAN MOI KEE SDN BHD"
723,1,3.849593284,103.3317922,222.1391,"KAZIMI FOOD INDUSTRIES SDN BHD (MON TO SAT) (12PM-2PM CLOSE FOR LUNCH)"
724,1,3.854138997,103.3302237,222.1592,"THOMYAM FOOD INDUSTERIES SDN BHD"
725,1,3.854507697,103.3306926,222.2226,"MAH TONG HUAT FOOD INDUSTRIES SDN BHD"
726,1,3.838983377,103.3369802,222.2555,"KAKAK KEMAMAN KOPITIAN (KEMAMAN KOPITIAM)"
727,1,3.834949468,103.3406636,222.4794,"ONE PLUS ONE BOUTIQUE RESIDENCE"
728,1,3.840439572,103.3494393,223.6057,"ISLAND FRIENDS CAFE (ISLAND TWO CAFE)"
729,1,3.880115789,103.337988,224.0206,"PASARAYA MEGA JAYA MAJU-OPEN 11AM"
730,1,3.98938,99.6270963,225.3063,"KENG LEONG ENTERPRISE"
731,1,3.830996984,103.3732004,225.7100,"CHING MAJU TRADING"
732,1,3.533299463,103.4599642,225.9630,"CHOP YAP HENG"
733,1,3.858686949,103.3654341,225.9857,"MUIP SUPERMARKET GROUP SDN BHD - PDM MART BESERAH"
734,1,3.863246581,103.3656074,226.1857,"PASAR MINI DAGANG SAHIHAN SDN BHD - Monday to saturday 9.30am to 4pm"
735,1,3.869020106,103.3672746,226.5900,"HOTEL MANDURAH SDN BHD"
736,1,3.936692891,103.3762835,230.3432,"ENG HONG MART (SG. KARANG) SDN BHD"
737,1,2.028017108,103.2998541,237.7427,"GIANT SUPERMARKET SRI KLUANG"
738,1,2.018523739,103.302359,238.5265,"GIANT SUPERMARKET KLUANG"
739,1,2.035792878,103.3328342,240.4518,"ECONSAVE CASH & CARRY (KLU) SDN BHD"
740,1,3.868483311,103.526598,243.1299,"SYARIKAT ENG HONG SDN BHD (Mon-Sat 9am-12pm,2pm-5pm) (Sun & PH Off)"
741,1,4.227150989,103.4178872,248.7319,"PERNIAGAAN Y K GEMILANG (FRIDAY CLOSE)"
742,1,4.237819171,103.4124729,248.7933,"ENG HOE MINI MARKET - Friday close"
743,1,4.226135387,103.4286789,249.7208,"PERNIAGAAN CLS - Friday close"
744,1,4.228632789,103.428473,249.8363,"ROKMAN GIGIH TRADING (CLOSE - 5PM)"
745,1,1.837135997,103.3071026,250.0060,"ECONSAVE CASH & CARRY (SR) SDN BHD"
746,1,4.229969213,103.4305115,250.1062,"A 1 SYUKUR ENTERPRISE - 8am to 7pm delievery"
747,1,4.250584969,103.4322024,251.3969,"PASARAYA SAMAMAJU (K) SDN BHD (CALL SALESMAN BEFORE SEND)"
748,1,5.208998766,100.5137138,254.2224,"ECONSAVE CASH & CARRY (JW) SDN BHD"
749,1,4.336747889,103.4558434,258.5135,"GCH RETAIL (MALAYSIA) SDN BHD- KIJAL SUPERSTORE FRIDAY HOLIDAY"
750,1,4.440724838,103.4484423,264.0081,"GCH RETAIL (MALAYSIA) SDN BHD-(MESRA MALL) *FRIDAY HOLIDAY"
751,1,4.488021018,103.4412454,266.2868,"LUCKY MART KERTEH SDN BHD (CALL SALESMAN BEFORE SEND)"
752,1,4.501463719,103.4428081,267.2788,"CAFILA CAFE"
753,1,5.311480867,100.4348473,268.2358,"PELITA SAMUDERA PERTAMA (M) SDN. BHD."
754,1,5.336695959,100.4663038,269.3213,"Econsave Cash & Carry (BM) Sdn Bhd"
755,1,5.385368961,100.5470494,270.7708,"GIANT SUPERSTORE KULIM"
756,1,5.368378776,100.4145905,274.9155,"MYDIN BUKIT MERTAJAM HYPERMARKET"
757,1,4.630477515,103.4385286,275.3304,"U SENG MINI MARKET & STORE (FRIDAY CLOSE)"
758,1,5.321337847,100.2849107,276.6922,"GIANT HYPERMARKET BAYAN BARU"
759,1,5.335022935,100.3000317,277.2480,"IMAN IKHLAS (M) SDN BHD - BJH"
760,1,5.335630403,100.294844,277.5762,"IMAN IKHLAS (M) SDN BHD - BTH"
761,1,5.398833857,100.3980271,278.7601,"SAM'S GROCERIA SDN BHD - SUNWAY CARNIVAL MALL"
762,1,1.681777662,103.52479,279.7340,"ENG HAN ENTERPRISE"
763,1,5.399154101,100.3765135,279.8131,"Econsave Cash & Carry (BW) Sdn Bhd"
764,1,5.401283529,100.3800901,279.8559,"ECONSAVE CASH & CARRY (RU) SDN BHD"
765,1,5.413271495,100.3968545,280.2690,"UNITED MALAYAN FLOUR (1996) SDN BHD"
766,1,4.7567618,103.4087183,281.5114,"PASARAYA SAMAMAJU (D) SDN BHD (CALL SALESMAN BEFORE SEND)"
767,1,4.755307706,103.4123641,281.7175,"CHOP CHOON BEE - Friday close."
768,1,1.479623204,103.3980593,282.4033,"ECONSAVE CASH & CARRY (PT) SDN BHD"
769,1,1.469431938,103.3924413,282.6679,"GIANT SUPERMARKET PONTIAN COMM"
770,1,4.766536813,103.4199939,283.1671,"DONA TRADING SDN BHD - Friday close"
771,1,5.416230204,100.340718,283.2510,"PODIRECT TRADING (M) SDN BHD"
772,1,4.762213593,103.4250843,283.2918,"POK ENG TIN ENTERPRISE SDN BHD"
773,1,5.385861072,100.2767723,283.4496,"ECONSAVE CASH & CARRY (NTH) SDN BHD"
774,1,5.421559232,100.341078,283.7654,"IMAN IKHLAS (M) SDN BHD - MEP"
775,1,4.778047101,103.4244486,284.3682,"THAM KOK SIONG BROTHERS TRADING (FRIDAY CLOSE)"
776,1,5.42168565,100.3259629,284.5181,"GIANT SUPERSTORE (PENANG PLZ)"
777,1,5.406014205,100.2870412,284.9109,"CHAI MUN MENG"
778,1,1.65671222,103.5705753,285.5002,"SUPREME HEALTHY VEGETARIAN FODDS"
779,1,1.658222842,103.5784323,286.1196,"ECONSAVE CASH & CARRY (TPK) SDN BHD *"
780,1,5.488327886,100.426365,286.5212,"SRI BERTAMAS JAYA SDN BHD"
781,1,1.663148434,103.5976183,287.5601,"MYDIN MOHAMED HOLDINGS BERHAD - KUH"
782,1,5.450526057,100.3077216,288.2886,"IMAN IKHLAS (M) SDN BHD - SQY"
783,1,5.458194977,100.3134158,288.7724,"SAM'S GROCERIA SDN BHD - STRAITS QUAY"
784,1,1.669110517,103.6339115,290.5196,"REZEKI MINIMART"
785,1,5.53441438,100.4249269,291.2825,"KEPALA BATAS BIHUN SDN BHD"
786,1,1.647451113,103.6280451,291.3357,"GIANT SUPERMARKET KULAI IOI"
787,1,1.567055869,103.6127313,295.1099,"ECONSAVE CASH & CARRY (KM) SDN BHD"
788,1,5.622855301,100.5409963,295.6337,"Econsave Cash & Carry (BPJ) Sdn Bhd"
789,1,1.52470633,103.5929995,296.1552,"ECONSAVE CASH & CARRY (JEB) SDN BHD"
790,1,1.612141141,103.6572144,296.2342,"ECONSAVE CASH & CARRY (SN) SDN BHD"
791,1,5.632823081,100.5385757,296.7661,"IMAN IKHLAS (M) SDN BHD - TBH"
792,1,1.54642842,103.6226836,297.3574,"GIANT HYPERMARKET PULAI UTAMA"
793,1,5.616529778,100.4730315,297.6749,"GIANT HYPERMARKET SUNGAI PETANI"
794,1,5.632452908,100.4904468,298.6165,"Econsave Cash & Carry (TPJ) Sdn Bhd"
795,1,1.594476169,103.6848573,299.8784,"SLH TUTA (M) MARKETING SDN BHD"
796,1,1.542263614,103.6552624,300.5546,"ECONSAVE CASH & CARRY (SK) SDN BHD"
797,1,1.515220223,103.6359001,300.6026,"MYDIN MUTIARA RINI HYPERMARKET"
798,1,1.532826294,103.6766708,303.0972,"NUR SAMI ENTERPRISE"
799,1,5.311063385,103.1284257,304.7871,"GCH RETAIL (MALAYSIA) SDN BHD- KUALA TERENGGANU HYPERMARKET FRIDAY HOLIDAY"
800,1,5.28483531,103.1665878,305.0714,"MYDIN MOHAMED HOLDING BHD - KUALA IBAI EMPORIUM-OPEN 10AM"
801,1,1.424274158,103.6181293,305.2017,"MYDIN MOHAMED HOLDINGS BERHAD - BAZAAR ANJUNG NUSAJAYA"
802,1,1.579532444,103.7332711,305.2527,"YTC ENTERPRISE & TRANSPORT AGENCY SDN BHD"
803,1,1.483600972,103.6655674,305.3488,"GIANT HYPERMARKET NUSA BESTARI"
804,1,1.496728022,103.6816063,305.9083,"GIANT SUPERMARKET PERLING MALL"
805,1,5.355386053,103.09384,306.4460,"MYDIN GONG BADAK HYPERMARKET FRIDAY HOLIDAY"
806,1,5.351013783,103.1017863,306.5745,"GCH RETAIL (MALAYSIA) SDN BHD- GONG BADAK SUPERSTORE FRIDAY HOLIDAY"
807,1,5.310178702,103.1571132,306.6448,"ANGKARAMA SDN BHD"
808,1,5.331701441,103.1398684,307.3805,"EMPORIUM HOCK KEE SENG SDN BHD"
809,1,1.499626726,103.7009418,307.4500,"GCH RETAIL (MALAYSIA) SDN BHD-TAMPOI"
810,1,5.335117336,103.1372327,307.5067,"MYDIN MOHAMED HOLDINGS BERHAD - KTH *   ( FRIDAY HOLIDAY )"
811,1,5.336548776,103.1420178,307.9536,"MYDIN MOHAMED HOLDING BHD - TERENGGANU EMPORIUM"
812,1,1.498719877,103.7109216,308.4059,"EDARAN S.A. AL HABSHEE SDN BHD - WARDA MART"
813,1,1.545156597,103.7615954,310.0131,"ECONSAVE CASH & CARRY (TD) SDN BHD"
814,1,1.672093864,103.8511859,310.6579,"STOR TAWAKAL SDN BHD"
815,1,1.525020024,103.7631201,311.4307,"BUNEER PAK ENTERPRISE"
816,1,5.734949771,102.4976912,311.5678,"GCH RETAIL (MALAYSIA) SDN BHD - GIANT SUPERSTORE JERTEH *FRIDAY HOLIDAY"
817,1,1.608761718,103.821449,311.6115,"GIANT SUPERMARKET ULU TIRAM"
818,1,1.718422103,103.8956198,312.2580,"ECONSAVE CASH & CARRY (DJ) SDN BHD"
819,1,5.356489881,103.1800292,312.2710,"ECONSAVE CASH & CARRY (EC) SDN BHD"
820,1,1.533652373,103.7808827,312.5041,"TBR BERAS ENTERPRISE"
821,1,1.576170631,103.8097343,312.5087,"MYDIN MOHAMED HOLDING BHD - PELANGI INDAH"
822,1,1.507547642,103.7706903,313.2358,"GCH RETAIL (MALAYSIA) SDN BHD-SOUTHERN CITY"
823,1,1.541305661,103.8023795,313.9935,"MING JII RESTAURANT SDN. BHD."
824,1,1.487946606,103.7831238,315.6227,"GIANT HYPERMARKET (L/MALL JB)"
825,1,1.528217974,103.8151091,315.9824,"GCH RETAIL (MALAYSIA) SDN BHD- GIANT HYPERMARKET ( PLENTONG JB )"
