cluster_id,sequence_order,store_name,lat,lon,tonnage,haversine_dist_km,haversine_cumulative_km,road_dist_km,cumulative_dist_km,drive_min_no_traffic,drive_min_with_traffic,delay_min,fuel_liters_leg,cumulative_fuel_liters,return_dist_km,weather,temp_c
8,26,"SINTAK KEE FOODS TRADING",3.039787,101.749066,"47",28.20,47.69,6.09,83.29,15,17,2,2.13,29.15,,"Scattered clouds. Extremely hot.",34.00
8,27,"MTK MART (Open 6am-3.30pm)",3.027616,101.747958,"52",29.01,49.05,8.43,91.72,13,16,2,2.95,32.10,,"Scattered clouds. Extremely hot.",34.00
8,28,"MANJUMA TRADING (Fri: Close during prayer)",3.027694,101.747156,"53",28.94,49.14,0.09,91.81,0,0,0,0.03,32.13,,"Scattered clouds. Extremely hot.",34.00
8,29,"A S M FAHIM HOLDINGS SDN BHD (Fri: 1pm-3pm rest)",3.024007,101.748703,"82",29.35,49.58,2.33,94.14,4,4,0,0.82,32.95,,"Scattered clouds. Extremely hot.",34.00
8,30,"K 1 TOP ENTERPRISE (Fri: 12.30pm-2.30pm close)",3.024029,101.749812,"54",29.44,49.71,0.41,94.55,1,1,0,0.14,33.09,,"Scattered clouds. Extremely hot.",34.00
8,31,"RAISHA MAJU TRADING (Fri: 1pm-3pm rest)",3.02444,101.750149,"49",29.43,49.77,0.38,94.93,1,1,0,0.13,33.23,41.36,"Scattered clouds. Extremely hot.",34.00
9,1,"MAMARAJ MINI MARKET (Mon-Sat: 9am-5.30pm|Fri: No delivery)",3.045206,101.602822,"53",18.53,18.53,26.37,26.37,29,35,6,9.23,9.23,,"Scattered clouds. Extremely hot.",34.00
9,2,"FS NUSANTARA MART (Friday: 12pm-3pm close)",3.035008,101.593601,"56",19.38,20.05,2.78,29.15,7,10,3,0.97,10.20,,"Scattered clouds. Extremely hot.",34.00
9,3,"GAJA STORE PLT (Mon-Sat: 9am-7pm)",2.995582,101.621139,"56",24.40,25.40,9.75,38.90,14,18,4,3.41,13.62,,"Scattered clouds. Extremely hot.",34.00
9,4,"PASAR SEGAR ARIFFIN ARAFAT (Mon-Sat: 9am-6pm)",2.989558,101.638945,"50",25.67,27.49,4.19,43.09,7,8,2,1.47,15.08,,"Scattered clouds. Extremely hot.",34.00
9,5,"JW GLOBAL JAYA TRADING",2.974097,101.6074419,"54",26.32,31.38,9.46,52.55,16,18,2,3.31,18.39,,"Scattered clouds. Extremely hot.",34.00
9,6,"PASARAYA JUST RIGHT SDN BHD",3.00698,101.709171,"50",27.81,43.26,23.73,76.28,27,31,5,8.31,26.70,,"Scattered clouds. Extremely hot.",34.00
9,7,"WIGNES MINI MARKET SDN BHD.",3.009313,101.710221,"46",27.67,43.54,0.89,77.17,2,3,0,0.31,27.01,,"Scattered clouds. Extremely hot.",34.00
9,8,"HASIL LAUT SEONG KEE SDN BHD - SERI KEMBANGAN",3.017334,101.712136,"55",27.11,44.46,1.78,78.95,3,4,1,0.62,27.63,,"Scattered clouds. Extremely hot.",34.00
9,9,"CHAW ENTERPRISE (SJK (C) KUNG MAN) - (Mon to Fri - After 2pm) (4pm Close)",3.015506777,101.7211052,"89",27.91,45.48,5.14,84.09,10,14,4,1.80,29.43,,"Scattered clouds. Extremely hot.",34.00
9,10,"B CART TRADING",3.026672,101.724401,"97",27.23,46.77,8.40,92.49,10,11,2,2.94,32.37,,"Scattered clouds. Extremely hot.",34.00
9,11,"PASAR MINI UMA",3.028052,101.726036,"50",27.25,47.01,1.33,93.82,2,2,0,0.47,32.84,,"Scattered clouds. Extremely hot.",34.00
9,12,"PASAR MINI BERKAT BONDA (Mon-Sat: 9.30am-6pm|Fri:12pm-3pm)",3.027898,101.722515,"51",26.99,47.40,1.42,95.24,3,4,0,0.50,33.33,,"Scattered clouds. Extremely hot.",34.00
9,13,"NYS FOOD MART SDN BHD - BALAKONG",3.024932,101.732613,"51",28.00,48.57,1.66,96.90,3,3,0,0.58,33.91,,"Scattered clouds. Extremely hot.",34.00
9,14,"PEMBORONG BARANG RUNCIT SOON SHENG",3.018567,101.734572,"49",28.66,49.31,2.23,99.13,7,7,0,0.78,34.70,40.61,"Scattered clouds. Extremely hot.",34.00
10,1,"CHAMPION FOOD SDN. BHD. (open 9am - 2pm)",3.132408666,101.7111244,"40",18.97,18.97,25.85,25.85,30,38,7,9.05,9.05,,"Scattered clouds. Extremely hot.",34.00
10,2,"AMAN RAHIM ENTERPRISE",3.073115126,101.7185008,"49",23.22,25.62,10.31,36.16,14,17,3,3.61,12.66,,"Scattered clouds. Extremely hot.",34.00
10,3,"MAKANAN LAUT YOKE HENG (Monday close|Delivery time: 8am-11.30am)",3.046177,101.703246,"53",24.05,29.06,6.33,42.49,10,12,2,2.22,14.87,,"Scattered clouds. Extremely hot.",34.00
10,4,"GURUNG MARKETING",3.023968,101.741204,"56",28.75,33.94,7.26,49.75,11,14,3,2.54,17.41,,"Scattered clouds. Extremely hot.",34.00
10,5,"ALTA JAYA ENTERPRISE",3.01451,101.754604,"66",30.55,35.77,4.98,54.73,9,10,1,1.74,19.16,,"Scattered clouds. Extremely hot.",34.00
10,6,"SUPER SEVEN (M) SDN BHD - CHERAS JAYA",3.021717,101.765476,"47",30.90,37.22,9.37,64.10,15,16,1,3.28,22.43,,"Scattered clouds. Extremely hot.",34.00
10,7,"WAI LUN ENTERPRISE",3.038294,101.767729,"46",29.91,39.08,4.12,68.22,6,7,1,1.44,23.88,,"Scattered clouds. Extremely hot.",34.00
10,8,"SUPER SEVEN CASH & CARRY SDN BHD - BALAKONG",3.03882,101.769435,"47",30.02,39.27,0.35,68.57,1,2,0,0.12,24.00,,"Scattered clouds. Extremely hot.",34.00
10,9,"BONKEE YUAN TRADING SDN. BHD. - PASAR RAYA SEGAR FRESH BOULEVARD",3.038428,101.770019,"51",30.10,39.35,0.10,68.67,1,1,0,0.03,24.03,,"Scattered clouds. Extremely hot.",34.00
10,10,"MYS BORONG MART",3.04488,101.773084,"52",29.93,40.15,0.97,69.64,3,3,1,0.34,24.37,,"Scattered clouds. Extremely hot.",34.00
10,11,"WAN SHENG MINI MARKET (Tue: Close|Delivery after 11.30am)",3.045525,101.772506,"46",29.84,40.24,0.14,69.78,0,0,0,0.05,24.42,,"Scattered clouds. Extremely hot.",34.00
10,12,"MH WORLD SOLUTIONS SDN. BHD. (Fri: 1pm-3pm close)",3.051661,101.7753,"53",29.69,40.99,1.96,71.74,5,6,1,0.69,25.11,,"Scattered clouds. Extremely hot.",34.00
10,13,"YUANS F&B SDN BHD (WEDNESDAY CLOSE)",3.054418,101.788344,"46",30.72,42.47,2.43,74.17,5,6,1,0.85,25.96,,"Scattered clouds. Extremely hot.",34.00
10,14,"SYARIKAT NG KEONG DAN ANAK-ANAK",3.028612,101.805897,"47",33.94,45.94,14.33,88.50,16,17,0,5.02,30.97,,"Scattered clouds. Extremely hot.",34.00
10,15,"JT TRADING SDN BHD (855251-H) (KAJANG)",2.999403,101.785137,"54",34.18,49.92,8.99,97.49,10,12,2,3.15,34.12,52.31,"Scattered clouds. Extremely hot.",34.00
11,1,"KOPITIAM SIN LAI KEE (9am-4pm)",3.192175,101.314981,"53",26.86,26.86,50.40,50.40,47,57,10,17.64,17.64,,"Scattered clouds. Extremely hot.",34.00
11,2,"CB FROZEN FOOD SDN. BHD. - SUNGAI BULOH (Monday-Saturday: 8am-5pm)",3.2105831,101.2785965,"62",30.87,31.39,3.38,53.78,7,7,0,1.18,18.82,,"Scattered clouds. Extremely hot.",34.00
11,3,"CB WHOLESALE MART SDN BHD - SUNGAI BULOH",3.2105831,101.2785965,"31",30.87,31.39,0.00,53.78,0,0,0,0.00,18.82,,"Scattered clouds. Extremely hot.",34.00
11,4,"RESTORAN SIDDIQ",3.2472475,101.2358762,"48",35.91,37.65,18.30,72.08,25,26,1,6.41,25.23,,"Scattered clouds. Extremely hot.",34.00
11,5,"PASARAYA HIJRAH (PELITA HIJRAH SDN BHD)",3.3027231,101.2459559,"50",36.15,43.92,7.56,79.64,15,15,1,2.65,27.87,42.80,"Scattered clouds. Extremely hot.",34.00
12,1,"RAMZAN MINI MARKET (Fri: Close 1pm-5pm)",3.080386,101.764632,"49",26.95,26.95,38.99,38.99,41,51,10,13.65,13.65,,"Scattered clouds. Extremely hot.",34.00
12,2,"PASARAYA ALAM JAYA SDN BHD",3.079911,101.764348,"50",26.95,27.01,0.08,39.07,1,1,0,0.03,13.67,,"Scattered clouds. Extremely hot.",34.00
12,3,"NEH LAH FRESH MARKET",3.004944,101.737784,"52",30.02,35.86,13.39,52.46,23,27,4,4.69,18.36,,"Scattered clouds. Extremely hot.",34.00
12,4,"KAY 9 ENTERPRISE",2.996747,101.75427,"54",31.93,37.90,4.47,56.93,12,12,0,1.56,19.93,,"Scattered clouds. Extremely hot.",34.00
12,5,"PASAR SEGAR SSV (RABU TUTUP)",2.998456,101.755537,"50",31.89,38.14,1.10,58.03,3,3,0,0.39,20.31,,"Scattered clouds. Extremely hot.",34.00
12,6,"HASIL LAUT SEONG KEE SDN BHD - BALAKONG JAYA",2.995897,101.756235,"55",32.15,38.43,2.23,60.26,6,6,0,0.78,21.09,,"Scattered clouds. Extremely hot.",34.00
12,7,"PERNIAGAAN XING FAI (FRIDAY OFF)",2.99464,101.756126,"49",32.24,38.57,0.50,60.76,1,1,0,0.17,21.27,,"Scattered clouds. Extremely hot.",34.00
12,8,"QXQY MANAGEMENT SDN. BHD.",2.992807,101.760437,"49",32.72,39.09,5.22,65.98,13,13,0,1.83,23.09,,"Scattered clouds. Extremely hot.",34.00
12,9,"PASAR FAMILY MART - NZ MAJESTIC PLT",2.980735,101.758214,"51",33.54,40.46,7.41,73.39,13,14,1,2.59,25.69,,"Overcast. Hot.",31.28
12,10,"NYS FOOD MART SDN BHD - KAJANG",2.982452,101.778964,"51",34.98,42.77,3.47,76.86,6,7,1,1.21,26.90,,"Overcast. Hot.",31.28
12,11,"RESTORAN HABEEB MAJU",2.955961,101.768493,"49",36.36,45.94,7.56,84.42,15,17,2,2.65,29.55,,"Overcast. Hot.",31.28
12,12,"HOCK MEI TRADING (SG. CHUA) SDN BHD",2.955156,101.768711,"55",36.45,46.03,0.05,84.47,0,0,0,0.02,29.56,,"Overcast. Hot.",31.28
12,13,"RESTORAN BANGI IMPIAN MAJU (LUTHFIA ALLIANCE SDN. BHD.)",2.955825,101.767651,"49",36.31,46.17,0.08,84.55,0,0,0,0.03,29.59,,"Overcast. Hot.",31.28
12,14,"HOCK MEI TRADING SDN BHD",2.953699,101.753766,"55",35.52,47.73,2.63,87.18,7,7,0,0.92,30.51,59.52,"Overcast. Hot.",31.28
13,1,"THIRTY THREE WALMART",3.385178767,101.7753856,"47",31.46,31.46,51.09,51.09,59,69,10,17.88,17.88,,"Scattered clouds. Extremely hot.",34.00
13,2,"GENTING GOLF COURSE BHD",3.396671266,101.7801231,"56",32.69,32.85,6.11,57.20,15,15,0,2.14,20.02,,"Scattered clouds. Extremely hot.",34.00
13,3,"GENTING MALAYSIA BERHAD",3.396671266,101.7801231,"56",32.69,32.85,0.00,57.20,0,0,0,0.00,20.02,,"Scattered clouds. Extremely hot.",34.00
13,4,"SURE WIN CLAYPOT SEAFOOD PORRIDGE SDN BHD (open 10am-3am)",3.398899596,101.7692864,"47",31.95,34.07,2.62,59.82,6,6,0,0.92,20.94,,"Scattered clouds. Extremely hot.",34.00
13,5,"SB GLORY SDN BHD",3.425583455,101.7933386,"48",35.93,38.06,9.84,69.66,22,22,0,3.44,24.38,,"Scattered clouds. Extremely hot.",34.00
13,6,"ION DELEMEN HOSPITALITY SDN BHD",3.434466307,101.7877331,"55",36.16,39.23,4.68,74.34,12,12,0,1.64,26.02,61.12,"Scattered clouds. Extremely hot.",34.00
14,1,"ZUHAIRINA FAMILY ENTERPRISE (Mon-Sat: 9am-6pm|Fri: No delivery)",2.962411,101.330055,"46",36.91,36.91,61.14,61.14,55,60,5,21.40,21.40,60.02,"Scattered clouds. Extremely hot.",34.00
15,1,"FROZEN KEN SDN. BHD.",2.991688,101.818101,"56",37.51,37.51,52.49,52.49,51,61,10,18.37,18.37,,"Overcast. Hot.",31.28
15,2,"RESTORAN URAT KETING",2.975536,101.809302,"48",37.95,39.56,7.37,59.86,9,9,0,2.58,20.95,,"Overcast. Hot.",31.28
15,3,"YS HYPER",2.972344,101.810053,"46",38.25,39.92,0.37,60.23,1,1,0,0.13,21.08,,"Overcast. Hot.",31.28
15,4,"MING TAI FOOD (M) SDN BHD (SEMENYIH)",2.944318,101.843327,"52",43.08,44.76,15.80,76.03,19,21,2,5.53,26.61,,"Overcast. Hot.",31.28
15,5,"SEMENYIH FROZEN FOOD MART",2.943634,101.843827,"48",43.17,44.85,0.26,76.29,1,1,0,0.09,26.70,,"Overcast. Hot.",31.28
15,6,"CLC WHOLESALER (SEMENYIH) SDN BHD",2.944514,101.844746,"80",43.18,44.99,0.22,76.51,1,1,0,0.08,26.78,,"Overcast. Hot.",31.28
15,7,"NYS FOOD MART SDN BHD - SEMENYIH",2.946046,101.845624,"51",43.14,45.19,0.44,76.95,2,2,0,0.15,26.93,,"Overcast. Hot.",31.28
15,8,"V.S.VARUSAI IBRAHIM & CO.",2.946268,101.845684,"46",43.13,45.21,0.03,76.98,0,0,0,0.01,26.94,,"Overcast. Hot.",31.28
15,9,"CHOP TOON CHOON THONG",2.946493,101.845751,"92",43.12,45.24,0.03,77.01,0,0,0,0.01,26.95,,"Overcast. Hot.",31.28
15,10,"PASAR MINI SRI RAAMA",2.946532,101.845759,"50",43.11,45.24,0.02,77.03,0,0,0,0.01,26.96,,"Overcast. Hot.",31.28
15,11,"BIRMIR CASH & CARRY",2.94739,101.845925,"70",43.06,45.34,0.10,77.13,1,1,0,0.03,27.00,65.66,"Overcast. Hot.",31.28
16,1,"BERKAT MADINA MART (Mon-Fri: 8am-5.30pm| Fri: 12pm-3pm rest| Sat: 4.30 pm close)",2.850165,101.650302,"87",40.84,40.84,61.95,61.95,59,68,9,21.68,21.68,,"Overcast. Hot.",31.28
16,2,"PASAR RAYA SAROJA UTAMA",2.8281921,101.7296673,"50",46.13,49.98,23.57,85.52,27,31,4,8.25,29.93,74.19,"Overcast. Hot.",31.28
17,1,"BAN BEE HUAT ENTERPRISE",2.81213,101.497758,"86",44.20,44.20,69.29,69.29,62,71,9,24.25,24.25,,"Overcast. Hot.",31.28
17,2,"KEDAI RUNCIT JHARSWIN  (Mon-Sat: 9am-6pm)",2.812952,101.486907,"54",44.31,45.41,2.64,71.93,5,6,1,0.92,25.18,71.39,"Overcast. Hot.",31.28
18,1,"PEMBORONG BARANG RUNCIT HUP SOON",2.854478,101.799272,"49",47.41,47.41,69.31,69.31,64,72,9,24.26,24.26,,"Overcast. Hot.",31.28
18,2,"BANG SHENG TRADING",2.85325,101.800804,"50",47.62,47.63,0.96,70.27,3,3,0,0.34,24.59,,"Overcast. Hot.",31.28
18,3,"RESTORAN KIM FONG N TIGA (Open: 7am-5pm|No delivery during lunch time)",2.857408,101.807033,"48",47.64,48.46,1.14,71.41,3,3,0,0.40,24.99,,"Overcast. Hot.",31.28
18,4,"FM COLLECTION SDN BHD",2.853037,101.812113,"56",48.37,49.21,1.18,72.59,3,3,0,0.41,25.41,,"Overcast. Hot.",31.28
18,5,"FOOD FARM SDN. BHD.",2.849691,101.813525,"56",48.76,49.61,1.55,74.14,5,5,0,0.54,25.95,79.15,"Overcast. Hot.",31.28
19,1,"NBK MAJU ENTERPRISE (M) SDN. BHD.",2.8147332,101.7347885,"52",47.72,47.72,68.61,68.61,63,74,12,24.01,24.01,,"Overcast. Hot.",31.28
19,2,"YI HONG CHUAN ENTERPRISE (hantar sebelum 9.30am)",2.811894,101.73719,"46",48.12,48.14,0.73,69.34,2,2,0,0.26,24.27,69.71,"Overcast. Hot.",31.28
20,1,"JIMAT BERANANG ENTERPRISE - BERANANG",2.9057,101.86448,"55",47.73,47.73,66.45,66.45,67,82,16,23.26,23.26,70.97,"Overcast. Hot.",31.28
21,1,"N NINE MINI MARKET",2.812944,101.762688,"52",49.27,49.27,71.61,71.61,64,77,12,25.06,25.06,74.41,"Overcast. Hot.",31.28
22,1,"PASAR MINI GNR - MANTIN",2.854344,101.840394,"51",50.16,50.16,75.30,75.30,71,84,13,26.35,26.35,81.06,"Overcast. Hot.",31.28
23,1,"SEMENYIH FOODMART SDN BHD",2.790236,101.749262,"48",50.87,50.87,70.54,70.54,63,75,12,24.69,24.69,71.55,"Overcast. Hot.",31.28
24,1,"1 BABA STORE SDN BHD",2.822197,101.817315,"20",51.51,51.51,70.66,70.66,65,74,9,24.73,24.73,75.64,"Overcast. Hot.",31.28
25,1,"CHUN MENG ENTERPRISE-DELIVER AFTER 12PM- SMALL LORRY (no red packing csr)",2.818956,101.813013,"70",51.54,51.54,70.93,70.93,65,74,10,24.83,24.83,77.03,"Overcast. Hot.",31.28
26,1,"BAIDURI BIJAKSANA SDN. BHD.",2.818299,101.814185,"96",51.67,51.67,70.78,70.78,65,74,10,24.77,24.77,77.20,"Overcast. Hot.",31.28
27,1,"CB FROZEN FOOD SDN BHD - NILAI BRANCH",2.818216,101.814241,"64",51.68,51.68,70.77,70.77,65,74,10,24.77,24.77,77.21,"Overcast. Hot.",31.28
28,1,"BUSY CORNER SDN BHD",2.810548,101.802492,"54",51.69,51.69,71.59,71.59,65,76,10,25.06,25.06,78.13,"Overcast. Hot.",31.28
29,1,"SEMARAK MART TRADING",2.818333,101.814914,"48",51.71,51.71,70.77,70.77,65,75,10,24.77,24.77,76.50,"Overcast. Hot.",31.28
30,1,"CT EXTRA STORES SDN BHD - DELIVERY B4 5PM & SAT OFF",2.817867,101.814519,"80",51.73,51.73,70.72,70.72,65,74,10,24.75,24.75,77.26,"Overcast. Hot.",31.28
31,1,"JINJANG LEE FROZEN SDN BHD",2.817905,101.814686,"55",51.74,51.74,71.88,71.88,66,76,10,25.16,25.16,76.43,"Overcast. Hot.",31.28
32,1,"HASIL LAUT SEONG KEE SDN. BHD. - NILAI",2.817414,101.814662,"55",51.78,51.78,70.69,70.69,64,74,10,24.74,24.74,77.33,"Overcast. Hot.",31.28
33,1,"KK EGGS TRADING SDN. BHD. - NILAI (Please call before delivery)",2.812987,101.808284,"53",51.81,51.81,71.67,71.67,65,75,10,25.08,25.08,77.42,"Overcast. Hot.",31.28
34,1,"CANDRIKAA CASH & CARRY (10AM-6PM)",2.81569,101.813293,"100",51.86,51.86,70.89,70.89,64,74,10,24.81,24.81,76.64,"Overcast. Hot.",31.28
35,1,"ANNACHI WHOLESALE CASH & CARRY (M) SDN. BHD.",2.815707,101.813339,"75",51.86,51.86,70.89,70.89,64,75,11,24.81,24.81,76.63,"Overcast. Hot.",31.28
36,1,"KINGSLEY FROZEN & GROCERIES (CALL BEFORE DELIVERY)",2.798922,101.791689,"53",52.19,52.19,74.48,74.48,70,81,11,26.07,26.07,76.17,"Overcast. Hot.",31.28
37,1,"RECRON (MALAYSIA) SDN BHD - NILAI GENERAL PLANT",2.814763,101.8176278,"49",52.21,52.21,71.86,71.86,67,77,10,25.15,25.15,77.68,"Overcast. Hot.",31.28
38,1,"YUZIE MINI MARKET",2.803548,101.80454,"46",52.48,52.48,73.00,73.00,67,78,11,25.55,25.55,78.77,"Overcast. Hot.",31.28
39,1,"MARWA STORE",2.80255,101.80972,"53",52.87,52.87,73.97,73.97,70,81,11,25.89,25.89,79.68,"Overcast. Hot.",31.28
40,1,"PASARAYA MILLENNIUM (MANTIN) SDN BHD(OFF FRI-SAT)",2.827368,101.88079,"50",55.33,55.33,79.26,79.26,74,89,15,27.74,27.74,78.68,"Overcast. Hot.",31.28
41,1,"VMAS MINI MARKET",2.82302,101.89265,"46",56.56,56.56,86.31,86.31,77,87,11,30.21,30.21,80.14,"Overcast. Hot.",31.28
42,1,"PATTANA TOMYAM SEAFOOD (Open 1pm-11pm|Wed close)",3.0382979,102.0702886,"49",59.98,59.98,85.00,85.00,89,101,12,29.75,29.75,85.47,"Overcast. Hot.",31.28
43,1,"KEDAI TONG HUAT",2.659987,101.561115,"54",60.64,60.64,97.82,97.82,90,102,12,34.24,34.24,95.52,"Scattered clouds. Hot.",33.00
44,1,"PASAR MINI BEE HENG",2.659424,101.565626,"51",60.71,60.71,98.09,98.09,89,102,12,34.33,34.33,95.83,"Scattered clouds. Hot.",33.00
45,1,"C S HUAT ENTERPRISE",2.656578,101.560182,"10",61.02,61.02,98.31,98.31,91,103,12,34.41,34.41,95.96,"Scattered clouds. Hot.",33.00
46,1,"KIM HOK HIN SDN BHD",2.690545,101.751322,"53",61.19,61.19,80.60,80.60,74,86,12,28.21,28.21,81.54,"Scattered clouds. Hot.",33.00
47,1,"CHOP CHEN HENG (open 10.30am)",2.69016,101.751236,"84",61.22,61.22,80.64,80.64,74,86,12,28.22,28.22,81.58,"Scattered clouds. Hot.",33.00
48,1,"TONG SOON CHIN (PJB TAK BOLEH MASUK)",2.6877022,101.7488175,"46",61.38,61.38,81.38,81.38,75,87,12,28.48,28.48,82.28,"Scattered clouds. Hot.",33.00
49,1,"SS HAPPY MART (WONG KONG WUI)",2.976721,102.060039,"47",61.41,61.41,94.28,94.28,99,111,12,33.00,33.00,94.75,"Overcast. Hot.",31.28
50,1,"YJK MINI MARKET",2.6850488,101.7496854,"46",61.70,61.70,81.19,81.19,74,86,12,28.42,28.42,82.67,"Scattered clouds. Hot.",33.00
51,1,"CHOP SHING LOONG",3.021308,102.081692,"37",61.79,61.79,87.38,87.38,91,103,12,30.58,30.58,87.85,"Overcast. Hot.",31.28
52,1,"VPS FAMILY H MART",2.949694,102.05491,"46",62.20,62.20,97.28,97.28,103,114,12,34.05,34.05,117.56,"Overcast. Hot.",31.28
53,1,"PASAR MINI SEONG HENG",2.949416,102.058253,"50",62.55,62.55,96.89,96.89,101,113,12,33.91,33.91,117.17,"Overcast. Hot.",31.28
54,1,"KEDAI RUNCIT YUNG SHIM",2.949202,102.058724,"54",62.60,62.60,96.87,96.87,101,113,12,33.90,33.90,117.15,"Overcast. Hot.",31.28
55,1,"LIM KEE MEI WEI TRADING",2.678614,101.759916,"53",62.77,62.77,82.50,82.50,75,88,13,28.87,28.87,83.41,"Scattered clouds. Hot.",33.00
56,1,"KEDAI RUNCIT NASHIRA - TIARA SENDAYAN",2.7016046,101.8206197,"54",63.22,63.22,84.85,84.85,79,91,12,29.70,29.70,85.78,"Scattered clouds. Hot.",33.00
57,1,"TQ BESTARI SDN BHD (FRIDAY 12.30PM-2.30PM OFF)",2.94377,102.064858,"46",63.49,63.49,117.33,117.33,107,122,15,41.07,41.07,116.19,"Overcast. Hot.",31.28
58,1,"NZ MAJESTIC PLT (Fri: 1pm-2pm close)",2.7011993,101.8308397,"51",63.79,63.79,86.12,86.12,80,92,13,30.14,30.14,87.11,"Scattered clouds. Hot.",33.00
59,1,"KEDAI RUNCIT NASHIRA - GADONG JAYA",2.7010358,101.8314265,"54",63.84,63.84,86.05,86.05,79,92,13,30.12,30.12,87.04,"Scattered clouds. Hot.",33.00
60,1,"BAN SING SUNDRY ENTERPRISE",2.939717,102.070984,"87",64.30,64.30,116.75,116.75,107,122,15,40.86,40.86,115.67,"Overcast. Hot.",31.28
61,1,"RESTORAN NOR FALAH (Open 7.30am-8pm)",2.9397397,102.0712292,"48",64.32,64.32,116.77,116.77,107,122,15,40.87,40.87,115.97,"Overcast. Hot.",31.28
62,1,"PASAR MINI A.T.N (11am-11pm)",2.762337,101.929541,"51",64.35,64.35,87.70,87.70,80,93,13,30.70,30.70,90.00,"Overcast. Hot.",31.28
63,1,"SIM YAM HOE SDN BHD",2.7491817,101.9157683,"47",64.52,64.52,86.43,86.43,78,91,13,30.25,30.25,88.57,"Overcast. Hot.",31.28
64,1,"MY SUPER STORE SDN BHD",2.644342,101.712694,"52",64.74,64.74,88.53,88.53,82,96,14,30.99,30.99,89.48,"Scattered clouds. Hot.",33.00
65,1,"SP MEGA FROZEN FOOD SDN BHD (3PM CLOSE)",2.644006,101.715883,"47",64.87,64.87,88.05,88.05,81,94,14,30.82,30.82,89.00,"Scattered clouds. Hot.",33.00
66,1,"FLT TRADING",2.654825,101.751895,"56",64.94,64.94,87.60,87.60,81,93,13,30.66,30.66,88.57,"Scattered clouds. Hot.",33.00
67,1,"PASAR MINI YC YEE CHIN",2.643147,101.717513,"50",65.01,65.01,87.77,87.77,80,93,13,30.72,30.72,89.50,"Scattered clouds. Hot.",33.00
68,1,"NS HONG FATT ENTERPRISE SDN BHD",2.6522,101.749893,"51",65.14,65.14,87.88,87.88,81,94,13,30.76,30.76,88.85,"Scattered clouds. Hot.",33.00
69,1,"G.U.S. (SUNGAI PELEK) SDN BHD",2.6406676,101.7141079,"56",65.18,65.18,88.26,88.26,81,95,14,30.89,30.89,89.22,"Scattered clouds. Hot.",33.00
70,1,"CHIN MEE (Thu: NO DELIVERY)",2.640419407,101.7165745,"92",65.28,65.28,88.23,88.23,81,94,14,30.88,30.88,89.20,"Scattered clouds. Hot.",33.00
71,1,"SIN MAH LEE ENTERPRISE",2.649425,101.747163,"47",65.33,65.33,88.36,88.36,81,94,13,30.93,30.93,89.33,"Scattered clouds. Hot.",33.00
72,1,"REZEKI FOOD STUFF ENTERPRISE",2.6387622,101.7137659,"48",65.37,65.37,88.48,88.48,81,95,14,30.97,30.97,89.41,"Scattered clouds. Hot.",33.00
73,1,"HANESH ENTERPRISE",2.6379591,101.7130079,"55",65.43,65.43,88.63,88.63,81,95,14,31.02,31.02,89.59,"Scattered clouds. Hot.",33.00
74,1,"FAMA CORPORATION SDN. BHD. - AGROBAZAAR SENDAYAN (Mon-Fri|Sat: Half day|Sun close)",2.6994621,101.8586484,"57",65.49,65.49,93.93,93.93,82,98,16,32.88,32.88,99.04,"Scattered clouds. Hot.",33.00
75,1,"PASARAYA FATEEMAH",2.6477819,101.7468925,"50",65.50,65.50,88.39,88.39,81,94,13,30.94,30.94,89.37,"Scattered clouds. Hot.",33.00
76,1,"SHIN KONG LEE TRADING",2.6477285,101.7469879,"48",65.50,65.50,88.39,88.39,81,94,13,30.94,30.94,89.36,"Scattered clouds. Hot.",33.00
77,1,"YAHYA MINI MARKET",2.9498645,102.0888616,"46",65.57,65.57,119.17,119.17,109,124,15,41.71,41.71,117.99,"Overcast. Hot.",31.28
78,1,"CHOP GUAN HONG",2.646738,101.746283,"24",65.58,65.58,88.50,88.50,81,94,13,30.97,30.97,89.47,"Scattered clouds. Hot.",33.00
79,1,"EUHUP ENTERPRISE",2.647971,101.751191,"57",65.63,65.63,88.83,88.83,83,96,13,31.09,31.09,89.80,"Scattered clouds. Hot.",33.00
80,1,"FATIMAH HASSAN ULLAH ENTERPRISE",2.6866853,101.846048,"56",66.02,66.02,95.49,95.49,85,101,16,33.42,33.42,101.30,"Scattered clouds. Hot.",33.00
81,1,"TNF MAJU ENTERPRISE",2.6878376,101.8484237,"47",66.04,66.04,90.02,90.02,84,97,13,31.51,31.51,101.11,"Scattered clouds. Hot.",33.00
82,1,"VIKA ENTERPRISE",2.7046855,101.8800407,"46",66.25,66.25,91.10,91.10,80,96,16,31.88,31.88,96.58,"Scattered clouds. Hot.",33.00
83,1,"MANTAU MINIMART (Fri: 12pm-3pm close)",2.7046733,101.8800297,"53",66.25,66.25,91.10,91.10,80,96,16,31.88,31.88,96.58,"Scattered clouds. Hot.",33.00
84,1,"GREEN APPLE STORE (PAGOH) SDN. BHD.",2.725993,101.911114,"56",66.26,66.26,86.17,86.17,75,92,16,30.16,30.16,91.56,"Overcast. Hot.",31.28
85,1,"DS KOPITIAM (MONDAY CLOSED)",2.710255,101.888816,"69",66.27,66.27,89.78,89.78,78,94,16,31.42,31.42,96.40,"Scattered clouds. Hot.",33.00
86,1,"COOKING MASTER RESTAURANT (THURSDAY OFF) (OPEN 1PM)",2.726096,101.911406,"34",66.27,66.27,86.15,86.15,75,92,16,30.15,30.15,91.55,"Overcast. Hot.",31.28
87,1,"KEDAI RUNCIT AA SMART (FRIDAY CLOSED)",2.708186,101.887739,"54",66.39,66.39,90.15,90.15,79,95,16,31.55,31.55,96.27,"Scattered clouds. Hot.",33.00
88,1,"LEAF VEGETARIAN",2.707843,101.888171,"53",66.45,66.45,90.15,90.15,78,94,16,31.55,31.55,96.65,"Scattered clouds. Hot.",33.00
89,1,"PASAR RAYA ARAFAH MAJU (Open everyday|Fri: 12.30pm-2.30pm close)",2.63956,101.7563291,"50",66.70,66.70,90.52,90.52,85,98,13,31.68,31.68,90.75,"Scattered clouds. Hot.",33.00
90,1,"CHOONG KHOON MUI (10AM start business) (Sunday Off)",2.740697,101.939021,"81",66.87,66.87,90.61,90.61,82,100,18,31.71,31.71,86.20,"Overcast. Hot.",31.28
91,1,"PASARAYA JELITA (smnall lorry)",2.747932,101.953588,"50",67.30,67.30,89.62,89.62,83,96,13,31.37,31.37,88.54,"Overcast. Hot.",31.28
92,1,"HOE HIN ENTERPRISE S/B-SMALL LORI-DELIVER TUE-THUR 8.30-12PM, TUE-FRI-2-4pm",2.73166,101.936167,"55",67.46,67.46,89.68,89.68,80,97,17,31.39,31.39,95.47,"Overcast. Hot.",31.28
93,1,"JT TRADING SDN BHD (855251-H)",2.7316173,101.9371433,"54",67.53,67.53,89.77,89.77,79,97,18,31.42,31.42,95.62,"Overcast. Hot.",31.28
94,1,"MING TAI FOOD (M) SDN BHD (MING TAI FOODMART)",2.731495,101.9371698,"52",67.54,67.54,89.76,89.76,78,96,18,31.42,31.42,95.62,"Overcast. Hot.",31.28
95,1,"PERNIAGAAN AL-AMIN",2.742156,101.950236,"49",67.55,67.55,89.28,89.28,83,96,13,31.25,31.25,88.19,"Overcast. Hot.",31.28
96,1,"KEDAI RUNCIT AA MART SDN. BHD.",2.6810546,101.8651364,"54",67.62,67.62,95.60,95.60,84,100,16,33.46,33.46,91.31,"Scattered clouds. Hot.",33.00
97,1,"JINJANG LEE FROZEN SDN. BHD. (SEREMBAN)",2.730515,101.937536,"55",67.65,67.65,89.63,89.63,78,96,18,31.37,31.37,85.37,"Overcast. Hot.",31.28
98,1,"TONGKAH BIDUANDA TRADING - CHE LAH MART",2.9640737,102.1170045,"46",67.76,67.76,100.74,100.74,104,116,12,35.26,35.26,121.77,"Overcast. Hot.",31.28
99,1,"CHOP KHOON SENG (MON TO SAT)",2.728787,101.939099,"24",67.91,67.91,89.86,89.86,79,97,18,31.45,31.45,85.61,"Overcast. Hot.",31.28
100,1,"KEDAI VOON FAH (10 TON LORI BOLEH MASUK SAJA)",2.727921,101.93914,"54",67.99,67.99,89.45,89.45,78,95,17,31.31,31.31,85.50,"Overcast. Hot.",31.28
101,1,"ASHA SPEEDMART (FRIDAY CLOSED)",2.750565,101.966302,"45",68.02,68.02,94.63,94.63,86,105,18,33.12,33.12,94.40,"Overcast. Hot.",31.28
102,1,"HIAP SENG TRADING",2.727651,101.93993,"55",68.07,68.07,89.47,89.47,79,96,17,31.31,31.31,86.03,"Overcast. Hot.",31.28
103,1,"SIKAMAT POINT",2.7487968,101.9674873,"48",68.25,68.25,94.40,94.40,86,104,18,33.04,33.04,94.37,"Overcast. Hot.",31.28
104,1,"PASARAYA MAP SDN BHD",2.725251,101.939727,"50",68.26,68.26,89.16,89.16,78,94,17,31.21,31.21,95.61,"Overcast. Hot.",31.28
105,1,"MS AYU KHAN ENTERPRISE",2.7246446,101.9390815,"52",68.27,68.27,88.94,88.94,77,93,17,31.13,31.13,95.55,"Scattered clouds. Hot.",33.00
106,1,"IMAH RIN ENTERPRISE",2.7476167,101.9665717,"55",68.28,68.28,94.18,94.18,85,104,18,32.96,32.96,94.16,"Overcast. Hot.",31.28
107,1,"NOORULLAH CONVENIENCE STORE - MY GROCER",2.756782,101.981908,"51",68.69,68.69,99.36,99.36,91,104,14,34.78,34.78,95.97,"Overcast. Hot.",31.28
108,1,"PASAR MINI MUHABBAT - SEREMBAN (Open everyday|Fri: 12.30pm-2.30pm close)",2.709072,101.9257111,"50",68.74,68.74,89.26,89.26,77,94,17,31.24,31.24,94.12,"Scattered clouds. Hot.",33.00
109,1,"HOE HING CHAN SDN BHD (MON-SAT : 8AM-1PM)",2.727606,101.95076,"55",68.83,68.83,94.96,94.96,84,100,17,33.24,33.24,87.37,"Overcast. Hot.",31.28
110,1,"JATI FROZEN SDN BHD (MASJID TANAH BRANCH)",2.70658,101.925851,"55",68.97,68.97,89.57,89.57,78,95,17,31.35,31.35,94.10,"Scattered clouds. Hot.",33.00
111,1,"AUTHENTIC CHARCOAL GRILL HOUSE -  DELIVERY BY THOMAS",2.694291,101.909831,"24",69.05,69.05,88.61,88.61,77,93,16,31.01,31.01,95.40,"Scattered clouds. Hot.",33.00
112,1,"PERMAI SEMBILAN ENTERPRISE S/B-5 TON 3 ORG-SAT&SUN NO RECEIVED",2.706052,101.926671,"49",69.07,69.07,89.46,89.46,78,95,17,31.31,31.31,94.07,"Scattered clouds. Hot.",33.00
113,1,"HOE HIN CONFECTIONARY SDN BHD",2.7239505,101.9558156,"55",69.50,69.50,91.58,91.58,82,100,18,32.05,32.05,90.50,"Scattered clouds. Hot.",33.00
114,1,"BINA SEJAHTERA MAJU (DELIVERY 2PM-5PM)",2.684408,101.9051381,"49",69.66,69.66,90.64,90.64,80,97,17,31.72,31.72,96.82,"Scattered clouds. Hot.",33.00
