cluster_id,sequence_order,store_name,lat,lon,tonnage,haversine_dist_km,haversine_cumulative_km,road_dist_km,cumulative_dist_km,drive_min_no_traffic,drive_min_with_traffic,delay_min,fuel_liters_leg,cumulative_fuel_liters,return_dist_km,weather,temp_c
8,15,"KEDAI RUNCIT THAHIR ( FRIDAY CLOSE)",3.11127,101.764819,"54",25.37,32.57,3.71,54.03,8,9,2,0.93,13.61,,"Thunderstorms. Scattered clouds. Warm.",29.00
8,16,"CB FROZEN FOOD SDN BHD - CHERAS BRANCH  8AM-5PM",3.10863638,101.7459843,"81",23.61,34.68,3.16,57.19,7,8,1,0.79,14.40,,"Thunderstorms. Scattered clouds. Warm.",29.00
8,17,"AMRI & HARTINI ENTERPRISE (Fri: 12pm-3pm close)",3.110411007,101.7301672,"38",21.97,36.44,4.58,61.77,9,11,2,1.15,15.55,,"Thunderstorms. Scattered clouds. Warm.",29.00
8,18,"BIG TREE PLT (24 Hrs - Every 2 weeks off 1 day)",3.088609843,101.7434149,"15",24.47,39.28,3.53,65.30,6,9,4,0.89,16.44,,"Thunderstorms. Scattered clouds. Warm.",29.00
8,19,"RESTORAN SEGAR PERTAMA",3.088366,101.743564,"48",24.49,39.31,0.41,65.71,1,1,0,0.10,16.54,,"Thunderstorms. Scattered clouds. Warm.",29.00
8,20,"PASAR MINI REZEKI (Fri: 1pm-5pm close)",3.069912,101.749662,"50",26.19,41.47,3.12,68.83,7,7,1,0.78,17.32,,"Thunderstorms. Scattered clouds. Warm.",29.00
8,21,"FORTRESS AVENUE SDN BHD(88 Sp mart)",3.058429,101.749406,"56",26.93,42.75,1.47,70.30,4,4,0,0.37,17.69,,"Thunderstorms. Scattered clouds. Warm.",29.00
8,22,"CHECKERS HYPERMARKET S/B - DELIVER TO CHERAS (Sat: Receiving halfday)",3.051664,101.746996,"90",27.18,43.55,1.49,71.79,5,6,0,0.37,18.06,,"Thunderstorms. Scattered clouds. Warm.",29.00
8,23,"AA WORLD ENTERPRISE (Fri: Close during prayer)",3.046857,101.740794,"24",26.99,44.42,1.82,73.61,4,5,1,0.46,18.52,,"Thunderstorms. Scattered clouds. Warm.",29.00
8,24,"SUPER SEVEN (M) SDN BHD - SG BULOH",3.049089,101.735535,"47",26.39,45.05,1.38,74.99,5,5,0,0.35,18.87,,"Thunderstorms. Scattered clouds. Warm.",29.00
8,25,"SHAHRUL FRESH & FROZEN (M) SDN BHD (Fri: Close during Jumaat prayer)",3.054135,101.738171,"48",26.25,45.69,2.21,77.20,6,6,0,0.55,19.42,,"Thunderstorms. Scattered clouds. Warm.",29.00
8,26,"SINTAK KEE FOODS TRADING",3.039787,101.749066,"47",28.20,47.69,6.09,83.29,15,17,2,1.53,20.95,,"Thunderstorms. Scattered clouds. Warm.",29.00
8,27,"MTK MART (Open 6am-3.30pm)",3.027616,101.747958,"52",29.01,49.05,8.43,91.72,13,15,2,2.12,23.06,,"Thunderstorms. Scattered clouds. Warm.",29.00
8,28,"MANJUMA TRADING (Fri: Close during prayer)",3.027694,101.747156,"53",28.94,49.14,0.09,91.81,0,0,0,0.02,23.08,,"Thunderstorms. Scattered clouds. Warm.",29.00
8,29,"A S M FAHIM HOLDINGS SDN BHD (Fri: 1pm-3pm rest)",3.024007,101.748703,"82",29.35,49.58,2.33,94.14,4,4,0,0.58,23.67,,"Thunderstorms. Scattered clouds. Warm.",29.00
8,30,"K 1 TOP ENTERPRISE (Fri: 12.30pm-2.30pm close)",3.024029,101.749812,"54",29.44,49.71,0.41,94.55,1,1,0,0.10,23.77,,"Thunderstorms. Scattered clouds. Warm.",29.00
8,31,"RAISHA MAJU TRADING (Fri: 1pm-3pm rest)",3.02444,101.750149,"49",29.43,49.77,0.38,94.93,1,1,0,0.10,23.86,41.36,"Thunderstorms. Scattered clouds. Warm.",29.00
9,1,"MAMARAJ MINI MARKET (Mon-Sat: 9am-5.30pm|Fri: No delivery)",3.045206,101.602822,"53",18.53,18.53,26.37,26.37,29,39,10,6.71,6.71,,"Thunderstorms. Scattered clouds. Warm.",29.00
9,2,"FS NUSANTARA MART (Friday: 12pm-3pm close)",3.035008,101.593601,"56",19.38,20.05,2.78,29.15,7,9,2,0.70,7.41,,"Thunderstorms. Scattered clouds. Warm.",29.00
9,3,"GAJA STORE PLT (Mon-Sat: 9am-7pm)",2.995582,101.621139,"56",24.40,25.40,10.49,39.64,14,18,4,2.64,10.05,,"Thunderstorms. Scattered clouds. Warm.",29.00
9,4,"PASAR SEGAR ARIFFIN ARAFAT (Mon-Sat: 9am-6pm)",2.989558,101.638945,"50",25.67,27.49,4.19,43.83,7,8,2,1.05,11.10,,"Thunderstorms. Scattered clouds. Warm.",29.00
9,5,"JW GLOBAL JAYA TRADING",2.974097,101.6074419,"54",26.32,31.38,9.46,53.29,16,18,2,2.37,13.48,,"Thunderstorms. Scattered clouds. Warm.",29.00
9,6,"PASARAYA JUST RIGHT SDN BHD",3.00698,101.709171,"50",27.81,43.26,23.73,77.02,27,31,4,5.98,19.45,,"Thunderstorms. Scattered clouds. Warm.",29.00
9,7,"WIGNES MINI MARKET SDN BHD.",3.009313,101.710221,"46",27.67,43.54,0.89,77.91,2,3,0,0.22,19.68,,"Thunderstorms. Scattered clouds. Warm.",29.00
9,8,"HASIL LAUT SEONG KEE SDN BHD - SERI KEMBANGAN",3.017334,101.712136,"55",27.11,44.46,1.78,79.69,3,4,1,0.45,20.12,,"Thunderstorms. Scattered clouds. Warm.",29.00
9,9,"CHAW ENTERPRISE (SJK (C) KUNG MAN) - (Mon to Fri - After 2pm) (4pm Close)",3.015506777,101.7211052,"89",27.91,45.48,5.14,84.83,10,14,4,1.29,21.42,,"Thunderstorms. Scattered clouds. Warm.",29.00
9,10,"B CART TRADING",3.026672,101.724401,"97",27.23,46.77,8.40,93.23,10,11,1,2.10,23.52,,"Thunderstorms. Scattered clouds. Warm.",29.00
9,11,"PASAR MINI UMA",3.028052,101.726036,"50",27.25,47.01,1.33,94.56,2,2,0,0.33,23.85,,"Thunderstorms. Scattered clouds. Warm.",29.00
9,12,"PASAR MINI BERKAT BONDA (Mon-Sat: 9.30am-6pm|Fri:12pm-3pm)",3.027898,101.722515,"51",26.99,47.40,1.42,95.98,3,4,0,0.36,24.21,,"Thunderstorms. Scattered clouds. Warm.",29.00
9,13,"NYS FOOD MART SDN BHD - BALAKONG",3.024932,101.732613,"51",28.00,48.57,1.66,97.64,3,3,0,0.42,24.62,,"Thunderstorms. Scattered clouds. Warm.",29.00
9,14,"PEMBORONG BARANG RUNCIT SOON SHENG",3.018567,101.734572,"49",28.66,49.31,2.23,99.87,7,7,0,0.56,25.18,40.61,"Thunderstorms. Scattered clouds. Warm.",29.00
10,1,"CHAMPION FOOD SDN. BHD. (open 9am - 2pm)",3.132408666,101.7111244,"40",18.97,18.97,25.85,25.85,30,37,6,6.53,6.53,,"Thunderstorms. Scattered clouds. Warm.",29.00
10,2,"AMAN RAHIM ENTERPRISE",3.073115126,101.7185008,"49",23.22,25.62,9.92,35.77,14,22,8,2.52,9.05,,"Thunderstorms. Scattered clouds. Warm.",29.00
10,3,"MAKANAN LAUT YOKE HENG (Monday close|Delivery time: 8am-11.30am)",3.046177,101.703246,"53",24.05,29.06,6.09,41.86,10,11,2,1.53,10.58,,"Thunderstorms. Scattered clouds. Warm.",29.00
10,4,"GURUNG MARKETING",3.023968,101.741204,"56",28.75,33.94,7.26,49.12,11,14,3,1.83,12.40,,"Thunderstorms. Scattered clouds. Warm.",29.00
10,5,"ALTA JAYA ENTERPRISE",3.01451,101.754604,"66",30.55,35.77,4.98,54.10,9,10,1,1.25,13.65,,"Thunderstorms. Scattered clouds. Warm.",29.00
10,6,"SUPER SEVEN (M) SDN BHD - CHERAS JAYA",3.021717,101.765476,"47",30.90,37.22,9.37,63.47,15,16,1,2.35,16.00,,"Thunderstorms. Scattered clouds. Warm.",29.00
10,7,"WAI LUN ENTERPRISE",3.038294,101.767729,"46",29.91,39.08,4.12,67.59,6,7,1,1.03,17.03,,"Thunderstorms. Scattered clouds. Warm.",29.00
10,8,"SUPER SEVEN CASH & CARRY SDN BHD - BALAKONG",3.03882,101.769435,"47",30.02,39.27,0.35,67.94,1,2,0,0.09,17.12,,"Thunderstorms. Scattered clouds. Warm.",29.00
10,9,"BONKEE YUAN TRADING SDN. BHD. - PASAR RAYA SEGAR FRESH BOULEVARD",3.038428,101.770019,"51",30.10,39.35,0.10,68.04,1,1,0,0.03,17.14,,"Thunderstorms. Scattered clouds. Warm.",29.00
10,10,"MYS BORONG MART",3.04488,101.773084,"52",29.93,40.15,0.97,69.01,3,4,1,0.24,17.39,,"Thunderstorms. Scattered clouds. Warm.",29.00
10,11,"WAN SHENG MINI MARKET (Tue: Close|Delivery after 11.30am)",3.045525,101.772506,"46",29.84,40.24,0.14,69.15,0,0,0,0.04,17.42,,"Thunderstorms. Scattered clouds. Warm.",29.00
10,12,"MH WORLD SOLUTIONS SDN. BHD. (Fri: 1pm-3pm close)",3.051661,101.7753,"53",29.69,40.99,1.96,71.11,5,6,1,0.49,17.91,,"Thunderstorms. Scattered clouds. Warm.",29.00
10,13,"YUANS F&B SDN BHD (WEDNESDAY CLOSE)",3.054418,101.788344,"46",30.72,42.47,2.43,73.54,5,6,1,0.61,18.52,,"Thunderstorms. Scattered clouds. Warm.",29.00
10,14,"SYARIKAT NG KEONG DAN ANAK-ANAK",3.028612,101.805897,"47",33.94,45.94,14.33,87.87,16,17,0,3.58,22.10,,"Thunderstorms. Scattered clouds. Warm.",29.00
10,15,"JT TRADING SDN BHD (855251-H) (KAJANG)",2.999403,101.785137,"54",34.18,49.92,8.99,96.86,10,12,2,2.26,24.36,45.84,"Thunderstorms. Scattered clouds. Warm.",29.00
11,1,"KOPITIAM SIN LAI KEE (9am-4pm)",3.192175,101.314981,"53",26.86,26.86,50.30,50.30,48,57,9,12.77,12.77,,"Thunderstorms. Scattered clouds. Warm.",29.00
11,2,"CB FROZEN FOOD SDN. BHD. - SUNGAI BULOH (Monday-Saturday: 8am-5pm)",3.2105831,101.2785965,"62",30.87,31.39,3.38,53.68,7,7,0,0.85,13.61,,"Thunderstorms. Scattered clouds. Warm.",29.00
11,3,"CB WHOLESALE MART SDN BHD - SUNGAI BULOH",3.2105831,101.2785965,"31",30.87,31.39,0.00,53.68,0,0,0,0.00,13.61,,"Thunderstorms. Scattered clouds. Warm.",29.00
11,4,"RESTORAN SIDDIQ",3.2472475,101.2358762,"48",35.91,37.65,18.30,71.98,25,26,1,4.58,18.19,,"Thunderstorms. Scattered clouds. Warm.",29.00
11,5,"PASARAYA HIJRAH (PELITA HIJRAH SDN BHD)",3.3027231,101.2459559,"50",36.15,43.92,7.56,79.54,15,15,1,1.89,20.09,42.80,"Thunderstorms. Scattered clouds. Warm.",29.00
12,1,"RAMZAN MINI MARKET (Fri: Close 1pm-5pm)",3.080386,101.764632,"49",26.95,26.95,42.39,42.39,44,52,9,10.77,10.77,,"Thunderstorms. Scattered clouds. Warm.",29.00
12,2,"PASARAYA ALAM JAYA SDN BHD",3.079911,101.764348,"50",26.95,27.01,0.08,42.47,1,1,0,0.02,10.79,,"Thunderstorms. Scattered clouds. Warm.",29.00
12,3,"NEH LAH FRESH MARKET",3.004944,101.737784,"52",30.02,35.86,13.39,55.86,23,27,4,3.37,14.16,,"Thunderstorms. Scattered clouds. Warm.",29.00
12,4,"KAY 9 ENTERPRISE",2.996747,101.75427,"54",31.93,37.90,4.47,60.33,12,12,0,1.12,15.28,,"Thunderstorms. Scattered clouds. Warm.",29.00
12,5,"PASAR SEGAR SSV (RABU TUTUP)",2.998456,101.755537,"50",31.89,38.14,1.10,61.43,3,3,0,0.28,15.55,,"Thunderstorms. Scattered clouds. Warm.",29.00
12,6,"HASIL LAUT SEONG KEE SDN BHD - BALAKONG JAYA",2.995897,101.756235,"55",32.15,38.43,2.23,63.66,6,6,0,0.56,16.11,,"Thunderstorms. Scattered clouds. Warm.",29.00
12,7,"PERNIAGAAN XING FAI (FRIDAY OFF)",2.99464,101.756126,"49",32.24,38.57,0.50,64.16,1,1,0,0.13,16.24,,"Thunderstorms. Scattered clouds. Warm.",29.00
12,8,"QXQY MANAGEMENT SDN. BHD.",2.992807,101.760437,"49",32.72,39.09,5.22,69.38,13,13,0,1.31,17.54,,"Thunderstorms. Scattered clouds. Warm.",29.00
12,9,"PASAR FAMILY MART - NZ MAJESTIC PLT",2.980735,101.758214,"51",33.54,40.46,7.41,76.79,13,14,1,1.86,19.40,,"Overcast. Extremely hot.",35.28
12,10,"NYS FOOD MART SDN BHD - KAJANG",2.982452,101.778964,"51",34.98,42.77,3.47,80.26,6,7,1,0.87,20.27,,"Overcast. Extremely hot.",35.28
12,11,"RESTORAN HABEEB MAJU",2.955961,101.768493,"49",36.36,45.94,7.56,87.82,15,17,2,1.90,22.16,,"Overcast. Extremely hot.",35.28
12,12,"HOCK MEI TRADING (SG. CHUA) SDN BHD",2.955156,101.768711,"55",36.45,46.03,0.05,87.87,0,0,0,0.01,22.18,,"Overcast. Extremely hot.",35.28
12,13,"RESTORAN BANGI IMPIAN MAJU (LUTHFIA ALLIANCE SDN. BHD.)",2.955825,101.767651,"49",36.31,46.17,0.08,87.95,0,0,0,0.02,22.20,,"Overcast. Extremely hot.",35.28
12,14,"HOCK MEI TRADING SDN BHD",2.953699,101.753766,"55",35.52,47.73,2.63,90.58,7,7,0,0.66,22.85,46.37,"Overcast. Extremely hot.",35.28
13,1,"THIRTY THREE WALMART",3.385178767,101.7753856,"47",31.46,31.46,54.51,54.51,61,71,11,13.88,13.88,,"Thunderstorms. Scattered clouds. Warm.",29.00
13,2,"GENTING GOLF COURSE BHD",3.396671266,101.7801231,"56",32.69,32.85,6.11,60.62,15,15,0,1.53,15.41,,"Thunderstorms. Scattered clouds. Warm.",29.00
13,3,"GENTING MALAYSIA BERHAD",3.396671266,101.7801231,"56",32.69,32.85,0.00,60.62,0,0,0,0.00,15.41,,"Thunderstorms. Scattered clouds. Warm.",29.00
13,4,"SURE WIN CLAYPOT SEAFOOD PORRIDGE SDN BHD (open 10am-3am)",3.398899596,101.7692864,"47",31.95,34.07,2.62,63.24,6,6,0,0.66,16.06,,"Thunderstorms. Scattered clouds. Warm.",29.00
13,5,"SB GLORY SDN BHD",3.425583455,101.7933386,"48",35.93,38.06,9.84,73.08,22,22,0,2.46,18.53,,"Thunderstorms. Scattered clouds. Warm.",29.00
13,6,"ION DELEMEN HOSPITALITY SDN BHD",3.434466307,101.7877331,"55",36.16,39.23,4.68,77.76,12,12,0,1.17,19.70,61.12,"Thunderstorms. Scattered clouds. Warm.",29.00
14,1,"ZUHAIRINA FAMILY ENTERPRISE (Mon-Sat: 9am-6pm|Fri: No delivery)",2.962411,101.330055,"46",36.91,36.91,61.14,61.14,55,65,11,15.57,15.57,59.37,"Thunderstorms. Scattered clouds. Warm.",29.00
15,1,"FROZEN KEN SDN. BHD.",2.991688,101.818101,"56",37.51,37.51,55.89,55.89,54,64,10,14.22,14.22,,"Overcast. Extremely hot.",35.28
15,2,"RESTORAN URAT KETING",2.975536,101.809302,"48",37.95,39.56,7.37,63.26,9,10,0,1.84,16.06,,"Overcast. Extremely hot.",35.28
15,3,"YS HYPER",2.972344,101.810053,"46",38.25,39.92,0.37,63.63,1,1,0,0.09,16.15,,"Overcast. Extremely hot.",35.28
15,4,"MING TAI FOOD (M) SDN BHD (SEMENYIH)",2.944318,101.843327,"52",43.08,44.76,16.01,79.64,20,22,3,4.02,20.18,,"Overcast. Extremely hot.",35.28
15,5,"SEMENYIH FROZEN FOOD MART",2.943634,101.843827,"48",43.17,44.85,0.19,79.83,1,1,0,0.05,20.23,,"Overcast. Extremely hot.",35.28
15,6,"CLC WHOLESALER (SEMENYIH) SDN BHD",2.944514,101.844746,"80",43.18,44.99,0.25,80.08,1,1,0,0.06,20.29,,"Overcast. Extremely hot.",35.28
15,7,"NYS FOOD MART SDN BHD - SEMENYIH",2.946046,101.845624,"51",43.14,45.19,0.44,80.52,2,2,0,0.11,20.40,,"Overcast. Extremely hot.",35.28
15,8,"V.S.VARUSAI IBRAHIM & CO.",2.946268,101.845684,"46",43.13,45.21,0.03,80.55,0,0,0,0.01,20.41,,"Overcast. Extremely hot.",35.28
15,9,"CHOP TOON CHOON THONG",2.946493,101.845751,"92",43.12,45.24,0.03,80.58,0,0,0,0.01,20.41,,"Overcast. Extremely hot.",35.28
15,10,"PASAR MINI SRI RAAMA",2.946532,101.845759,"50",43.11,45.24,0.02,80.60,0,0,0,0.01,20.42,,"Overcast. Extremely hot.",35.28
15,11,"BIRMIR CASH & CARRY",2.94739,101.845925,"70",43.06,45.34,0.10,80.70,1,1,0,0.03,20.44,61.83,"Overcast. Extremely hot.",35.28
16,1,"BERKAT MADINA MART (Mon-Fri: 8am-5.30pm| Fri: 12pm-3pm rest| Sat: 4.30 pm close)",2.850165,101.650302,"87",40.84,40.84,67.57,67.57,65,79,14,17.29,17.29,,"Overcast. Extremely hot.",35.28
16,2,"PASAR RAYA SAROJA UTAMA",2.8281921,101.7296673,"50",46.13,49.98,23.57,91.14,27,31,4,5.93,23.22,74.19,"Overcast. Extremely hot.",35.28
17,1,"BAN BEE HUAT ENTERPRISE",2.81213,101.497758,"86",44.20,44.20,69.29,69.29,62,77,14,17.73,17.73,,"Overcast. Extremely hot.",35.28
17,2,"KEDAI RUNCIT JHARSWIN  (Mon-Sat: 9am-6pm)",2.812952,101.486907,"54",44.31,45.41,2.64,71.93,5,7,2,0.66,18.39,69.72,"Overcast. Extremely hot.",35.28
18,1,"PEMBORONG BARANG RUNCIT HUP SOON",2.854478,101.799272,"49",47.41,47.41,65.29,65.29,62,81,19,16.84,16.84,,"Overcast. Extremely hot.",35.28
18,2,"BANG SHENG TRADING",2.85325,101.800804,"50",47.62,47.63,0.96,66.25,3,3,0,0.24,17.08,,"Overcast. Extremely hot.",35.28
18,3,"RESTORAN KIM FONG N TIGA (Open: 7am-5pm|No delivery during lunch time)",2.857408,101.807033,"48",47.64,48.46,1.14,67.39,3,3,0,0.29,17.37,,"Overcast. Extremely hot.",35.28
18,4,"FM COLLECTION SDN BHD",2.853037,101.812113,"56",48.37,49.21,1.18,68.57,3,3,0,0.30,17.66,,"Overcast. Extremely hot.",35.28
18,5,"FOOD FARM SDN. BHD.",2.849691,101.813525,"56",48.76,49.61,1.55,70.12,5,5,0,0.39,18.05,85.75,"Overcast. Extremely hot.",35.28
19,1,"NBK MAJU ENTERPRISE (M) SDN. BHD.",2.8147332,101.7347885,"52",47.72,47.72,73.48,73.48,71,85,14,18.80,18.80,,"Overcast. Extremely hot.",35.28
19,2,"YI HONG CHUAN ENTERPRISE (hantar sebelum 9.30am)",2.811894,101.73719,"46",48.12,48.14,0.73,74.21,2,2,0,0.18,18.98,69.71,"Overcast. Extremely hot.",35.28
20,1,"JIMAT BERANANG ENTERPRISE - BERANANG",2.9057,101.86448,"55",47.73,47.73,70.42,70.42,70,78,8,17.84,17.84,67.14,"Overcast. Extremely hot.",35.28
21,1,"N NINE MINI MARKET",2.812944,101.762688,"52",49.27,49.27,70.53,70.53,66,87,22,18.28,18.28,74.41,"Overcast. Extremely hot.",35.28
22,1,"PASAR MINI GNR - MANTIN",2.854344,101.840394,"51",50.16,50.16,76.98,76.98,73,82,8,19.50,19.50,76.86,"Overcast. Extremely hot.",35.28
23,1,"SEMENYIH FOODMART SDN BHD",2.790236,101.749262,"48",50.87,50.87,75.41,75.41,71,86,15,19.32,19.32,71.55,"Overcast. Extremely hot.",35.28
24,1,"1 BABA STORE SDN BHD",2.822197,101.817315,"20",51.51,51.51,66.64,66.64,63,83,20,17.22,17.22,75.64,"Overcast. Extremely hot.",35.28
25,1,"CHUN MENG ENTERPRISE-DELIVER AFTER 12PM- SMALL LORRY (no red packing csr)",2.818956,101.813013,"70",51.54,51.54,66.90,66.90,63,83,20,17.28,17.28,79.51,"Overcast. Extremely hot.",35.28
26,1,"BAIDURI BIJAKSANA SDN. BHD.",2.818299,101.814185,"96",51.67,51.67,66.76,66.76,63,84,21,17.28,17.28,79.68,"Overcast. Extremely hot.",35.28
27,1,"CB FROZEN FOOD SDN BHD - NILAI BRANCH",2.818216,101.814241,"64",51.68,51.68,66.75,66.75,63,84,21,17.27,17.27,79.69,"Overcast. Extremely hot.",35.28
28,1,"BUSY CORNER SDN BHD",2.810548,101.802492,"54",51.69,51.69,67.56,67.56,64,85,21,17.48,17.48,80.23,"Overcast. Extremely hot.",35.28
29,1,"SEMARAK MART TRADING",2.818333,101.814914,"48",51.71,51.71,66.75,66.75,63,83,20,17.24,17.24,78.59,"Overcast. Extremely hot.",35.28
30,1,"CT EXTRA STORES SDN BHD - DELIVERY B4 5PM & SAT OFF",2.817867,101.814519,"80",51.73,51.73,66.69,66.69,63,83,19,17.20,17.20,79.74,"Overcast. Extremely hot.",35.28
31,1,"JINJANG LEE FROZEN SDN BHD",2.817905,101.814686,"55",51.74,51.74,67.85,67.85,64,84,19,17.50,17.50,78.53,"Overcast. Extremely hot.",35.28
32,1,"HASIL LAUT SEONG KEE SDN. BHD. - NILAI",2.817414,101.814662,"55",51.78,51.78,66.66,66.66,63,82,19,17.19,17.19,79.81,"Overcast. Extremely hot.",35.28
33,1,"KK EGGS TRADING SDN. BHD. - NILAI (Please call before delivery)",2.812987,101.808284,"53",51.81,51.81,67.65,67.65,63,84,20,17.48,17.48,79.52,"Overcast. Extremely hot.",35.28
34,1,"CANDRIKAA CASH & CARRY (10AM-6PM)",2.81569,101.813293,"100",51.86,51.86,66.87,66.87,62,82,20,17.28,17.28,78.73,"Overcast. Extremely hot.",35.28
35,1,"ANNACHI WHOLESALE CASH & CARRY (M) SDN. BHD.",2.815707,101.813339,"75",51.86,51.86,66.86,66.86,62,82,20,17.27,17.27,78.73,"Overcast. Extremely hot.",35.28
36,1,"KINGSLEY FROZEN & GROCERIES (CALL BEFORE DELIVERY)",2.798922,101.791689,"53",52.19,52.19,70.45,70.45,68,90,21,18.23,18.23,76.17,"Overcast. Extremely hot.",35.28
37,1,"RECRON (MALAYSIA) SDN BHD - NILAI GENERAL PLANT",2.814763,101.8176278,"49",52.21,52.21,67.84,67.84,65,85,19,17.50,17.50,78.64,"Overcast. Extremely hot.",35.28
38,1,"YUZIE MINI MARKET",2.803548,101.80454,"46",52.48,52.48,68.98,68.98,65,86,21,17.85,17.85,80.87,"Overcast. Extremely hot.",35.28
39,1,"MARWA STORE",2.80255,101.80972,"53",52.87,52.87,69.95,69.95,68,89,21,18.10,18.10,81.77,"Overcast. Extremely hot.",35.28
40,1,"PASARAYA MILLENNIUM (MANTIN) SDN BHD(OFF FRI-SAT)",2.827368,101.88079,"50",55.33,55.33,80.94,80.94,76,85,9,20.54,20.54,80.86,"Overcast. Extremely hot.",35.28
41,1,"VMAS MINI MARKET",2.82302,101.89265,"46",56.56,56.56,84.47,84.47,77,85,7,21.36,21.36,82.32,"Overcast. Extremely hot.",35.28
42,1,"PATTANA TOMYAM SEAFOOD (Open 1pm-11pm|Wed close)",3.0382979,102.0702886,"49",59.98,59.98,85.00,85.00,89,101,12,21.68,21.68,85.47,"Overcast. Extremely hot.",35.28
43,1,"KEDAI TONG HUAT",2.659987,101.561115,"54",60.64,60.64,97.82,97.82,90,108,18,25.19,25.19,96.17,"Thunderstorms. Scattered clouds. Warm.",31.00
44,1,"PASAR MINI BEE HENG",2.659424,101.565626,"51",60.71,60.71,98.09,98.09,89,107,18,25.26,25.26,96.48,"Thunderstorms. Scattered clouds. Warm.",31.00
45,1,"C S HUAT ENTERPRISE",2.656578,101.560182,"10",61.02,61.02,98.31,98.31,91,109,18,25.31,25.31,96.61,"Thunderstorms. Scattered clouds. Warm.",31.00
46,1,"KIM HOK HIN SDN BHD",2.690545,101.751322,"53",61.19,61.19,80.60,80.60,74,98,24,20.96,20.96,81.54,"Thunderstorms. Scattered clouds. Warm.",31.00
47,1,"CHOP CHEN HENG (open 10.30am)",2.69016,101.751236,"84",61.22,61.22,80.64,80.64,74,98,24,20.97,20.97,81.58,"Thunderstorms. Scattered clouds. Warm.",31.00
48,1,"TONG SOON CHIN (PJB TAK BOLEH MASUK)",2.6877022,101.7488175,"46",61.38,61.38,81.38,81.38,75,99,24,21.16,21.16,82.28,"Thunderstorms. Scattered clouds. Warm.",31.00
49,1,"SS HAPPY MART (WONG KONG WUI)",2.976721,102.060039,"47",61.41,61.41,94.28,94.28,99,111,12,24.04,24.04,94.75,"Overcast. Extremely hot.",35.28
50,1,"YJK MINI MARKET",2.6850488,101.7496854,"46",61.70,61.70,81.19,81.19,74,98,24,21.11,21.11,82.67,"Thunderstorms. Scattered clouds. Warm.",31.00
51,1,"CHOP SHING LOONG",3.021308,102.081692,"37",61.79,61.79,87.38,87.38,91,103,12,22.28,22.28,87.85,"Overcast. Extremely hot.",35.28
52,1,"VPS FAMILY H MART",2.949694,102.05491,"46",62.20,62.20,97.28,97.28,103,114,12,24.81,24.81,126.90,"Overcast. Extremely hot.",35.28
53,1,"PASAR MINI SEONG HENG",2.949416,102.058253,"50",62.55,62.55,96.89,96.89,101,113,12,24.71,24.71,122.55,"Overcast. Extremely hot.",35.28
54,1,"KEDAI RUNCIT YUNG SHIM",2.949202,102.058724,"54",62.60,62.60,96.87,96.87,101,113,12,24.70,24.70,122.53,"Overcast. Extremely hot.",35.28
55,1,"LIM KEE MEI WEI TRADING",2.678614,101.759916,"53",62.77,62.77,82.50,82.50,75,100,24,21.45,21.45,83.41,"Thunderstorms. Scattered clouds. Warm.",31.00
56,1,"KEDAI RUNCIT NASHIRA - TIARA SENDAYAN",2.7016046,101.8206197,"54",63.22,63.22,86.09,86.09,85,107,22,22.31,22.31,86.92,"Thunderstorms. Scattered clouds. Warm.",31.00
57,1,"TQ BESTARI SDN BHD (FRIDAY 12.30PM-2.30PM OFF)",2.94377,102.064858,"46",63.49,63.49,97.77,97.77,102,114,12,24.93,24.93,125.52,"Overcast. Extremely hot.",35.28
58,1,"NZ MAJESTIC PLT (Fri: 1pm-2pm close)",2.7011993,101.8308397,"51",63.79,63.79,84.70,84.70,83,106,22,21.95,21.95,88.25,"Thunderstorms. Scattered clouds. Warm.",31.00
59,1,"KEDAI RUNCIT NASHIRA - GADONG JAYA",2.7010358,101.8314265,"54",63.84,63.84,84.63,84.63,83,105,22,21.93,21.93,88.18,"Thunderstorms. Scattered clouds. Warm.",31.00
60,1,"BAN SING SUNDRY ENTERPRISE",2.939717,102.070984,"87",64.30,64.30,120.14,120.14,110,118,8,30.44,30.44,121.05,"Overcast. Extremely hot.",35.28
61,1,"RESTORAN NOR FALAH (Open 7.30am-8pm)",2.9397397,102.0712292,"48",64.32,64.32,120.17,120.17,110,118,8,30.44,30.44,125.30,"Overcast. Extremely hot.",35.28
62,1,"PASAR MINI A.T.N (11am-11pm)",2.762337,101.929541,"51",64.35,64.35,91.10,91.10,84,90,6,23.00,23.00,92.15,"Overcast. Extremely hot.",35.28
63,1,"SIM YAM HOE SDN BHD",2.7491817,101.9157683,"47",64.52,64.52,89.83,89.83,82,88,6,22.68,22.68,90.72,"Overcast. Extremely hot.",35.28
64,1,"MY SUPER STORE SDN BHD",2.644342,101.712694,"52",64.74,64.74,88.53,88.53,82,107,26,23.09,23.09,89.48,"Thunderstorms. Scattered clouds. Warm.",31.00
65,1,"SP MEGA FROZEN FOOD SDN BHD (3PM CLOSE)",2.644006,101.715883,"47",64.87,64.87,88.05,88.05,81,106,25,22.93,22.93,89.00,"Thunderstorms. Scattered clouds. Warm.",31.00
66,1,"FLT TRADING",2.654825,101.751895,"56",64.94,64.94,87.60,87.60,81,105,25,22.81,22.81,88.57,"Thunderstorms. Scattered clouds. Warm.",31.00
67,1,"PASAR MINI YC YEE CHIN",2.643147,101.717513,"50",65.01,65.01,87.77,87.77,80,105,25,22.86,22.86,90.41,"Thunderstorms. Scattered clouds. Warm.",31.00
68,1,"NS HONG FATT ENTERPRISE SDN BHD",2.6522,101.749893,"51",65.14,65.14,87.88,87.88,81,105,25,22.89,22.89,88.85,"Thunderstorms. Scattered clouds. Warm.",31.00
69,1,"G.U.S. (SUNGAI PELEK) SDN BHD",2.6406676,101.7141079,"56",65.18,65.18,88.26,88.26,81,106,26,23.02,23.02,89.22,"Thunderstorms. Scattered clouds. Warm.",31.00
70,1,"CHIN MEE (Thu: NO DELIVERY)",2.640419407,101.7165745,"92",65.28,65.28,88.23,88.23,81,106,26,23.01,23.01,89.20,"Thunderstorms. Scattered clouds. Warm.",31.00
71,1,"SIN MAH LEE ENTERPRISE",2.649425,101.747163,"47",65.33,65.33,88.36,88.36,81,106,25,23.01,23.01,89.33,"Thunderstorms. Scattered clouds. Warm.",31.00
72,1,"REZEKI FOOD STUFF ENTERPRISE",2.6387622,101.7137659,"48",65.37,65.37,88.48,88.48,81,107,26,23.08,23.08,89.41,"Thunderstorms. Scattered clouds. Warm.",31.00
73,1,"HANESH ENTERPRISE",2.6379591,101.7130079,"55",65.43,65.43,88.63,88.63,81,107,26,23.12,23.12,89.59,"Thunderstorms. Scattered clouds. Warm.",31.00
74,1,"FAMA CORPORATION SDN. BHD. - AGROBAZAAR SENDAYAN (Mon-Fri|Sat: Half day|Sun close)",2.6994621,101.8586484,"57",65.49,65.49,89.90,89.90,81,106,25,23.41,23.41,88.62,"Thunderstorms. Scattered clouds. Warm.",31.00
75,1,"PASARAYA FATEEMAH",2.6477819,101.7468925,"50",65.50,65.50,88.39,88.39,81,106,25,23.02,23.02,89.37,"Thunderstorms. Scattered clouds. Warm.",31.00
76,1,"SHIN KONG LEE TRADING",2.6477285,101.7469879,"48",65.50,65.50,88.39,88.39,81,106,25,23.02,23.02,89.36,"Thunderstorms. Scattered clouds. Warm.",31.00
77,1,"YAHYA MINI MARKET",2.9498645,102.0888616,"46",65.57,65.57,122.56,122.56,112,121,8,31.05,31.05,127.32,"Overcast. Extremely hot.",35.28
78,1,"CHOP GUAN HONG",2.646738,101.746283,"24",65.58,65.58,88.50,88.50,81,106,25,23.05,23.05,89.47,"Thunderstorms. Scattered clouds. Warm.",31.00
79,1,"EUHUP ENTERPRISE",2.647971,101.751191,"57",65.63,65.63,88.83,88.83,83,108,25,23.13,23.13,89.80,"Thunderstorms. Scattered clouds. Warm.",31.00
80,1,"FATIMAH HASSAN ULLAH ENTERPRISE",2.6866853,101.846048,"56",66.02,66.02,91.46,91.46,83,108,25,23.82,23.82,90.88,"Thunderstorms. Scattered clouds. Warm.",31.00
81,1,"TNF MAJU ENTERPRISE",2.6878376,101.8484237,"47",66.04,66.04,91.63,91.63,84,108,25,23.86,23.86,90.69,"Thunderstorms. Scattered clouds. Warm.",31.00
82,1,"VIKA ENTERPRISE",2.7046855,101.8800407,"46",66.25,66.25,87.08,87.08,78,103,25,22.68,22.68,86.16,"Thunderstorms. Scattered clouds. Warm.",31.00
83,1,"MANTAU MINIMART (Fri: 12pm-3pm close)",2.7046733,101.8800297,"53",66.25,66.25,87.07,87.07,78,103,25,22.68,22.68,86.16,"Thunderstorms. Scattered clouds. Warm.",31.00
84,1,"GREEN APPLE STORE (PAGOH) SDN. BHD.",2.725993,101.911114,"56",66.26,66.26,82.14,82.14,74,100,26,21.43,21.43,91.56,"Overcast. Extremely hot.",35.28
85,1,"DS KOPITIAM (MONDAY CLOSED)",2.710255,101.888816,"69",66.27,66.27,85.75,85.75,76,101,25,22.33,22.33,85.98,"Thunderstorms. Scattered clouds. Warm.",31.00
86,1,"COOKING MASTER RESTAURANT (THURSDAY OFF) (OPEN 1PM)",2.726096,101.911406,"34",66.27,66.27,82.13,82.13,74,100,26,21.42,21.42,91.55,"Overcast. Extremely hot.",35.28
87,1,"KEDAI RUNCIT AA SMART (FRIDAY CLOSED)",2.708186,101.887739,"54",66.39,66.39,86.13,86.13,77,102,25,22.43,22.43,85.85,"Thunderstorms. Scattered clouds. Warm.",31.00
88,1,"LEAF VEGETARIAN",2.707843,101.888171,"53",66.45,66.45,86.12,86.12,77,102,25,22.43,22.43,86.23,"Thunderstorms. Scattered clouds. Warm.",31.00
89,1,"PASAR RAYA ARAFAH MAJU (Open everyday|Fri: 12.30pm-2.30pm close)",2.63956,101.7563291,"50",66.70,66.70,90.52,90.52,85,110,25,23.57,23.57,90.75,"Thunderstorms. Scattered clouds. Warm.",31.00
90,1,"CHOONG KHOON MUI (10AM start business) (Sunday Off)",2.740697,101.939021,"81",66.87,66.87,92.28,92.28,85,92,7,23.34,23.34,93.15,"Overcast. Extremely hot.",35.28
91,1,"PASARAYA JELITA (smnall lorry)",2.747932,101.953588,"50",67.30,67.30,93.01,93.01,86,94,7,23.52,23.52,93.91,"Overcast. Extremely hot.",35.28
