cluster_id,sequence,store_name,tonnage,cumulative_tonnage,p2p_dist_km,cumulative_dist_km,dist_to_origin_km,fuel_litres,latitude,longitude
197,1,"PAK DEEN FRESH & FROZEN SUPPLY (Mon-Sat: 9am-6pm)",51,51.000,17.324,17.324,17.324,5.006,3.096273,101.44454
198,1,"MAKASSAR FRESH MARKET SDN BHD",53,53.000,17.351,17.351,17.351,5.064,3.197221,101.712079
199,1,"7 PELANGI SDN BHD",56,56.000,17.743,17.743,17.743,5.259,3.20193959,101.7157807
200,1,"KA FRESH FARM SDN BHD (Fri: 12pm-3pm rest)",54,54.000,18.166,18.166,18.166,5.329,3.044568,101.526693
201,1,"AFIA MARIAM TRADING SDN BHD (LORI KECIL)",50,50.000,18.572,18.572,18.572,5.339,3.162200822,101.7176114
201,2,"SAKTI SRI AMBAL MAJU TRADING",48,98.000,0.486,19.057,18.249,0.138,3.15983,101.713936
202,1,"TOPZELLER (M) SDN BHD - SUPER SEVEN SETAPAK",46,46.000,18.825,18.825,18.825,5.306,3.199519,101.725462
202,2,"QCPLUS SDN. BHD. - SETAPAK (HQ)",49,95.000,0.346,19.171,18.507,0.099,3.198387,101.722557
203,1,"A MART SUPERSTORE SDN BHD",78,78.000,18.509,18.509,18.509,6.187,3.164167089,101.7175381
204,1,"MAMARAJ MINI MARKET (Mon-Sat: 9am-5.30pm|Fri: No delivery)",53,53.000,18.545,18.545,18.545,5.413,3.045206,101.602822
205,1,"PASARAYA WENG FOON SDN. BHD.",49,49.000,19.422,19.422,19.422,5.556,3.031843,101.53548
205,2,"PASAR MINI DAWOOD (Mon-Fri: 8.30am-6pm|Fri: 12pm-3pm rest|Sat: Close at 3pm)",51,100.000,3.811,23.233,18.607,1.101,3.046131,101.504283
206,1,"CHIA HUNG LI - KILANG KUIH-MUIH (No big truck)",50,50.000,19.973,19.973,19.973,5.742,3.087866,101.692126
206,2,"1 JUTA NASI LEMAK ENTERPRISE (K88 Food COURT)",30,80.000,1.326,21.299,18.680,0.347,3.093567658,101.6816377
207,1,"TWO SIX DELIGHT GARDEN CATERERS",46,46.000,18.785,18.785,18.785,5.295,3.063017,101.647217
208,1,"AAA MINI MARKET (Mon-Sat: 10am-6pm|Friday close)",81,81.000,18.926,18.926,18.926,6.439,3.055909,101.63768
209,1,"I AND D ENTERPRISE (Mon-Sat: 9am-6pm| Fri: NO DELIVERY)",55,55.000,18.944,18.944,18.944,5.586,3.055871,101.637959
210,1,"KML MINI MARKET (Mon-Fri: 8.30am-6pm|Sat: 4pm close)",53,53.000,18.944,18.944,18.944,5.529,3.055871,101.637959
211,1,"AMRI & HARTINI ENTERPRISE (Fri: 12pm-3pm close)",38,38.000,22.028,22.028,22.028,5.975,3.110411007,101.7301672
211,2,"CHAMPION FOOD SDN. BHD. (open 9am - 2pm)",40,78.000,3.233,25.262,19.035,0.885,3.132408666,101.7111244
212,1,"EIGHT ROAD RESTAURANT-deliver sebelum 12pm (angkat cheque)",57,57.000,19.121,19.121,19.121,5.697,3.04684,101.62288
213,1,"810 SPEEDMART SDN BHD (open 8am-4pm) (close 1pm-2pm) - SAT CLOSED",78,78.000,19.677,19.677,19.677,6.578,3.195203231,101.7329516
213,2,"CB FROZEN FOOD SDN. BHD. - SRI RAMPAI",19,97.000,0.674,20.351,19.377,0.168,3.200736131,101.7304739
214,1,"FS NUSANTARA MART (Friday: 12pm-3pm close)",56,56.000,19.390,19.390,19.390,5.747,3.035008,101.593601
215,1,"D A R RESOURCES (KEDAI MAKAN HARMONY)",72,72.000,19.426,19.426,19.426,6.275,3.0995071,101.4167627
216,1,"WANJIALI MARKETING SDN BHD",46,46.000,19.639,19.639,19.639,5.535,3.029864,101.535609
217,1,"AI KOPI ENTERPRISE (DELIVERY BY 4BY4)",12,12.000,21.408,21.408,21.408,5.172,3.086685362,101.7078735
217,2,"RESTORAN CHON SAI KEI",49,61.000,1.722,23.130,20.062,0.493,3.086921,101.692362
218,1,"ACCESS FOUR TRADING (Fri: Halfday for prayer)",62,62.000,22.577,22.577,22.577,6.905,3.196925,101.759184
218,2,"BESTA CORPORATION SDN BHD",22,84.000,3.256,25.833,20.266,0.821,3.217327111,101.7381495
219,1,"PASAR MINI LAILA ENTERPERISE (Fri: Close 12pm-3pm)",50,50.000,20.555,20.555,20.555,5.909,3.2040912,101.3708626
220,1,"FANAAS BISTRO (Restoran Alinas-Prima Beruntung)",57,57.000,20.865,20.865,20.865,6.216,3.392907,101.552295
221,1,"RESTORAN LIAN SIANG (Delivery at Gate F|Mon-Fri: 9.30am-11.30am & 1.30pm-3.30pm|Sat: Normal time)",48,48.000,20.990,20.990,20.990,5.975,3.052425,101.445092
222,1,"HONG WAH RESTAURANT (Delivery time: 7am-11.30am & 3pm-5pm)",55,55.000,21.068,21.068,21.068,6.212,3.0512,101.4456
223,1,"KEDAI KOPI & MAKANAN NAM SIANG (12PM-2PM: NO DELIVERY)",54,54.000,21.071,21.071,21.071,6.182,3.051185,101.445569
224,1,"ARL SUPER MART (Mon-Sat: 9am-5.30pm)",48,48.000,21.145,21.145,21.145,6.019,3.028178,101.625312
225,1,"AL AWWAL BISTRO",72,72.000,21.268,21.268,21.268,6.870,3.014075,101.560209
226,1,"PROFIT BEST TRADING (DELIVERY TO CUSTOMER'S HOUSE, PLEASE CALL 30 MINS BEFORE DELIVERY)",49,49.000,21.356,21.356,21.356,6.109,3.156252,101.741978
226,2,"PASARAYA MADEENA",50,99.000,1.053,22.409,21.336,0.303,3.147212,101.739155
227,1,"SHREE MAP JAYA SDN BHD (Mon-Fri: 9am-6pm|Sat: 9am-3pm)",48,48.000,21.899,21.899,21.899,6.234,3.040992,101.447262
227,2,"PENG HEONG HAKKA PAIKUT RESTAURANT",49,97.000,0.867,22.766,21.362,0.248,3.048432,101.444929
228,1,"KOFFEE & CO ENTERPRISE",53,53.000,21.519,21.519,21.519,6.281,3.021559,101.616834
229,1,"SCS JAYA ENTERPRISE (Fri: 12pm-3pm close)",48,48.000,21.745,21.745,21.745,6.190,3.136069,101.372825
229,2,"PASAR MINI THANA (Mon-Sat: 8.30am-6pm)",50,98.000,0.484,22.229,21.548,0.139,3.133012,101.375926
230,1,"NEW XUN FATT ENTERPRISE (Morning - Lori besar tak boleh masuk)",51,51.000,21.765,21.765,21.765,6.289,3.156144,101.745755
231,1,"AMPANG GROCERS SDN BHD",97,97.000,21.906,21.906,21.906,8.233,3.158203235,101.7475888
232,1,"29 GROCER (Open 8.30am-5.30pm)",20,20.000,23.407,23.407,23.407,5.852,3.131789,101.753551
232,2,"CB FROZEN FOOD SDN. BHD. - PANDAN JAYA (Monday-Saturday: 8am-5pm)",14,34.000,1.328,24.735,22.080,0.324,3.135418376,101.7421538
233,1,"KEDAI RUNCIT MULIA SEJATI",54,54.000,22.534,22.534,22.534,6.611,3.007,101.597852
234,1,"KEDAI RUNCIT YUSUF ALI ENTERPRISE (Mon-Sat: 9am-6pm|Fri: No delivery)",54,54.000,23.413,23.413,23.413,6.869,3.0345,101.432688
234,2,"YK SEMENTA TRADING (MON: No receiving)",46,100.000,8.839,32.252,23.239,2.491,3.093395,101.37922
235,1,"SHAHRUL FRESH & FROZEN (M) SDN BHD (Fri: Close during Jumaat prayer)",48,48.000,26.299,26.299,26.299,7.486,3.054135,101.738171
235,2,"AMAN RAHIM ENTERPRISE",49,97.000,3.037,29.336,23.271,0.869,3.073115126,101.7185008
236,1,"PASAR MINI BERLIAN (Mon-Sat: 9am-6pm| Fri: 12pm-3pm rest| Sat: 3pm close)",51,51.000,23.336,23.336,23.336,6.743,3.158593,101.760915
237,1,"MUAR STATION SDN. BHD.",52,52.000,23.342,23.342,23.342,6.779,2.996204,101.574596
238,1,"BNS MINI MARKET (Mon-Sat: 10am-7pm|Fri: 12pm-3pm rest)",44,44.000,23.415,23.415,23.415,6.536,3.034485,101.43268
238,2,"PASAR MINI EUPHORIA (Mon-Sat: 9am-6pm|Fri: 12pm-3pm rest)",51,95.000,0.002,23.417,23.412,0.001,3.034498,101.432695
239,1,"MM MULTIPURPORSE MARKET (Mon-Sat: 9.30am-6pm|Fri: 12pm-3pm rest)",52,52.000,23.417,23.417,23.417,6.800,3.034387,101.432778
239,2,"SAJIAN AMBANG SDN BHD",48,100.000,0.005,23.422,23.413,0.002,3.034434,101.432771
240,1,"MAFANA RESOURCES SDN BHD (Fri: 1pm-2pm rest)",53,53.000,23.414,23.414,23.414,6.834,3.034471,101.432701
241,1,"KZ KIOSK (Mon-Sat: 9am-6pm|Fri: 12pm-3pm)",53,53.000,23.416,23.416,23.416,6.835,3.034461,101.432692
242,1,"PASAR MINI AM (OPEN ON MONDAY-SUNDAY | CLOSE ON FRIDAY AT 12PM-3PM)",51,51.000,23.418,23.418,23.418,6.767,3.03442,101.432716
243,1,"NAZURAH RESOURCES (MON-SAT : 8AM-6PM | FRI CLOSED AT 12PM-3PM)",52,52.000,23.420,23.420,23.420,6.801,3.034433,101.432673
244,1,"PASARAYA HAPPY HAPPY (Mon-Sat: 9am-6pm)",50,50.000,23.420,23.420,23.420,6.733,3.034433,101.432673
245,1,"SRI DEVI STORE (Delivery by salesman)",47,47.000,24.405,24.405,24.405,6.913,3.026502,101.428519
245,2,"NOVI FROZEN FOODS (Mon-Sat: 10am-6pm|Fri: No delivery)",51,98.000,0.988,25.393,23.425,0.285,3.03432,101.432747
246,1,"CB FROZEN FOOD SDN BHD - CHERAS BRANCH  8AM-5PM",81,81.000,23.674,23.674,23.674,8.055,3.10863638,101.7459843
247,1,"KEDAI UBAT DAN RUNCIT GUEY HONG -OPEN 9.30AM",54,54.000,23.762,23.762,23.762,6.971,3.12503,101.754355
248,1,"BEAUTY LIVING (PANDAN INDAH) SDN. BHD. (Open receiving 9am-6pm)",69,69.000,23.773,23.773,23.773,7.552,3.129901994,101.7563689
249,1,"HASIL LAUT SEONG KEE SDN BHD - KOTA KEMUNING",55,55.000,23.866,23.866,23.866,7.037,2.990831,101.54759
250,1,"MY A1 SDN BHD",52,52.000,23.906,23.906,23.906,6.942,3.2021103,101.3406998
251,1,"MY A1 SDN BHD-DESA COALFIELDS",52,52.000,23.906,23.906,23.906,6.942,3.2021103,101.3406998
252,1,"MAKANAN LAUT YOKE HENG (Monday close|Delivery time: 8am-11.30am)",53,53.000,24.090,24.090,24.090,7.031,3.046177,101.703246
253,1,"GAJA STORE PLT (Mon-Sat: 9am-7pm)",56,56.000,24.415,24.415,24.415,7.237,2.995582,101.621139
254,1,"PASAR MINI RASMI (Mon-Sat: 8.30am-6pm| Fri: 12pm-3pm rest| Sat: 3pm close)",50,50.000,24.485,24.485,24.485,7.039,3.152606,101.770132
255,1,"RESTORAN SEGAR PERTAMA",48,48.000,24.551,24.551,24.551,6.988,3.088366,101.743564
255,2,"BIG TREE PLT (24 Hrs - Every 2 weeks off 1 day)",15,63.000,0.032,24.582,24.522,0.008,3.088609843,101.7434149
256,1,"DIVINE MART (Mon-Sat: 9am-6pm)",15,15.000,26.181,26.181,26.181,6.406,2.986935,101.46782
256,2,"WING SMG TRADING (MON-FRI : 8AM-6PM | SAT CLOSED AT 3PM)",46,61.000,1.903,28.084,24.529,0.536,3.003932,101.465793
257,1,"WAI CHOON TRADING (Mon-Sat: 1pm-6pm)",46,46.000,24.790,24.790,24.790,6.988,3.12848,101.765613
257,2,"PASAR MINI IZHARI (Open 10am-11pm|Fri: 12pm-3pm close)",51,97.000,0.111,24.901,24.700,0.032,3.129297,101.765041
258,1,"KEDAI RUNCIT THAHIR ( FRIDAY CLOSE)",54,54.000,25.433,25.433,25.433,7.461,3.11127,101.764819
259,1,"PASAR SEGAR ARIFFIN ARAFAT (Mon-Sat: 9am-6pm)",50,50.000,25.696,25.696,25.696,7.388,2.989558,101.638945
260,1,"KEDAI RUNCIT MURAH JAYA (Fri: 1pm-5pm close)",54,54.000,25.866,25.866,25.866,7.588,3.129166,101.776144
261,1,"PASAR MINI REZEKI (Fri: 1pm-5pm close)",50,50.000,26.248,26.248,26.248,7.546,3.069912,101.749662
262,1,"JW GLOBAL JAYA TRADING",54,54.000,26.335,26.335,26.335,7.726,2.974097,101.6074419
263,1,"AA WORLD ENTERPRISE (Fri: Close during prayer)",24,24.000,27.044,27.044,27.044,6.881,3.046857,101.740794
263,2,"SUPER SEVEN (M) SDN BHD - SG BULOH",47,71.000,0.635,27.678,26.440,0.180,3.049089,101.735535
264,1,"KOPITIAM SIN LAI KEE (9am-4pm)",53,53.000,26.798,26.798,26.798,7.822,3.192175,101.314981
265,1,"FORTRESS AVENUE SDN BHD(88 Sp mart)",56,56.000,26.978,26.978,26.978,7.996,3.058429,101.749406
266,1,"PASARAYA ALAM JAYA SDN BHD",50,50.000,27.009,27.009,27.009,7.765,3.079911,101.764348
266,2,"RAMZAN MINI MARKET (Fri: Close 1pm-5pm)",49,99.000,0.062,27.071,27.009,0.018,3.080386,101.764632
267,1,"PASAR MINI BERKAT BONDA (Mon-Sat: 9.30am-6pm|Fri:12pm-3pm)",51,51.000,27.036,27.036,27.036,7.812,3.027898,101.722515
268,1,"HASIL LAUT SEONG KEE SDN BHD - SERI KEMBANGAN",55,55.000,27.155,27.155,27.155,8.007,3.017334,101.712136
269,1,"CHECKERS HYPERMARKET S/B - DELIVER TO CHERAS (Sat: Receiving halfday)",90,90.000,27.231,27.231,27.231,9.786,3.051664,101.746996
270,1,"B CART TRADING",97,97.000,27.279,27.279,27.279,10.252,3.026672,101.724401
271,1,"PASAR MINI UMA",50,50.000,27.292,27.292,27.292,7.847,3.028052,101.726036
272,1,"PASARAYA JUST RIGHT SDN BHD",50,50.000,27.848,27.848,27.848,8.006,3.00698,101.709171
272,2,"WIGNES MINI MARKET SDN BHD.",46,96.000,0.284,28.133,27.715,0.080,3.009313,101.710221
273,1,"CHAW ENTERPRISE (SJK (C) KUNG MAN) - (Mon to Fri - After 2pm) (4pm Close)",89,89.000,27.954,27.954,27.954,9.984,3.015506777,101.7211052
274,1,"PEMBORONG BARANG RUNCIT SOON SHENG",49,49.000,28.710,28.710,28.710,8.213,3.018567,101.734572
274,2,"NYS FOOD MART SDN BHD - BALAKONG",51,100.000,0.740,29.450,28.049,0.214,3.024932,101.732613
275,1,"MTK MART (Open 6am-3.30pm)",52,52.000,29.062,29.062,29.062,8.440,3.027616,101.747958
275,2,"SINTAK KEE FOODS TRADING",47,99.000,1.359,30.421,28.253,0.385,3.039787,101.749066
276,1,"GURUNG MARKETING",56,56.000,28.799,28.799,28.799,8.536,3.023968,101.741204
277,1,"MANJUMA TRADING (Fri: Close during prayer)",53,53.000,28.991,28.991,28.991,8.462,3.027694,101.747156
278,1,"A S M FAHIM HOLDINGS SDN BHD (Fri: 1pm-3pm rest)",82,82.000,29.397,29.397,29.397,10.061,3.024007,101.748703
279,1,"RAISHA MAJU TRADING (Fri: 1pm-3pm rest)",49,49.000,29.481,29.481,29.481,8.434,3.02444,101.750149
280,1,"K 1 TOP ENTERPRISE (Fri: 12.30pm-2.30pm close)",54,54.000,29.485,29.485,29.485,8.650,3.024029,101.749812
281,1,"WAN SHENG MINI MARKET (Tue: Close|Delivery after 11.30am)",46,46.000,29.891,29.891,29.891,8.425,3.045525,101.772506
281,2,"MH WORLD SOLUTIONS SDN. BHD. (Fri: 1pm-3pm close)",53,99.000,0.750,30.641,29.744,0.219,3.051661,101.7753
282,1,"SUPER SEVEN CASH & CARRY SDN BHD - BALAKONG",47,47.000,30.071,30.071,30.071,8.518,3.03882,101.769435
282,2,"WAI LUN ENTERPRISE",46,93.000,0.198,30.269,29.958,0.056,3.038294,101.767729
283,1,"MYS BORONG MART",52,52.000,29.986,29.986,29.986,8.708,3.04488,101.773084
284,1,"NEH LAH FRESH MARKET",52,52.000,30.062,30.062,30.062,8.730,3.004944,101.737784
285,1,"SUPER SEVEN (M) SDN BHD - CHERAS JAYA",47,47.000,30.946,30.946,30.946,8.766,3.021717,101.765476
285,2,"BONKEE YUAN TRADING SDN. BHD. - PASAR RAYA SEGAR FRESH BOULEVARD",51,98.000,1.925,32.871,30.149,0.556,3.038428,101.770019
286,1,"ALTA JAYA ENTERPRISE",66,66.000,30.599,30.599,30.599,9.562,3.01451,101.754604
287,1,"SYARIKAT NG KEONG DAN ANAK-ANAK",47,47.000,33.998,33.998,33.998,9.630,3.028612,101.805897
287,2,"YUANS F&B SDN BHD (WEDNESDAY CLOSE)",46,93.000,3.469,37.467,30.773,0.978,3.054418,101.788344
288,1,"CB WHOLESALE MART SDN BHD - SUNGAI BULOH",31,31.000,30.803,30.803,30.803,8.088,3.2105831,101.2785965
288,2,"CB FROZEN FOOD SDN. BHD. - SUNGAI BULOH (Monday-Saturday: 8am-5pm)",62,93.000,0.000,30.803,30.803,0.000,3.2105831,101.2785965
289,1,"THIRTY THREE WALMART",47,47.000,31.515,31.515,31.515,8.927,3.385178767,101.7753856
290,1,"PASAR SEGAR SSV (RABU TUTUP)",50,50.000,31.935,31.935,31.935,9.181,2.998456,101.755537
291,1,"KAY 9 ENTERPRISE",54,54.000,31.975,31.975,31.975,9.380,2.996747,101.75427
292,1,"SURE WIN CLAYPOT SEAFOOD PORRIDGE SDN BHD (open 10am-3am)",47,47.000,32.000,32.000,32.000,9.064,3.398899596,101.7692864
293,1,"HASIL LAUT SEONG KEE SDN BHD - BALAKONG JAYA",55,55.000,32.194,32.194,32.194,9.493,2.995897,101.756235
294,1,"QXQY MANAGEMENT SDN. BHD.",49,49.000,32.765,32.765,32.765,9.373,2.992807,101.760437
294,2,"PERNIAGAAN XING FAI (FRIDAY OFF)",49,98.000,0.520,33.285,32.287,0.149,2.99464,101.756126
295,1,"GENTING GOLF COURSE BHD",56,56.000,32.739,32.739,32.739,9.704,3.396671266,101.7801231
296,1,"GENTING MALAYSIA BERHAD",56,56.000,32.739,32.739,32.739,9.704,3.396671266,101.7801231
297,1,"PASAR FAMILY MART - NZ MAJESTIC PLT",51,51.000,33.580,33.580,33.580,9.703,2.980735,101.758214
298,1,"SAI VINA CASH & CARRY (Mon-Sat: 9am-6pm|Sat close at 1pm)",48,48.000,34.223,34.223,34.223,9.742,2.909877,101.469573
299,1,"JT TRADING SDN BHD (855251-H) (KAJANG)",54,54.000,34.226,34.226,34.226,10.041,2.999403,101.785137
300,1,"RESTORAN HABEEB MAJU",49,49.000,36.406,36.406,36.406,10.415,2.955961,101.768493
300,2,"NYS FOOD MART SDN BHD - KAJANG",51,100.000,3.167,39.572,35.027,0.915,2.982452,101.778964
301,1,"HOCK MEI TRADING SDN BHD",55,55.000,35.565,35.565,35.565,10.487,2.953699,101.753766
302,1,"PASARAYA HIJRAH (PELITA HIJRAH SDN BHD)",50,50.000,36.084,36.084,36.084,10.374,3.3027231,101.2459559
302,2,"RESTORAN SIDDIQ",48,98.000,6.269,42.354,35.844,1.785,3.2472475,101.2358762
303,1,"SB GLORY SDN BHD",48,48.000,35.974,35.974,35.974,10.240,3.425583455,101.7933386
304,1,"ION DELEMEN HOSPITALITY SDN BHD",55,55.000,36.209,36.209,36.209,10.677,3.434466307,101.7877331
305,1,"RESTORAN BANGI IMPIAN MAJU (LUTHFIA ALLIANCE SDN. BHD.)",49,49.000,36.357,36.357,36.357,10.401,2.955825,101.767651
306,1,"HOCK MEI TRADING (SG. CHUA) SDN BHD",55,55.000,36.489,36.489,36.489,10.760,2.955156,101.768711
307,1,"KEDAI RUNCIT JHARSWIN  (Mon-Sat: 9am-6pm)",54,54.000,44.297,44.297,44.297,12.995,2.812952,101.486907
307,2,"ZUHAIRINA FAMILY ENTERPRISE (Mon-Sat: 9am-6pm|Fri: No delivery)",46,100.000,24.075,68.372,36.862,6.786,2.962411,101.330055
308,1,"FROZEN KEN SDN. BHD.",56,56.000,37.565,37.565,37.565,11.134,2.991688,101.818101
309,1,"YS HYPER",46,46.000,38.298,38.298,38.298,10.795,2.972344,101.810053
309,2,"RESTORAN URAT KETING",48,94.000,0.365,38.662,37.997,0.104,2.975536,101.809302
310,1,"BERKAT MADINA MART (Mon-Fri: 8am-5.30pm| Fri: 12pm-3pm rest| Sat: 4.30 pm close)",87,87.000,40.854,40.854,40.854,14.412,2.850165,101.650302
311,1,"BIRMIR CASH & CARRY",70,70.000,43.113,43.113,43.113,13.772,2.94739,101.845925
312,1,"SEMENYIH FROZEN FOOD MART",48,48.000,43.220,43.220,43.220,12.303,2.943634,101.843827
312,2,"MING TAI FOOD (M) SDN BHD (SEMENYIH)",52,100.000,0.094,43.314,43.127,0.027,2.944318,101.843327
313,1,"PASAR MINI SRI RAAMA",50,50.000,43.163,43.163,43.163,12.409,2.946532,101.845759
314,1,"CHOP TOON CHOON THONG",92,92.000,43.165,43.165,43.165,15.709,2.946493,101.845751
315,1,"NYS FOOD MART SDN BHD - SEMENYIH",51,51.000,43.188,43.188,43.188,12.479,2.946046,101.845624
315,2,"V.S.VARUSAI IBRAHIM & CO.",46,97.000,0.026,43.213,43.176,0.007,2.946268,101.845684
316,1,"CLC WHOLESALER (SEMENYIH) SDN BHD",80,80.000,43.229,43.229,43.229,14.622,2.944514,101.844746
317,1,"BAN BEE HUAT ENTERPRISE",86,86.000,44.194,44.194,44.194,15.495,2.81213,101.497758
318,1,"PASAR RAYA SAROJA UTAMA",50,50.000,46.154,46.154,46.154,13.269,2.8281921,101.7296673
319,1,"BANG SHENG TRADING",50,50.000,47.658,47.658,47.658,13.702,2.85325,101.800804
319,2,"PEMBORONG BARANG RUNCIT HUP SOON",49,99.000,0.218,47.877,47.449,0.062,2.854478,101.799272
320,1,"RESTORAN KIM FONG N TIGA (Open: 7am-5pm|No delivery during lunch time)",48,48.000,47.680,47.680,47.680,13.572,2.857408,101.807033
321,1,"YI HONG CHUAN ENTERPRISE (hantar sebelum 9.30am)",46,46.000,48.150,48.150,48.150,13.572,2.811894,101.73719
321,2,"NBK MAJU ENTERPRISE (M) SDN. BHD.",52,98.000,0.413,48.563,47.752,0.120,2.8147332,101.7347885
322,1,"JIMAT BERANANG ENTERPRISE - BERANANG",55,55.000,47.781,47.781,47.781,14.089,2.9057,101.86448
323,1,"FM COLLECTION SDN BHD",56,56.000,48.405,48.405,48.405,14.347,2.853037,101.812113
324,1,"FOOD FARM SDN. BHD.",56,56.000,48.798,48.798,48.798,14.463,2.849691,101.813525
325,1,"SEMENYIH FOODMART SDN BHD",48,48.000,50.898,50.898,50.898,14.488,2.790236,101.749262
325,2,"N NINE MINI MARKET",52,100.000,2.932,53.831,49.297,0.852,2.812944,101.762688
326,1,"1 BABA STORE SDN BHD",20,20.000,51.543,51.543,51.543,12.886,2.822197,101.817315
326,2,"PASAR MINI GNR - MANTIN",51,71.000,4.399,55.941,50.201,1.271,2.854344,101.840394
327,1,"CHUN MENG ENTERPRISE-DELIVER AFTER 12PM- SMALL LORRY (no red packing csr)",70,70.000,51.575,51.575,51.575,16.475,2.818956,101.813013
328,1,"BAIDURI BIJAKSANA SDN. BHD.",96,96.000,51.708,51.708,51.708,19.307,2.818299,101.814185
329,1,"CB FROZEN FOOD SDN BHD - NILAI BRANCH",64,64.000,51.719,51.719,51.719,15.988,2.818216,101.814241
330,1,"BUSY CORNER SDN BHD",54,54.000,51.729,51.729,51.729,15.176,2.810548,101.802492
331,1,"SEMARAK MART TRADING",48,48.000,51.750,51.750,51.750,14.731,2.818333,101.814914
332,1,"CT EXTRA STORES SDN BHD - DELIVERY B4 5PM & SAT OFF",80,80.000,51.769,51.769,51.769,17.510,2.817867,101.814519
333,1,"JINJANG LEE FROZEN SDN BHD",55,55.000,51.775,51.775,51.775,15.267,2.817905,101.814686
334,1,"HASIL LAUT SEONG KEE SDN. BHD. - NILAI",55,55.000,51.819,51.819,51.819,15.280,2.817414,101.814662
335,1,"KK EGGS TRADING SDN. BHD. - NILAI (Please call before delivery)",53,53.000,51.844,51.844,51.844,15.132,2.812987,101.808284
336,1,"CANDRIKAA CASH & CARRY (10AM-6PM)",100,100.000,51.895,51.895,51.895,19.893,2.81569,101.813293
337,1,"ANNACHI WHOLESALE CASH & CARRY (M) SDN. BHD.",75,75.000,51.896,51.896,51.896,17.052,2.815707,101.813339
338,1,"YUZIE MINI MARKET",46,46.000,52.510,52.510,52.510,14.801,2.803548,101.80454
338,2,"KINGSLEY FROZEN & GROCERIES (CALL BEFORE DELIVERY)",53,99.000,1.517,54.027,52.219,0.443,2.798922,101.791689
339,1,"RECRON (MALAYSIA) SDN BHD - NILAI GENERAL PLANT",49,49.000,52.247,52.247,52.247,14.946,2.814763,101.8176278
340,1,"MARWA STORE",53,53.000,52.909,52.909,52.909,15.443,2.80255,101.80972
341,1,"VMAS MINI MARKET",46,46.000,56.607,56.607,56.607,15.955,2.82302,101.89265
341,2,"PASARAYA MILLENNIUM (MANTIN) SDN BHD(OFF FRI-SAT)",50,96.000,1.403,58.010,55.378,0.403,2.827368,101.88079
342,1,"CHOP SHING LOONG",37,37.000,61.850,61.850,61.850,16.697,3.021308,102.081692
342,2,"PATTANA TOMYAM SEAFOOD (Open 1pm-11pm|Wed close)",49,86.000,2.274,64.124,60.045,0.651,3.0382979,102.0702886
343,1,"C S HUAT ENTERPRISE",10,10.000,61.017,61.017,61.017,14.619,2.656578,101.560182
343,2,"KEDAI TONG HUAT",54,64.000,0.393,61.410,60.639,0.115,2.659987,101.561115
344,1,"PASAR MINI BEE HENG",51,51.000,60.708,60.708,60.708,17.541,2.659424,101.565626
345,1,"KIM HOK HIN SDN BHD",53,53.000,61.210,61.210,61.210,17.866,2.690545,101.751322
346,1,"CHOP CHEN HENG (open 10.30am)",84,84.000,61.247,61.247,61.247,21.215,2.69016,101.751236
347,1,"YJK MINI MARKET",46,46.000,61.718,61.718,61.718,17.396,2.6850488,101.7496854
347,2,"TONG SOON CHIN (PJB TAK BOLEH MASUK)",46,92.000,0.310,62.029,61.408,0.087,2.6877022,101.7488175
348,1,"PASAR MINI SEONG HENG",50,50.000,62.607,62.607,62.607,17.999,2.949416,102.058253
348,2,"SS HAPPY MART (WONG KONG WUI)",47,97.000,3.043,65.649,61.466,0.862,2.976721,102.060039
349,1,"KEDAI RUNCIT YUNG SHIM",54,54.000,62.664,62.664,62.664,18.384,2.949202,102.058724
349,2,"VPS FAMILY H MART",46,100.000,0.427,63.091,62.262,0.120,2.949694,102.05491
350,1,"LIM KEE MEI WEI TRADING",53,53.000,62.790,62.790,62.790,18.327,2.678614,101.759916
351,1,"KEDAI RUNCIT NASHIRA - TIARA SENDAYAN",54,54.000,63.249,63.249,63.249,18.555,2.7016046,101.8206197
352,1,"TQ BESTARI SDN BHD (FRIDAY 12.30PM-2.30PM OFF)",46,46.000,63.546,63.546,63.546,17.911,2.94377,102.064858
353,1,"NZ MAJESTIC PLT (Fri: 1pm-2pm close)",51,51.000,63.824,63.824,63.824,18.442,2.7011993,101.8308397
354,1,"KEDAI RUNCIT NASHIRA - GADONG JAYA",54,54.000,63.871,63.871,63.871,18.738,2.7010358,101.8314265
355,1,"BAN SING SUNDRY ENTERPRISE",87,87.000,64.357,64.357,64.357,22.703,2.939717,102.070984
356,1,"YAHYA MINI MARKET",46,46.000,65.630,65.630,65.630,18.499,2.9498645,102.0888616
356,2,"RESTORAN NOR FALAH (Open 7.30am-8pm)",48,94.000,2.259,67.889,64.380,0.643,2.9397397,102.0712292
357,1,"SIM YAM HOE SDN BHD",47,47.000,64.563,64.563,64.563,18.287,2.7491817,101.9157683
357,2,"PASAR MINI A.T.N (11am-11pm)",51,98.000,2.117,66.679,64.394,0.612,2.762337,101.929541
358,1,"SP MEGA FROZEN FOOD SDN BHD (3PM CLOSE)",47,47.000,64.889,64.889,64.889,18.380,2.644006,101.715883
358,2,"MY SUPER STORE SDN BHD",52,99.000,0.356,65.246,64.757,0.103,2.644342,101.712694
359,1,"FLT TRADING",56,56.000,64.961,64.961,64.961,19.254,2.654825,101.751895
360,1,"PASAR MINI YC YEE CHIN",50,50.000,65.031,65.031,65.031,18.696,2.643147,101.717513
361,1,"SIN MAH LEE ENTERPRISE",47,47.000,65.354,65.354,65.354,18.512,2.649425,101.747163
361,2,"NS HONG FATT ENTERPRISE SDN BHD",51,98.000,0.433,65.787,65.162,0.125,2.6522,101.749893
362,1,"G.U.S. (SUNGAI PELEK) SDN BHD",56,56.000,65.193,65.193,65.193,19.323,2.6406676,101.7141079
363,1,"CHIN MEE (Thu: NO DELIVERY)",92,92.000,65.294,65.294,65.294,23.762,2.640419407,101.7165745
364,1,"REZEKI FOOD STUFF ENTERPRISE",48,48.000,65.387,65.387,65.387,18.613,2.6387622,101.7137659
365,1,"CHOP GUAN HONG",24,24.000,65.605,65.605,65.605,16.692,2.646738,101.746283
365,2,"HANESH ENTERPRISE",55,79.000,3.823,69.428,65.451,1.127,2.6379591,101.7130079
366,1,"SHIN KONG LEE TRADING",48,48.000,65.526,65.526,65.526,18.652,2.6477285,101.7469879
366,2,"PASARAYA FATEEMAH",50,98.000,0.012,65.539,65.517,0.003,2.6477819,101.7468925
367,1,"FAMA CORPORATION SDN. BHD. - AGROBAZAAR SENDAYAN (Mon-Fri|Sat: Half day|Sun close)",57,57.000,65.522,65.522,65.522,19.521,2.6994621,101.8586484
368,1,"EUHUP ENTERPRISE",57,57.000,65.654,65.654,65.654,19.560,2.647971,101.751191
369,1,"FATIMAH HASSAN ULLAH ENTERPRISE",56,56.000,66.053,66.053,66.053,19.577,2.6866853,101.846048
370,1,"TNF MAJU ENTERPRISE",47,47.000,66.070,66.070,66.070,18.714,2.6878376,101.8484237
371,1,"MANTAU MINIMART (Fri: 12pm-3pm close)",53,53.000,66.284,66.284,66.284,19.347,2.7046733,101.8800297
371,2,"VIKA ENTERPRISE",46,99.000,0.002,66.286,66.284,0.001,2.7046855,101.8800407
372,1,"COOKING MASTER RESTAURANT (THURSDAY OFF) (OPEN 1PM)",34,34.000,66.309,66.309,66.309,17.652,2.726096,101.911406
372,2,"GREEN APPLE STORE (PAGOH) SDN. BHD.",56,90.000,0.034,66.343,66.299,0.010,2.725993,101.911114
373,1,"DS KOPITIAM (MONDAY CLOSED)",69,69.000,66.302,66.302,66.302,21.063,2.710255,101.888816
374,1,"KEDAI RUNCIT AA SMART (FRIDAY CLOSED)",54,54.000,66.427,66.427,66.427,19.488,2.708186,101.887739
375,1,"AUTHENTIC CHARCOAL GRILL HOUSE -  DELIVERY BY THOMAS",24,24.000,69.084,69.084,69.084,17.577,2.694291,101.909831
375,2,"LEAF VEGETARIAN",53,77.000,2.839,71.922,66.486,0.829,2.707843,101.888171
376,1,"PASAR RAYA ARAFAH MAJU",50,50.000,70.543,70.543,70.543,20.281,2.6059925,101.7643781
376,2,"PASAR RAYA ARAFAH MAJU (Open everyday|Fri: 12.30pm-2.30pm close)",50,100.000,3.838,74.382,66.725,1.103,2.63956,101.7563291
377,1,"CHOONG KHOON MUI (10AM start business) (Sunday Off)",81,81.000,66.917,66.917,66.917,22.768,2.740697,101.939021
378,1,"PERNIAGAAN AL-AMIN",49,49.000,67.592,67.592,67.592,19.336,2.742156,101.950236
378,2,"PASARAYA JELITA (smnall lorry)",50,99.000,0.742,68.334,67.347,0.213,2.747932,101.953588
379,1,"HOE HIN ENTERPRISE S/B-SMALL LORI-DELIVER TUE-THUR 8.30-12PM, TUE-FRI-2-4pm",55,55.000,67.498,67.498,67.498,19.903,2.73166,101.936167
380,1,"JT TRADING SDN BHD (855251-H)",54,54.000,67.569,67.569,67.569,19.823,2.7316173,101.9371433
381,1,"MING TAI FOOD (M) SDN BHD (MING TAI FOODMART)",52,52.000,67.582,67.582,67.582,19.626,2.731495,101.9371698
382,1,"KEDAI RUNCIT AA MART SDN. BHD.",54,54.000,67.651,67.651,67.651,19.846,2.6810546,101.8651364
383,1,"CHOP KHOON SENG (MON TO SAT)",24,24.000,67.951,67.951,67.951,17.288,2.728787,101.939099
383,2,"JINJANG LEE FROZEN SDN. BHD. (SEREMBAN)",55,79.000,0.259,68.209,67.692,0.076,2.730515,101.937536
384,1,"118 FRESHMART",40,40.000,74.587,74.587,74.587,20.423,3.097621,102.219079
384,2,"TONGKAH BIDUANDA TRADING - CHE LAH MART",46,86.000,18.681,93.268,67.820,5.265,2.9640737,102.1170045
385,1,"KEDAI VOON FAH (10 TON LORI BOLEH MASUK SAJA)",54,54.000,68.028,68.028,68.028,19.957,2.727921,101.93914
386,1,"SIKAMAT POINT",48,48.000,68.298,68.298,68.298,19.441,2.7487968,101.9674873
