cluster_id,sequence_order,lat,lon,cumulative_distance_km,store_name
113,1,3.024932,101.732613,31.8737,"NYS FOOD MART SDN BHD - BALAKONG"
114,1,3.046857,101.740794,31.9417,"AA WORLD ENTERPRISE (Fri: Close during prayer)"
115,1,3.131789,101.753551,32.0280,"29 GROCER (Open 8.30am-5.30pm)"
116,1,3.12503,101.754355,32.1187,"KEDAI UBAT DAN RUNCIT GUEY HONG -OPEN 9.30AM"
117,1,3.069912,101.749662,32.2692,"PASAR MINI REZEKI (Fri: 1pm-5pm close)"
118,1,3.018567,101.734572,32.3384,"PEMBORONG BARANG RUNCIT SOON SHENG"
119,1,3.129901994,101.7563689,32.3395,"BEAUTY LIVING (PANDAN INDAH) SDN. BHD. (Open receiving 9am-6pm)"
120,1,3.051664,101.746996,32.4567,"CHECKERS HYPERMARKET S/B - DELIVER TO CHERAS (Sat: Receiving halfday)"
121,1,3.058429,101.749406,32.5253,"FORTRESS AVENUE SDN BHD(88 Sp mart)"
122,1,3.023968,101.741204,32.8024,"GURUNG MARKETING"
123,1,3.158593,101.760915,33.0092,"PASAR MINI BERLIAN (Mon-Sat: 9am-6pm| Fri: 12pm-3pm rest| Sat: 3pm close)"
124,1,3.039787,101.749066,33.0502,"SINTAK KEE FOODS TRADING"
125,1,3.004944,101.737784,33.2673,"NEH LAH FRESH MARKET"
126,1,3.027694,101.747156,33.2785,"MANJUMA TRADING (Fri: Close during prayer)"
127,1,3.129297,101.765041,33.3022,"PASAR MINI IZHARI (Open 10am-11pm|Fri: 12pm-3pm close)"
128,1,3.11127,101.764819,33.3355,"KEDAI RUNCIT THAHIR ( FRIDAY CLOSE)"
129,1,3.027616,101.747958,33.3652,"MTK MART (Open 6am-3.30pm)"
130,1,3.12848,101.765613,33.3657,"WAI CHOON TRADING (Mon-Sat: 1pm-6pm)"
131,1,3.196925,101.759184,33.5155,"ACCESS FOUR TRADING (Fri: Halfday for prayer)"
132,1,3.024007,101.748703,33.5804,"A S M FAHIM HOLDINGS SDN BHD (Fri: 1pm-3pm rest)"
133,1,3.079911,101.764348,33.6696,"PASARAYA ALAM JAYA SDN BHD"
134,1,3.080386,101.764632,33.6922,"RAMZAN MINI MARKET (Fri: Close 1pm-5pm)"
135,1,3.024029,101.749812,33.6951,"K 1 TOP ENTERPRISE (Fri: 12.30pm-2.30pm close)"
136,1,3.02444,101.750149,33.7144,"RAISHA MAJU TRADING (Fri: 1pm-3pm rest)"
137,1,3.152606,101.770132,33.9695,"PASAR MINI RASMI (Mon-Sat: 8.30am-6pm| Fri: 12pm-3pm rest| Sat: 3pm close)"
138,1,3.129166,101.776144,34.5350,"KEDAI RUNCIT MURAH JAYA (Fri: 1pm-5pm close)"
139,1,3.01451,101.754604,34.5702,"ALTA JAYA ENTERPRISE"
140,1,3.038294,101.767729,35.0800,"WAI LUN ENTERPRISE"
141,1,2.812952,101.486907,35.2152,"KEDAI RUNCIT JHARSWIN  (Mon-Sat: 9am-6pm)"
142,1,3.03882,101.769435,35.2448,"SUPER SEVEN CASH & CARRY SDN BHD - BALAKONG"
143,1,2.996747,101.75427,35.3112,"KAY 9 ENTERPRISE"
144,1,3.038428,101.770019,35.3194,"BONKEE YUAN TRADING SDN. BHD. - PASAR RAYA SEGAR FRESH BOULEVARD"
145,1,2.998456,101.755537,35.3607,"PASAR SEGAR SSV (RABU TUTUP)"
146,1,3.045525,101.772506,35.3690,"WAN SHENG MINI MARKET (Tue: Close|Delivery after 11.30am)"
147,1,2.81213,101.497758,35.4094,"BAN BEE HUAT ENTERPRISE"
148,1,3.021717,101.765476,35.4177,"SUPER SEVEN (M) SDN BHD - CHERAS JAYA"
149,1,3.04488,101.773084,35.4498,"MYS BORONG MART"
150,1,3.051661,101.7753,35.4972,"MH WORLD SOLUTIONS SDN. BHD. (Fri: 1pm-3pm close)"
151,1,2.995897,101.756235,35.5489,"HASIL LAUT SEONG KEE SDN BHD - BALAKONG JAYA"
152,1,2.99464,101.756126,35.5963,"PERNIAGAAN XING FAI (FRIDAY OFF)"
153,1,2.992807,101.760437,36.1164,"QXQY MANAGEMENT SDN. BHD."
154,1,2.980735,101.758214,36.4788,"PASAR FAMILY MART - NZ MAJESTIC PLT"
155,1,3.054418,101.788344,36.8339,"YUANS F&B SDN BHD (WEDNESDAY CLOSE)"
156,1,2.850165,101.650302,37.1963,"BERKAT MADINA MART (Mon-Fri: 8am-5.30pm| Fri: 12pm-3pm rest| Sat: 4.30 pm close)"
157,1,2.953699,101.753766,37.5089,"HOCK MEI TRADING SDN BHD"
158,1,2.999403,101.785137,38.3422,"JT TRADING SDN BHD (855251-H) (KAJANG)"
159,1,2.982452,101.778964,38.4673,"NYS FOOD MART SDN BHD - KAJANG"
160,1,2.955825,101.767651,38.7166,"RESTORAN BANGI IMPIAN MAJU (LUTHFIA ALLIANCE SDN. BHD.)"
161,1,2.955961,101.768493,38.7903,"RESTORAN HABEEB MAJU"
162,1,2.955156,101.768711,38.8557,"HOCK MEI TRADING (SG. CHUA) SDN BHD"
163,1,3.028612,101.805897,39.4492,"SYARIKAT NG KEONG DAN ANAK-ANAK"
164,1,2.975536,101.809302,41.8512,"RESTORAN URAT KETING"
165,1,2.991688,101.818101,42.0607,"FROZEN KEN SDN. BHD."
166,1,2.972344,101.810053,42.0730,"YS HYPER"
167,1,2.8281921,101.7296673,44.5102,"PASAR RAYA SAROJA UTAMA"
168,1,3.385178767,101.7753856,44.7060,"THIRTY THREE WALMART"
169,1,3.398899596,101.7692864,45.1853,"SURE WIN CLAYPOT SEAFOOD PORRIDGE SDN BHD (open 10am-3am)"
170,1,3.396671266,101.7801231,45.9303,"GENTING GOLF COURSE BHD"
171,1,3.396671266,101.7801231,45.9303,"GENTING MALAYSIA BERHAD"
172,1,2.8147332,101.7347885,46.0133,"NBK MAJU ENTERPRISE (M) SDN. BHD."
173,1,2.811894,101.73719,46.4266,"YI HONG CHUAN ENTERPRISE (hantar sebelum 9.30am)"
174,1,2.944318,101.843327,46.7448,"MING TAI FOOD (M) SDN BHD (SEMENYIH)"
175,1,2.943634,101.843827,46.8281,"SEMENYIH FROZEN FOOD MART"
176,1,2.94739,101.845925,46.8560,"BIRMIR CASH & CARRY"
177,1,2.944514,101.844746,46.8769,"CLC WHOLESALER (SEMENYIH) SDN BHD"
178,1,2.946532,101.845759,46.8805,"PASAR MINI SRI RAAMA"
179,1,2.946493,101.845751,46.8816,"CHOP TOON CHOON THONG"
180,1,2.946268,101.845684,46.8857,"V.S.VARUSAI IBRAHIM & CO."
181,1,2.946046,101.845624,46.8904,"NYS FOOD MART SDN BHD - SEMENYIH"
182,1,2.854478,101.799272,48.0426,"PEMBORONG BARANG RUNCIT HUP SOON"
183,1,2.812944,101.762688,48.2320,"N NINE MINI MARKET"
184,1,2.85325,101.800804,48.2608,"BANG SHENG TRADING"
185,1,2.857408,101.807033,48.5079,"RESTORAN KIM FONG N TIGA (Open: 7am-5pm|No delivery during lunch time)"
186,1,2.790236,101.749262,49.1308,"SEMENYIH FOODMART SDN BHD"
187,1,3.425583455,101.7933386,49.1539,"SB GLORY SDN BHD"
188,1,2.853037,101.812113,49.2520,"FM COLLECTION SDN BHD"
189,1,3.434466307,101.7877331,49.3687,"ION DELEMEN HOSPITALITY SDN BHD"
190,1,2.849691,101.813525,49.6068,"FOOD FARM SDN. BHD."
191,1,2.9057,101.86448,50.8199,"JIMAT BERANANG ENTERPRISE - BERANANG"
192,1,2.810548,101.802492,51.5440,"BUSY CORNER SDN BHD"
193,1,2.798922,101.791689,51.5902,"KINGSLEY FROZEN & GROCERIES (CALL BEFORE DELIVERY)"
194,1,2.854344,101.840394,51.6599,"PASAR MINI GNR - MANTIN"
195,1,2.818956,101.813013,51.7723,"CHUN MENG ENTERPRISE-DELIVER AFTER 12PM- SMALL LORRY (no red packing csr)"
196,1,2.812987,101.808284,51.8292,"KK EGGS TRADING SDN. BHD. - NILAI (Please call before delivery)"
197,1,2.822197,101.817315,51.8921,"1 BABA STORE SDN BHD"
198,1,2.818299,101.814185,51.9180,"BAIDURI BIJAKSANA SDN. BHD."
199,1,2.818216,101.814241,51.9288,"CB FROZEN FOOD SDN BHD - NILAI BRANCH"
200,1,2.818333,101.814914,51.9760,"SEMARAK MART TRADING"
201,1,2.817867,101.814519,51.9777,"CT EXTRA STORES SDN BHD - DELIVERY B4 5PM & SAT OFF"
202,1,2.817905,101.814686,51.9887,"JINJANG LEE FROZEN SDN BHD"
203,1,2.817414,101.814662,52.0231,"HASIL LAUT SEONG KEE SDN. BHD. - NILAI"
204,1,2.81569,101.813293,52.0379,"CANDRIKAA CASH & CARRY (10AM-6PM)"
205,1,2.815707,101.813339,52.0404,"ANNACHI WHOLESALE CASH & CARRY (M) SDN. BHD."
206,1,2.803548,101.80454,52.2456,"YUZIE MINI MARKET"
207,1,2.814763,101.8176278,52.4651,"RECRON (MALAYSIA) SDN BHD - NILAI GENERAL PLANT"
208,1,2.80255,101.80972,52.7384,"MARWA STORE"
209,1,2.659987,101.561115,53.2198,"KEDAI TONG HUAT"
210,1,2.659424,101.565626,53.3837,"PASAR MINI BEE HENG"
211,1,2.656578,101.560182,53.5708,"C S HUAT ENTERPRISE"
212,1,2.827368,101.88079,57.0521,"PASARAYA MILLENNIUM (MANTIN) SDN BHD(OFF FRI-SAT)"
213,1,2.690545,101.751322,58.1908,"KIM HOK HIN SDN BHD"
214,1,2.69016,101.751236,58.2215,"CHOP CHEN HENG (open 10.30am)"
215,1,2.6877022,101.7488175,58.3051,"TONG SOON CHIN (PJB TAK BOLEH MASUK)"
216,1,2.82302,101.89265,58.4031,"VMAS MINI MARKET"
217,1,2.6850488,101.7496854,58.6055,"YJK MINI MARKET"
218,1,2.678614,101.759916,59.8235,"LIM KEE MEI WEI TRADING"
219,1,2.644342,101.712694,60.4908,"MY SUPER STORE SDN BHD"
220,1,2.644006,101.715883,60.6858,"SP MEGA FROZEN FOOD SDN BHD (3PM CLOSE)"
221,1,2.643147,101.717513,60.8538,"PASAR MINI YC YEE CHIN"
222,1,2.6406676,101.7141079,60.9261,"G.U.S. (SUNGAI PELEK) SDN BHD"
223,1,2.640419407,101.7165745,61.0755,"CHIN MEE (Thu: NO DELIVERY)"
224,1,2.6387622,101.7137659,61.0978,"REZEKI FOOD STUFF ENTERPRISE"
225,1,2.6379591,101.7130079,61.1396,"HANESH ENTERPRISE"
226,1,2.654825,101.751895,61.5892,"FLT TRADING"
227,1,2.6522,101.749893,61.7250,"NS HONG FATT ENTERPRISE SDN BHD"
228,1,2.7016046,101.8206197,61.7756,"KEDAI RUNCIT NASHIRA - TIARA SENDAYAN"
229,1,2.649425,101.747163,61.8361,"SIN MAH LEE ENTERPRISE"
230,1,2.6477819,101.7468925,61.9785,"PASARAYA FATEEMAH"
231,1,2.6477285,101.7469879,61.9890,"SHIN KONG LEE TRADING"
232,1,2.646738,101.746283,62.0447,"CHOP GUAN HONG"
233,1,2.647971,101.751191,62.2028,"EUHUP ENTERPRISE"
234,1,2.7011993,101.8308397,62.5413,"NZ MAJESTIC PLT (Fri: 1pm-2pm close)"
235,1,2.7010358,101.8314265,62.5974,"KEDAI RUNCIT NASHIRA - GADONG JAYA"
236,1,2.63956,101.7563291,63.2984,"PASAR RAYA ARAFAH MAJU (Open everyday|Fri: 12.30pm-2.30pm close)"
237,1,2.6994621,101.8586484,64.7319,"FAMA CORPORATION SDN. BHD. - AGROBAZAAR SENDAYAN (Mon-Fri|Sat: Half day|Sun close)"
238,1,2.6866853,101.846048,64.8659,"FATIMAH HASSAN ULLAH ENTERPRISE"
239,1,2.6878376,101.8484237,64.9415,"TNF MAJU ENTERPRISE"
240,1,2.7491817,101.9157683,65.4780,"SIM YAM HOE SDN BHD"
241,1,2.762337,101.929541,65.7371,"PASAR MINI A.T.N (11am-11pm)"
242,1,2.7046855,101.8800407,65.9422,"VIKA ENTERPRISE"
243,1,2.7046733,101.8800297,65.9423,"MANTAU MINIMART (Fri: 12pm-3pm close)"
244,1,2.710255,101.888816,66.1897,"DS KOPITIAM (MONDAY CLOSED)"
245,1,2.708186,101.887739,66.2670,"KEDAI RUNCIT AA SMART (FRIDAY CLOSED)"
246,1,2.707843,101.888171,66.3279,"LEAF VEGETARIAN"
247,1,2.6810546,101.8651364,66.7339,"KEDAI RUNCIT AA MART SDN. BHD."
248,1,2.725993,101.911114,66.7858,"GREEN APPLE STORE (PAGOH) SDN. BHD."
249,1,2.726096,101.911406,66.8021,"COOKING MASTER RESTAURANT (THURSDAY OFF) (OPEN 1PM)"
250,1,2.6059925,101.7643781,66.9736,"PASAR RAYA ARAFAH MAJU"
251,1,3.0382979,102.0702886,67.9475,"PATTANA TOMYAM SEAFOOD (Open 1pm-11pm|Wed close)"
252,1,2.740697,101.939021,68.0667,"CHOONG KHOON MUI (10AM start business) (Sunday Off)"
253,1,2.976721,102.060039,68.1931,"SS HAPPY MART (WONG KONG WUI)"
254,1,2.949694,102.05491,68.4560,"VPS FAMILY H MART"
255,1,2.73166,101.936167,68.4660,"HOE HIN ENTERPRISE S/B-SMALL LORI-DELIVER TUE-THUR 8.30-12PM, TUE-FRI-2-4pm"
256,1,2.614247,101.804508,68.5249,"MOON SING HEONG TRADING"
257,1,2.7316173,101.9371433,68.5519,"JT TRADING SDN BHD (855251-H)"
258,1,2.731495,101.9371698,68.5630,"MING TAI FOOD (M) SDN BHD (MING TAI FOODMART)"
259,1,2.730515,101.937536,68.6643,"JINJANG LEE FROZEN SDN. BHD. (SEREMBAN)"
260,1,2.949416,102.058253,68.8202,"PASAR MINI SEONG HENG"
261,1,2.747932,101.953588,68.8268,"PASARAYA JELITA (smnall lorry)"
262,1,2.949202,102.058724,68.8772,"KEDAI RUNCIT YUNG SHIM"
263,1,2.728787,101.939099,68.9209,"CHOP KHOON SENG (MON TO SAT)"
264,1,2.742156,101.950236,68.9328,"PERNIAGAAN AL-AMIN"
265,1,2.727921,101.93914,68.9866,"KEDAI VOON FAH (10 TON LORI BOLEH MASUK SAJA)"
266,1,2.727651,101.93993,69.0730,"HIAP SENG TRADING"
267,1,2.694291,101.909831,69.0984,"AUTHENTIC CHARCOAL GRILL HOUSE -  DELIVERY BY THOMAS"
268,1,2.7246446,101.9390815,69.2178,"MS AYU KHAN ENTERPRISE"
269,1,2.725251,101.939727,69.2285,"PASARAYA MAP SDN BHD"
270,1,2.709072,101.9257111,69.2511,"PASAR MINI MUHABBAT - SEREMBAN (Open everyday|Fri: 12.30pm-2.30pm close)"
271,1,2.70658,101.925851,69.4496,"JATI FROZEN SDN BHD (MASJID TANAH BRANCH)"
272,1,2.660534,101.878845,69.4514,"CT EXTRA STORES (SENDAYAN) SDN BHD - DELIVERY B4 5PM & SAT OFF"
273,1,3.021308,102.081692,69.5006,"CHOP SHING LOONG"
274,1,2.684408,101.9051381,69.5042,"BINA SEJAHTERA MAJU (DELIVERY 2PM-5PM)"
275,1,2.681679,101.903017,69.5555,"PASARAYA MEGA INDAH SDN BHD"
276,1,2.706052,101.926671,69.5564,"PERMAI SEMBILAN ENTERPRISE S/B-5 TON 3 ORG-SAT&SUN NO RECEIVED"
277,1,2.680775,101.902971,69.6238,"ALEE FROZEN AND FOOD SUPPLY-8.30AM-5.30PM"
278,1,2.94377,102.064858,69.7054,"TQ BESTARI SDN BHD (FRIDAY 12.30PM-2.30PM OFF)"
279,1,2.750565,101.966302,69.7680,"ASHA SPEEDMART (FRIDAY CLOSED)"
280,1,2.684181,101.908771,69.8063,"BUMI INSPIRA ENTERPRISE"
281,1,2.684211,101.908922,69.8158,"KK EGGS TRADING SDN. BHD. - SEREMBAN (Please call before delivery)"
282,1,2.7476167,101.9665717,69.9900,"IMAH RIN ENTERPRISE"
283,1,2.7487968,101.9674873,69.9916,"SIKAMAT POINT"
284,1,2.727606,101.95076,69.9986,"HOE HING CHAN SDN BHD (MON-SAT : 8AM-1PM)"
285,1,2.6960601,101.9285684,70.4662,"GAN HOCK HIN TRADING SDN BHD-SAT & SUN CLOSE"
286,1,2.939717,102.070984,70.4889,"BAN SING SUNDRY ENTERPRISE"
287,1,2.9397397,102.0712292,70.5141,"RESTORAN NOR FALAH (Open 7.30am-8pm)"
288,1,2.695362,101.929559,70.5995,"GAN HOCK LAM"
289,1,2.68909,101.923662,70.6039,"KKH FRESHMART SDN BHD (Close - 3pm)"
290,1,2.7066691,101.9405558,70.6548,"BUGAHIR MINI MARKET"
291,1,2.7239505,101.9558156,70.6904,"HOE HIN CONFECTIONARY SDN BHD"
292,1,2.756782,101.981908,70.7516,"NOORULLAH CONVENIENCE STORE - MY GROCER"
293,1,2.72015,101.958545,71.1934,"SETOR BISMILLAH"
294,1,2.6733018,101.9183997,71.4182,"PASAR MINI PSA MAJU"
295,1,2.673226,101.9183709,71.4219,"RESTORAN NOOR BISTRO 71"
296,1,2.721444,101.964257,71.5916,"KEDAI RUNCIT JMI"
297,1,2.5917118,101.822286,71.7043,"RAHIMA MINI MARKET - TAMAN PERINDUSTRIAN LUKUT (Fri: 12pm-3pm close)"
298,1,2.7052953,101.9525987,71.7599,"DARUSSALAM MINI MART"
299,1,2.591196,101.822544,71.7679,"KKH FRESHMART (PD) SDN BHD"
300,1,2.7047987,101.9525332,71.7907,"PASAR SEGAR RIAS"
301,1,2.7148083,101.9611122,71.7926,"PASAR MINI MAAS"
302,1,2.6707416,101.9207543,71.8045,"PASAR MINI KONG FU (Mon-Fri: 12pm-6pm|Sat-Sun close)"
303,1,2.6707412,101.9207556,71.8046,"BAN Y MINI MARKET"
304,1,2.6707434,101.9207589,71.8047,"APMK ENTERPRISE"
305,1,2.724758,101.970691,71.9153,"SETOR BISMILLAH (CAWANGAN) - Friday closed"
306,1,2.590784,101.82438,71.9190,"HALLMARK BEVERAGE INDUSTRY SDN BHD"
307,1,2.6664974,101.9183007,71.9493,"1ST GRID SDN. BHD."
308,1,2.6665019,101.9183247,71.9508,"PASAR MINI YAKIN MAJU - P. PERDAGANGAN GEMAS"
309,1,2.706592,101.956995,72.0348,"JTM HOE HIN ENTERPRISE SDN BHD-(MON-SAT 9AM-3PM)"
310,1,2.9498645,102.0888616,72.0658,"YAHYA MINI MARKET"
311,1,2.6519328,101.9053411,72.1325,"VST MART"
312,1,2.6887005,101.9422248,72.1343,"MY 77 KOPITIAM (Open everyday|Delivery: 9am-3pm)"
313,1,2.6871375,101.9411722,72.1667,"RADHA STORE"
314,1,2.674784,101.929687,72.1918,"QIANYUGE MIXED RICE (Delivery: morning)"
315,1,2.674735,101.929801,72.2047,"YUSNI IDRIS ENTERPRISE - NASI AYAM GEMAS MUSTAFAH (Friday close)"
316,1,2.674599,101.929871,72.2208,"TONG AH PENGARAKAN SDN BHD ( MON-FRI 8:30AM-5PM )"
317,1,2.701899,101.95692,72.3699,"SYARIKAT PERNIAGAAN MOH GUAN HIN KEE (TUESDAY & THURSDAY CLOSE)"
318,1,2.682553,101.943123,72.6728,"COLDMAXGOLD (TUESDAY OFF)"
319,1,2.680206,101.943952,72.9184,"RJ FAMILY STORE SDN BHD (Receiving: After 11am)"
320,1,2.6802939,101.9453049,73.0214,"SEMMA PASI FOOD EMPIRE (Mon-Sat: 8am-4pm|Sun close)"
321,1,2.6801935,101.9479377,73.2428,"GAURANGA PURE VEGE HOUSE"
322,1,2.6784227,101.9478186,73.3674,"RASAH JAYA DAILY MART SDN BHD"
323,1,2.65255,101.9253291,73.6057,"DEVIAD A/L FRANCIS"
324,1,2.574131,101.827276,73.6421,"K JAYAKUMAR ENTERPRISE (open 10am-6pm)"
325,1,2.716927,101.984599,73.6660,"MR STORE ENTERPRISE"
326,1,2.5608222,101.8112615,73.9462,"MR MART TRADING (DELIVERY: 1pm-6pm)"
327,1,2.5603146,101.81157,74.0122,"UYIR INSPIRED SDN. BHD."
328,1,2.5732709,101.8330101,74.0716,"AKPS CASH & CARRY"
329,1,2.5609882,101.8153255,74.1661,"SEGAR MINI MARKET"
330,1,2.5696012,101.829262,74.1846,"MING TAI FOOD (M) SDN BHD"
331,1,2.5678068,101.8269905,74.2151,"ANTHONY A/L AROKIAM"
332,1,2.5608411,101.8159328,74.2155,"M FAMILY MINI MART"
333,1,2.5605253,101.8156879,74.2311,"M FAMILY MINI MARKET (DEL: 12pm to 6pm) Tuesday off"
334,1,2.568588,101.828739,74.2475,"SAIKUMARANS CASH & CARRY"
335,1,2.578881,101.8442535,74.2530,"RAHIMA MINI MARKET - TAMAN SRI LUKUT"
336,1,2.553235,101.8059851,74.3682,"SIN NG WING SUN MINI MARKET"
337,1,2.5656164,101.8274333,74.4465,"SHC SUCCESS WHOLESALER SDN BHD (Receiving 1pm-5pm)"
338,1,2.69261,101.975052,74.5693,"PASARAYA SSR SENAWANG"
339,1,2.9640737,102.1170045,74.6702,"TONGKAH BIDUANDA TRADING - CHE LAH MART"
340,1,2.705956,101.988207,74.7419,"KEDAI RUNCIT AL SHAFI"
341,1,2.697414,101.981562,74.7758,"LUCKY INN RESTAURANT (Receiving open at 3pm|Call before delivery)"
342,1,2.6864949,101.9724358,74.7945,"MRANI ENTERPRISE (Delivery: 8.00am-11.00am)"
343,1,2.704814,101.99057,75.0258,"MING TAI FOOD (M) SDN BHD (SENAWANG)"
344,1,2.682213,101.972429,75.1080,"BABAU SENTOSA SDN BHD"
345,1,2.682198,101.972451,75.1109,"PASAR MINI LONG ( PJB TAK BOLEH MASUK, HANTAR PAGI )"
346,1,2.68198,101.972747,75.1516,"SILVER LINE SALES & SERVICES"
347,1,2.538253,101.797022,75.3148,"PD JIMAT ENTERPRISE"
348,1,2.714368,102.002103,75.3717,"PASAR BORONG SENAWANG SDN BHD"
349,1,2.714351,102.002091,75.3718,"MOHD ATHAR BIN BACHOK"
350,1,2.714624,102.002474,75.3869,"JIT HENG CASH & CARRY"
351,1,2.5744354,101.8558772,75.3963,"LK MINI MART (Open everyday|Fri: 12.30pm-2.30pm close)"
352,1,2.714067,102.002188,75.3996,"JATI FROZEN SDN BHD (SENAWANG BRANCH)"
353,1,2.68926,101.983768,75.5476,"THILAGAM MINI MARKET"
354,1,2.689047,101.983868,75.5714,"PONNY CASH AND CARRY SDN. BHD."
355,1,2.688826,101.98408,75.6052,"SIAN BOY MIXED RICE"
356,1,2.701312,101.995469,75.6938,"PASAR MINI MUHABBAT - SENAWANG (FRIDAY CLOSED)"
357,1,2.6914164,101.9888259,75.8226,"AIMAN BAHAR MINI MARKET"
358,1,2.6971037,101.9937649,75.8421,"PASAR MINI AL HAQ"
359,1,2.675555,101.976645,75.9493,"YL CASH & CARRY"
360,1,2.688894,101.988648,75.9878,"ON SEMICONDUCTOR MALAYSIA SDN. BHD."
361,1,2.675369,101.977762,76.0558,"TF MULTI FOOD MARKETING SDN BHD (SAT NO RECEIVE)"
362,1,2.675365,101.977882,76.0661,"KEDAI BORONG WAJA SDN BHD *MESTI NAK HANTAR 1ST KEDAI-PAGI (JUMAAT TUTUP)"
363,1,2.529281,101.799888,76.3410,"KIM GUAN HUAT"
364,1,2.695023,101.998962,76.4356,"PASAR MINI AR SENAWANG INDAH"
365,1,2.5300141,101.8031274,76.4458,"SUN HUP KI TRADING (open 10am - 6pm)"
366,1,2.527122,101.798514,76.4767,"PEMBORONG MAKANAN & MINUMAN MUHIBAH"
367,1,2.671145,101.982496,76.7609,"MATHIALAGAN FAMILY STORE (10am-5pm) (Saturday & Lunch hour : no receiving)"
368,1,2.6707521,101.9825646,76.7956,"CMM CHITA ENTERPRISE"
369,1,2.522651,101.797759,76.8718,"PEMBORONG MAKANAN & MINUMAN CERIA - PORT DICKSON"
370,1,2.675131,101.993652,77.4028,"PASARAYA TTJ FAMILY SDN BHD (Receiving: After 11am)"
371,1,2.674543,101.993237,77.4106,"YAKIN HALAL MART"
372,1,2.6743991,101.9931765,77.4159,"PASAR MINI NURSARI"
373,1,2.664112,101.98577,77.5525,"SINAR JMART ENTERPRISE - Off every Friday"
374,1,2.665372,101.987995,77.6438,"RAJBARI ENTERPRISE (FRIDAY 12.30PM-3PM OFF)"
375,1,2.6640302,101.9877915,77.7261,"ELEN FRESH MART"
376,1,2.656777,101.993386,78.7268,"SENAWANG MART SDN. BHD."
377,1,3.8365807,101.3876052,79.1592,"PEMBORONG RAO SDN BHD"
378,1,2.662316,102.007342,79.4849,"FADILA UNGGUL ENTERPRISE"
379,1,2.654857,102.003952,79.7460,"KM BERSATU RESOURCES SDN. BHD. - PASAR SEGAR JIMAT PLUS"
380,1,2.7312522,102.0785258,81.2127,"ALANGACU UB TRADING"
381,1,2.7312522,102.0785258,81.2127,"PASAR MINI AMPANGAN (Please call before arrange for delivery)"
382,1,2.5894446,101.964009,81.6584,"KEDAI RUNCIT SHARI (Delivery: 8am-11.30am)"
383,1,2.5840205,101.9612125,81.8932,"HANAMAN MAJU ENTERPRISE"
384,1,3.097621,102.219079,83.7871,"118 FRESHMART"
385,1,3.099941,102.220235,83.9050,"SAR NILAM ENTERPRISE"
386,1,2.4627127,101.8543241,85.7672,"RESTORAN MOHAMADUNNI"
387,1,2.5482813,101.9753894,85.9064,"PIRAMILA A/P ARUMUGAM"
388,1,2.4456901,101.8590868,87.6702,"SI RUSA MINI MARKET"
389,1,3.817922656,101.8519693,87.8277,"SHANTI MASPADI SDN BHD"
390,1,2.448229,101.869155,87.9906,"PASAR MINI AL FATIMAH - PORT DICKSON"
391,1,2.442176,101.8648555,88.3293,"PASARAYA PEBBLE BEACH"
392,1,2.58707,102.049179,88.5294,"PASAR MINI PEDAS"
393,1,2.575877,102.045429,89.0795,"PASAR MINI HAFIZI"
394,1,2.4300219,101.8632635,89.4128,"SAVEMART TRADING (Mon close)"
395,1,2.7483076,102.1822433,90.1839,"BERKAT NORA FAMILY ENTERPRISE (Open 8am-6pm)"
396,1,2.594095,102.078388,90.4172,"SHU BEE ENTERPRISE"
397,1,2.7412015,102.1842105,90.7498,"KEDAI RUNCIT MESTINA JAYA"
398,1,2.7012793,102.1629923,90.9253,"DSENARA ENTERPRISE (Mon-Fri: 7am-4pm|Sat-Sun close)"
399,1,2.4239552,101.8807959,90.9723,"SAZALI BIN ABD AZIZ"
400,1,2.589372,102.093896,92.0630,"JALIL MINI MART ( FRIDAY 12.30PM-3PM OFF )"
401,1,2.589137,102.093841,92.0754,"KEDAI RUNCIT SAFIUDEEN (FRIDAY 12PM-2PM OFF)"
402,1,2.591818,102.100117,92.4121,"JALIL MINI MART (FRIDAY 2PM-3.30PM OFF)"
403,1,2.589475,102.099087,92.4936,"JATI FROZEN SDN BHD (REMBAU BRANCH) - Open 9am-9pm"
404,1,2.483857,102.011914,93.9822,"K INDERA CASH & CARRY"
405,1,2.4834773,102.0121924,94.0344,"LAM HING LOONG MART (Open everyday|Delivery behind shop)"
406,1,2.8609839,102.2711055,94.3290,"AD DIN TEGUH RESOURCES"
407,1,2.8610535,102.2713192,94.3491,"NEPHRO MESRA SDN. BHD. - PASAR MINI JUASSEH SENTOSA"
408,1,2.4862353,102.0205616,94.4052,"PASAR MINI PENGKALAN DURIAN (Delivery everyday|Fri: 12pm-2.30pm rest)"
409,1,2.739467,102.223562,94.7060,"SARVANA TRADING (Call Before Delivery)"
410,1,2.735137,102.234947,96.0508,"JATI FROZEN SDN BHD (KUALA PILAH BRANCH)"
411,1,2.7366944,102.2385201,96.3256,"CHIA YEN LAI ENTERPRISE (Open 7am-4pm|Tue close)"
412,1,2.734932,102.240854,96.6455,"SYARIKAT SARVANA"
413,1,2.7416036,102.2461086,96.8336,"KEDAI RUNCIT ROBI"
414,1,2.7390995,102.2453252,96.8800,"SYARIKAT MOHD.ISA BERSAUDARA (Fri-Sat: Close)"
415,1,2.740523,102.248994,97.1740,"TEE HIAP HUAT TRADING"
416,1,2.7381269,102.2495641,97.3495,"KURNIA AKRAB SDN. BHD."
417,1,2.728815,102.2462567,97.4894,"SUBBU LETCUMI A/P JAGANTHAN (Sat-Sun close)"
418,1,2.7177819,102.242897,97.7257,"GKS MINI MART"
419,1,2.7179018,102.2446655,97.8931,"WAJADDA ENTERPRISE"
420,1,2.729443333,102.2515317,97.9793,"H&M SENALING ENTERPRISE"
421,1,2.8965716,102.3183315,98.2027,"KELUARGA IMAM ENTERPRISE (7am-6pm|Fri close)"
422,1,2.8793555,102.3230852,99.2310,"MHD YUNUS BIN A.MANAP (Fri: Close)"
423,1,2.8785885,102.3234398,99.2927,"PERNIAGAAN BANGLANG SERI SERTING"
424,1,2.7904052,102.2929553,99.3372,"JR RIJK RESOURCES"
425,1,2.7903109,102.2929478,99.3404,"PASAR SEGAR HIJRAH ENTERPRISE"
426,1,2.7903269,102.2930265,99.3478,"SANG KEE FOODSTUFF (Open 7am-2pm|Call before delivery)"
427,1,2.7902305,102.2932903,99.3790,"ETA MM ENTERPRISE"
428,1,2.786565,102.299326,100.1539,"ENG HING LEONG MINI MARKET"
429,1,2.456023,102.070796,100.6149,"PASARMINI LUBOK CINA"
430,1,3.500195132,102.2918905,100.6394,"MY FRESH BOX SDN. BHD."
431,1,3.8718924,100.9299223,101.7528,"PASAR MINI HUTAN MELINTANG TIGA PULUH TIGA"
432,1,3.8713071,100.9256573,101.9772,"HENG GIAP FISHERY"
433,1,3.8731955,100.9240346,102.2529,"SOON HENG LAI TRADING"
434,1,3.8897981,100.9362567,102.9733,"PASAR SEGAR SURIA"
435,1,3.479771578,102.3308234,103.7214,"HUP CHON CHAN (Monday to Friday - 9am to 5pm)"
436,1,3.8985077,100.936034,103.7843,"SS SELVAARASII MINI MARKET"
437,1,3.8944975,100.9299612,103.8012,"RK SANTHIYA MINI MARKET"
438,1,3.487490745,102.3288132,103.8409,"NEW HUP CHONG ( MON-SAT 9AM-6PM)"
439,1,2.5100722,102.1665633,103.9422,"SALAM BERKAT MINI MARKET (Open 8am-8pm)"
440,1,3.8978562,100.9303106,104.0855,"PERNIAGAAN SHEN HOCK"
441,1,2.9451631,102.3848559,104.1520,"NIVASH ENTERPRISE (Tue close)"
442,1,2.5084106,102.1684491,104.2215,"SRA OM SAKTHI STORE (Open 8am-7pm|Sun close)"
443,1,2.3671058,102.0127436,104.2834,"KIM MART SDN BHD"
444,1,3.449908117,102.3515554,104.6804,"AMAZING INDUSTRIES SDN BHD - Monday to saturday"
445,1,3.867938,100.8748208,105.0956,"LK STORE"
446,1,3.8914933,100.9007392,105.4215,"STK N TRADING"
447,1,3.485193876,102.3518292,106.1090,"AIK HENG (MON-FRI 9PM to 3PM)"
448,1,2.3618125,102.0388176,106.4697,"TOP FRESH MINI MARKET"
449,1,3.9034433,100.9000314,106.5392,"T.P STORE"
450,1,2.640694,102.2939612,106.8636,"CHIA BERJAYA ENTERPRISE"
451,1,3.9572358,100.9745809,106.9916,"DSS MINI MARKET"
452,1,2.8920944,102.4019491,107.3098,"PASARAYA DEIN"
453,1,2.891982,102.4019611,107.3141,"PASAR MINI RAASI"
454,1,2.8973985,102.4052943,107.5270,"NG WOON ENTERPRISE (Open 7am-6pm|Tue close)"
455,1,3.9910179,101.0206166,107.8102,"KEDAI SERBANEKA PERKASA"
456,1,2.8969825,102.4085076,107.8845,"SHAFA NS TRADING"
457,1,2.8937286,102.4077194,107.8868,"KU ROSMA BINTI KU AHMAD"
458,1,2.8915798,102.4076408,107.9366,"YUS HALIMAH ENTERPRISE"
459,1,2.8915522,102.4077432,107.9484,"NORHAYU BINTI MOHD SHAH - DAPO KUEH (Wed close)"
460,1,2.8058359,102.3858948,108.3771,"K SANGAM STORE"
461,1,2.805268,102.3857979,108.3879,"JEMPOL BAKERY (Open: 6am-4pm)"
462,1,2.881556,102.409311,108.3943,"JATI FROZEN SDN BHD (SERTING BRANCH)"
463,1,2.8859507,102.4128054,108.6470,"PUTRA ROHIMIEN AIMY BIN RADZEMI - D' WARUNG FADILAH"
464,1,3.8901958,100.8511226,108.6711,"RAJAHS ENTERPRISE"
465,1,2.460633101,102.1791085,108.6740,"LETCHUMEE MAJU ENTERPRISE"
466,1,2.4843761,102.200832,108.6875,"CVM AYAPA ENTERPRISE (Open 11am-6pm)"
467,1,2.8084484,102.3916763,108.8875,"MOHD ROSZI BIN AB.RASHID"
468,1,3.260630649,102.4383112,109.0363,"ECONSAVE CASH & CARRY (TRI) SDN BHD"
469,1,3.9954028,101.0050959,109.0396,"COSMOS VALUE MART"
470,1,2.8094297,102.3935699,109.0506,"MARWA MANAGEMENT (M) SDN. BHD."
471,1,2.811745,102.3963773,109.2619,"RESTORAN CMZ TOM YAM (Open 3pm-12pm)"
472,1,3.005905,102.442745,109.4115,"PERNIAGAAN FIRDAUS RASHID"
473,1,4.0197174,101.0430092,109.5719,"VANAN STORE"
474,1,2.811443,102.399315,109.5815,"NUR AISYAH KAMSIAH ENTERPRISE"
475,1,2.811812,102.40098,109.7434,"SYARIKAT MALAR"
476,1,3.466830698,102.3942353,109.7754,"CHOP WAN CHONG - Mon - sat 9-5pm delivery"
477,1,2.811937,102.40148,109.7915,"KAMISAH BINTI MD ISA (KEDAI RUNCIT KAMISAH)"
478,1,2.8113617,102.4018009,109.8458,"DARIN BARAKAH ENTERPRISE - PASAR MINI AZMAN (MAWANG) (Open 7.30am-7pm|Fri close)"
479,1,2.8085664,102.4010826,109.8708,"BILLION SHOPPING CENTRE (KLANG) S/B"
480,1,2.8081519,102.4012404,109.9023,"RESTORAN HIJASS"
481,1,2.827606,102.409126,110.0524,"VK RAMASAMY TRADING SDN BHD (Close at 2 pm)"
482,1,2.8095395,102.4044522,110.1898,"ALIYA FARHANA ENTERPRISE"
483,1,2.8085439,102.4055884,110.3450,"DIN MINIMART (Mon-Sun: 8.30am-7pm|Fri close)"
