cluster_id,sequence_order,store_name,lat,lon,tonnage,haversine_dist_km,haversine_cumulative_km,road_dist_km,cumulative_dist_km,drive_min_no_traffic,drive_min_with_traffic,delay_min,fuel_liters_leg,cumulative_fuel_liters,return_dist_km,weather,temp_c
92,1,"HOE HIN ENTERPRISE S/B-SMALL LORI-DELIVER TUE-THUR 8.30-12PM, TUE-FRI-2-4pm",2.73166,101.936167,"55",67.46,67.46,92.72,92.72,85,94,9,23.53,23.53,93.22,"Overcast. Extremely hot.",35.28
93,1,"JT TRADING SDN BHD (855251-H)",2.7316173,101.9371433,"54",67.53,67.53,92.90,92.90,86,95,9,23.57,23.57,93.20,"Overcast. Extremely hot.",35.28
94,1,"MING TAI FOOD (M) SDN BHD (MING TAI FOODMART)",2.731495,101.9371698,"52",67.54,67.54,92.88,92.88,85,94,9,23.57,23.57,93.26,"Overcast. Extremely hot.",35.28
95,1,"PERNIAGAAN AL-AMIN",2.742156,101.950236,"49",67.55,67.55,92.68,92.68,87,93,7,23.44,23.44,93.57,"Overcast. Extremely hot.",35.28
96,1,"KEDAI RUNCIT AA MART SDN. BHD.",2.6810546,101.8651364,"54",67.62,67.62,91.57,91.57,82,107,25,23.85,23.85,91.31,"Thunderstorms. Scattered clouds. Warm.",31.00
97,1,"JINJANG LEE FROZEN SDN. BHD. (SEREMBAN)",2.730515,101.937536,"55",67.65,67.65,85.60,85.60,77,103,26,22.33,22.33,93.34,"Overcast. Extremely hot.",35.28
98,1,"TONGKAH BIDUANDA TRADING - CHE LAH MART",2.9640737,102.1170045,"46",67.76,67.76,100.74,100.74,104,115,11,25.65,25.65,127.14,"Overcast. Extremely hot.",35.28
99,1,"CHOP KHOON SENG (MON TO SAT)",2.728787,101.939099,"24",67.91,67.91,92.97,92.97,85,94,9,23.59,23.59,93.89,"Overcast. Extremely hot.",35.28
100,1,"KEDAI VOON FAH (10 TON LORI BOLEH MASUK SAJA)",2.727921,101.93914,"54",67.99,67.99,93.13,93.13,86,95,9,23.63,23.63,93.78,"Overcast. Extremely hot.",35.28
101,1,"ASHA SPEEDMART (FRIDAY CLOSED)",2.750565,101.966302,"45",68.02,68.02,94.62,94.62,90,98,8,23.97,23.97,95.52,"Overcast. Extremely hot.",35.28
102,1,"HIAP SENG TRADING",2.727651,101.93993,"55",68.07,68.07,93.17,93.17,86,95,9,23.64,23.64,94.00,"Overcast. Extremely hot.",35.28
103,1,"SIKAMAT POINT",2.7487968,101.9674873,"48",68.25,68.25,94.66,94.66,90,98,8,23.98,23.98,95.56,"Overcast. Extremely hot.",35.28
104,1,"PASARAYA MAP SDN BHD",2.725251,101.939727,"50",68.26,68.26,85.14,85.14,76,102,26,22.21,22.21,94.07,"Overcast. Extremely hot.",35.28
105,1,"MS AYU KHAN ENTERPRISE",2.7246446,101.9390815,"52",68.27,68.27,84.92,84.92,75,101,26,22.15,22.15,94.01,"Thunderstorms. Scattered clouds. Warm.",31.00
106,1,"IMAH RIN ENTERPRISE",2.7476167,101.9665717,"55",68.28,68.28,94.45,94.45,89,97,8,23.93,23.93,95.35,"Overcast. Extremely hot.",35.28
107,1,"NOORULLAH CONVENIENCE STORE - MY GROCER",2.756782,101.981908,"51",68.69,68.69,102.76,102.76,94,102,7,25.99,25.99,102.45,"Overcast. Extremely hot.",35.28
108,1,"PASAR MINI MUHABBAT - SEREMBAN (Open everyday|Fri: 12.30pm-2.30pm close)",2.709072,101.9257111,"50",68.74,68.74,85.24,85.24,76,101,26,22.23,22.23,83.70,"Thunderstorms. Scattered clouds. Warm.",31.00
109,1,"HOE HING CHAN SDN BHD (MON-SAT : 8AM-1PM)",2.727606,101.95076,"55",68.83,68.83,96.41,96.41,90,101,11,24.55,24.55,95.45,"Overcast. Extremely hot.",35.28
110,1,"JATI FROZEN SDN BHD (MASJID TANAH BRANCH)",2.70658,101.925851,"55",68.97,68.97,85.54,85.54,76,102,26,22.31,22.31,83.68,"Thunderstorms. Scattered clouds. Warm.",31.00
111,1,"AUTHENTIC CHARCOAL GRILL HOUSE -  DELIVERY BY THOMAS",2.694291,101.909831,"24",69.05,69.05,84.58,84.58,76,101,25,22.03,22.03,84.98,"Thunderstorms. Scattered clouds. Warm.",31.00
112,1,"PERMAI SEMBILAN ENTERPRISE S/B-5 TON 3 ORG-SAT&SUN NO RECEIVED",2.706052,101.926671,"49",69.07,69.07,85.43,85.43,76,102,26,22.28,22.28,83.65,"Thunderstorms. Scattered clouds. Warm.",31.00
113,1,"HOE HIN CONFECTIONARY SDN BHD",2.7239505,101.9558156,"55",69.50,69.50,95.36,95.36,88,99,10,24.24,24.24,90.50,"Thunderstorms. Scattered clouds. Warm.",31.00
114,1,"BINA SEJAHTERA MAJU (DELIVERY 2PM-5PM)",2.684408,101.9051381,"49",69.66,69.66,86.61,86.61,78,104,26,22.59,22.59,91.06,"Thunderstorms. Scattered clouds. Warm.",31.00
115,1,"PASARAYA MEGA INDAH SDN BHD",2.681679,101.903017,"50",69.78,69.78,87.03,87.03,79,104,26,22.70,22.70,86.37,"Thunderstorms. Scattered clouds. Warm.",31.00
116,1,"ALEE FROZEN AND FOOD SUPPLY-8.30AM-5.30PM",2.680775,101.902971,"77",69.87,69.87,86.95,86.95,78,104,26,22.68,22.68,90.54,"Thunderstorms. Scattered clouds. Warm.",31.00
117,1,"BUMI INSPIRA ENTERPRISE",2.684181,101.908771,"67",69.91,69.91,86.00,86.00,77,102,25,22.40,22.40,85.12,"Thunderstorms. Scattered clouds. Warm.",31.00
118,1,"KK EGGS TRADING SDN. BHD. - SEREMBAN (Please call before delivery)",2.684211,101.908922,"53",69.91,69.91,85.98,85.98,77,102,25,22.39,22.39,85.11,"Thunderstorms. Scattered clouds. Warm.",31.00
119,1,"BUGAHIR MINI MARKET",2.7066691,101.9405558,"94",69.94,69.94,87.53,87.53,76,101,25,22.80,22.80,87.70,"Thunderstorms. Scattered clouds. Warm.",31.00
120,1,"SETOR BISMILLAH",2.72015,101.958545,"48",70.02,70.02,96.28,96.28,90,101,11,24.51,24.51,89.77,"Thunderstorms. Scattered clouds. Warm.",31.00
121,1,"GAN HOCK HIN TRADING SDN BHD-SAT & SUN CLOSE",2.6960601,101.9285684,"56",70.09,70.09,84.99,84.99,77,102,25,22.13,22.13,84.96,"Thunderstorms. Scattered clouds. Warm.",31.00
122,1,"GAN HOCK LAM",2.695362,101.929559,"56",70.22,70.22,84.86,84.86,76,101,25,22.10,22.10,84.83,"Thunderstorms. Scattered clouds. Warm.",31.00
123,1,"KEDAI RUNCIT JMI",2.721444,101.964257,"54",70.31,70.31,96.52,96.52,91,102,11,24.57,24.57,91.21,"Thunderstorms. Scattered clouds. Warm.",31.00
124,1,"CT EXTRA STORES (SENDAYAN) SDN BHD - DELIVERY B4 5PM & SAT OFF",2.660534,101.878845,"50",70.36,70.36,98.73,98.73,90,118,28,25.84,25.84,96.96,"Thunderstorms. Scattered clouds. Warm.",31.00
125,1,"KKH FRESHMART SDN BHD (Close - 3pm)",2.68909,101.923662,"53",70.40,70.40,86.49,86.49,78,103,25,22.52,22.52,86.63,"Thunderstorms. Scattered clouds. Warm.",31.00
126,1,"SETOR BISMILLAH (CAWANGAN) - Friday closed",2.724758,101.970691,"48",70.50,70.50,97.31,97.31,91,102,11,24.77,24.77,104.53,"Thunderstorms. Scattered clouds. Warm.",31.00
127,1,"PASAR RAYA ARAFAH MAJU",2.6059925,101.7643781,"50",70.52,70.52,97.73,97.73,89,114,25,25.45,25.45,95.96,"Thunderstorms. Scattered clouds. Warm.",31.00
128,1,"PASAR MINI MAAS",2.7148083,101.9611122,"50",70.66,70.66,96.72,96.72,90,101,11,24.62,24.62,89.18,"Thunderstorms. Scattered clouds. Warm.",31.00
129,1,"DARUSSALAM MINI MART",2.7052953,101.9525987,"16",70.89,70.89,87.64,87.64,78,104,25,22.82,22.82,87.73,"Thunderstorms. Scattered clouds. Warm.",31.00
130,1,"PASAR SEGAR RIAS",2.7047987,101.9525332,"50",70.93,70.93,87.66,87.66,78,103,25,22.83,22.83,87.76,"Thunderstorms. Scattered clouds. Warm.",31.00
131,1,"JTM HOE HIN ENTERPRISE SDN BHD-(MON-SAT 9AM-3PM)",2.706592,101.956995,"54",71.08,71.08,88.16,88.16,79,104,25,22.96,22.96,89.79,"Thunderstorms. Scattered clouds. Warm.",31.00
132,1,"MOON SING HEONG TRADING",2.614247,101.804508,"52",71.26,71.26,93.12,93.12,85,110,25,24.25,24.25,93.67,"Thunderstorms. Scattered clouds. Warm.",31.00
133,1,"SYARIKAT PERNIAGAAN MOH GUAN HIN KEE (TUESDAY & THURSDAY CLOSE)",2.701899,101.95692,"47",71.48,71.48,89.14,89.14,80,106,26,23.25,23.25,88.06,"Thunderstorms. Scattered clouds. Warm.",31.00
134,1,"PASAR MINI PSA MAJU",2.6733018,101.9183997,"50",71.51,71.51,89.74,89.74,80,107,27,23.45,23.45,87.93,"Thunderstorms. Scattered clouds. Warm.",31.00
135,1,"RESTORAN NOOR BISTRO 71",2.673226,101.9183709,"48",71.51,71.51,89.72,89.72,80,107,27,23.44,23.44,87.92,"Thunderstorms. Scattered clouds. Warm.",31.00
136,1,"MY 77 KOPITIAM (Open everyday|Delivery: 9am-3pm)",2.6887005,101.9422248,"52",71.65,71.65,87.37,87.37,78,104,25,22.75,22.75,86.77,"Thunderstorms. Scattered clouds. Warm.",31.00
137,1,"RADHA STORE",2.6871375,101.9411722,"49",71.72,71.72,87.44,87.44,78,103,25,22.77,22.77,87.06,"Thunderstorms. Scattered clouds. Warm.",31.00
138,1,"PASAR MINI KONG FU (Mon-Fri: 12pm-6pm|Sat-Sun close)",2.6707416,101.9207543,"51",71.89,71.89,89.05,89.05,79,105,26,23.23,23.23,87.25,"Thunderstorms. Scattered clouds. Warm.",31.00
139,1,"BAN Y MINI MARKET",2.6707412,101.9207556,"11",71.89,71.89,89.05,89.05,79,105,26,23.23,23.23,87.25,"Thunderstorms. Scattered clouds. Warm.",31.00
140,1,"APMK ENTERPRISE",2.6707434,101.9207589,"34",71.89,71.89,89.05,89.05,79,105,26,23.23,23.23,87.25,"Thunderstorms. Scattered clouds. Warm.",31.00
141,1,"QIANYUGE MIXED RICE (Delivery: morning)",2.674784,101.929687,"49",72.09,72.09,88.62,88.62,78,104,26,23.12,23.12,89.19,"Thunderstorms. Scattered clouds. Warm.",31.00
142,1,"YUSNI IDRIS ENTERPRISE - NASI AYAM GEMAS MUSTAFAH (Friday close)",2.674735,101.929801,"46",72.10,72.10,88.59,88.59,78,104,26,23.11,23.11,89.16,"Thunderstorms. Scattered clouds. Warm.",31.00
143,1,"TONG AH PENGARAKAN SDN BHD ( MON-FRI 8:30AM-5PM )",2.674599,101.929871,"46",72.11,72.11,88.59,88.59,78,104,26,23.11,23.11,89.14,"Thunderstorms. Scattered clouds. Warm.",31.00
144,1,"1ST GRID SDN. BHD.",2.6664974,101.9183007,"100",72.13,72.13,89.58,89.58,79,106,27,23.40,23.40,87.78,"Thunderstorms. Scattered clouds. Warm.",31.00
145,1,"PASAR MINI YAKIN MAJU - P. PERDAGANGAN GEMAS",2.6665019,101.9183247,"50",72.13,72.13,89.58,89.58,79,106,27,23.40,23.40,87.78,"Thunderstorms. Scattered clouds. Warm.",31.00
146,1,"MR STORE ENTERPRISE",2.716927,101.984599,"52",72.17,72.17,94.32,94.32,84,111,27,24.64,24.64,93.99,"Thunderstorms. Scattered clouds. Warm.",31.00
147,1,"COLDMAXGOLD (TUESDAY OFF)",2.682553,101.943123,"43",72.26,72.26,87.96,87.96,79,105,26,22.94,22.94,87.63,"Thunderstorms. Scattered clouds. Warm.",31.00
148,1,"RJ FAMILY STORE SDN BHD (Receiving: After 11am)",2.680206,101.943952,"48",72.52,72.52,88.34,88.34,79,105,26,23.04,23.04,88.94,"Thunderstorms. Scattered clouds. Warm.",31.00
149,1,"SEMMA PASI FOOD EMPIRE (Mon-Sat: 8am-4pm|Sun close)",2.6802939,101.9453049,"48",72.60,72.60,88.51,88.51,79,105,26,23.09,23.09,88.68,"Thunderstorms. Scattered clouds. Warm.",31.00
150,1,"PEMBORONG RAO SDN BHD",3.8365807,101.3876052,"49",72.66,72.66,91.28,91.28,75,79,4,22.97,22.97,91.03,"Thunderstorms. Scattered clouds. Warm.",29.00
151,1,"VST MART",2.6519328,101.9053411,"46",72.70,72.70,91.99,91.99,82,109,27,24.03,24.03,90.19,"Thunderstorms. Scattered clouds. Warm.",31.00
152,1,"GAURANGA PURE VEGE HOUSE",2.6801935,101.9479377,"56",72.79,72.79,88.70,88.70,79,105,26,23.14,23.14,88.38,"Thunderstorms. Scattered clouds. Warm.",31.00
153,1,"RASAH JAYA DAILY MART SDN BHD",2.6784227,101.9478186,"49",72.94,72.94,88.84,88.84,80,106,26,23.17,23.17,88.52,"Thunderstorms. Scattered clouds. Warm.",31.00
154,1,"KEDAI RUNCIT AL SHAFI",2.705956,101.988207,"54",73.35,73.35,92.96,92.96,82,109,27,24.29,24.29,103.29,"Thunderstorms. Scattered clouds. Warm.",31.00
155,1,"PASARAYA SSR SENAWANG",2.69261,101.975052,"50",73.55,73.55,90.84,90.84,79,104,25,23.66,23.66,90.51,"Thunderstorms. Scattered clouds. Warm.",31.00
156,1,"LUCKY INN RESTAURANT (Receiving open at 3pm|Call before delivery)",2.697414,101.981562,"53",73.60,73.60,92.02,92.02,82,108,26,24.00,24.00,91.58,"Thunderstorms. Scattered clouds. Warm.",31.00
157,1,"MING TAI FOOD (M) SDN BHD (SENAWANG)",2.704814,101.99057,"52",73.62,73.62,102.74,102.74,93,102,9,26.07,26.07,103.26,"Thunderstorms. Scattered clouds. Warm.",31.00
158,1,"PASAR BORONG SENAWANG SDN BHD",2.714368,102.002103,"51",73.67,73.67,100.75,100.75,91,98,7,25.48,25.48,102.29,"Thunderstorms. Scattered clouds. Warm.",31.00
159,1,"MOHD ATHAR BIN BACHOK",2.714351,102.002091,"52",73.67,73.67,100.75,100.75,91,98,7,25.48,25.48,102.30,"Thunderstorms. Scattered clouds. Warm.",31.00
160,1,"JIT HENG CASH & CARRY",2.714624,102.002474,"55",73.68,73.68,100.76,100.76,91,98,7,25.48,25.48,102.18,"Thunderstorms. Scattered clouds. Warm.",31.00
161,1,"JATI FROZEN SDN BHD (SENAWANG BRANCH)",2.714067,102.002188,"55",73.70,73.70,100.77,100.77,91,98,7,25.49,25.49,102.11,"Thunderstorms. Scattered clouds. Warm.",31.00
162,1,"DEVIAD A/L FRANCIS",2.65255,101.9253291,"37",73.85,73.85,91.23,91.23,81,107,26,23.80,23.80,89.48,"Thunderstorms. Scattered clouds. Warm.",31.00
163,1,"MRANI ENTERPRISE (Delivery: 8.00am-11.00am)",2.6864949,101.9724358,"52",73.89,73.89,91.20,91.20,83,108,26,23.79,23.79,89.85,"Thunderstorms. Scattered clouds. Warm.",31.00
164,1,"BABAU SENTOSA SDN BHD",2.682213,101.972429,"83",74.27,74.27,90.27,90.27,79,104,25,23.51,23.51,90.11,"Thunderstorms. Scattered clouds. Warm.",31.00
165,1,"PASAR MINI MUHABBAT - SENAWANG (FRIDAY CLOSED)",2.701312,101.995469,"50",74.27,74.27,103.42,103.42,94,103,9,26.24,26.24,105.47,"Thunderstorms. Scattered clouds. Warm.",31.00
166,1,"PASAR MINI LONG ( PJB TAK BOLEH MASUK, HANTAR PAGI )",2.682198,101.972451,"50",74.27,74.27,90.27,90.27,79,104,25,23.51,23.51,90.11,"Thunderstorms. Scattered clouds. Warm.",31.00
167,1,"SILVER LINE SALES & SERVICES",2.68198,101.972747,"48",74.31,74.31,90.30,90.30,79,104,24,23.48,23.48,89.89,"Thunderstorms. Scattered clouds. Warm.",31.00
168,1,"RAHIMA MINI MARKET - TAMAN PERINDUSTRIAN LUKUT (Fri: 12pm-3pm close)",2.5917118,101.822286,"49",74.33,74.33,95.84,95.84,87,112,26,25.00,25.00,105.19,"Thunderstorms. Scattered clouds. Warm.",31.00
169,1,"KKH FRESHMART (PD) SDN BHD",2.591196,101.822544,"53",74.40,74.40,95.90,95.90,87,112,26,25.01,25.01,105.25,"Thunderstorms. Scattered clouds. Warm.",31.00
170,1,"THILAGAM MINI MARKET",2.68926,101.983768,"47",74.45,74.45,92.11,92.11,82,108,26,24.03,24.03,91.92,"Thunderstorms. Scattered clouds. Warm.",31.00
171,1,"PONNY CASH AND CARRY SDN. BHD.",2.689047,101.983868,"49",74.47,74.47,92.13,92.13,82,108,26,24.03,24.03,91.90,"Thunderstorms. Scattered clouds. Warm.",31.00
172,1,"PASAR MINI AL HAQ",2.6971037,101.9937649,"51",74.50,74.50,95.64,95.64,83,111,28,25.03,25.03,103.92,"Thunderstorms. Scattered clouds. Warm.",31.00
173,1,"SIAN BOY MIXED RICE",2.688826,101.98408,"48",74.51,74.51,93.52,93.52,81,108,27,24.43,24.43,91.74,"Thunderstorms. Scattered clouds. Warm.",31.00
174,1,"118 FRESHMART",3.097621,102.219079,"40",74.52,74.52,139.12,139.12,124,140,16,35.71,35.71,136.06,"Overcast. Extremely hot.",35.28
175,1,"HALLMARK BEVERAGE INDUSTRY SDN BHD",2.590784,101.82438,"56",74.52,74.52,96.20,96.20,87,113,26,25.09,25.09,105.05,"Thunderstorms. Scattered clouds. Warm.",31.00
176,1,"SAR NILAM ENTERPRISE",3.099941,102.220235,"48",74.61,74.61,138.83,138.83,124,139,16,35.63,35.63,135.77,"Overcast. Extremely hot.",35.28
177,1,"AIMAN BAHAR MINI MARKET",2.6914164,101.9888259,"43",74.62,74.62,93.25,93.25,83,110,26,24.32,24.32,104.81,"Thunderstorms. Scattered clouds. Warm.",31.00
178,1,"ON SEMICONDUCTOR MALAYSIA SDN. BHD.",2.688894,101.988648,"51",74.83,74.83,94.81,94.81,83,111,28,24.81,24.81,93.05,"Thunderstorms. Scattered clouds. Warm.",31.00
179,1,"PASAR MINI AR SENAWANG INDAH",2.695023,101.998962,"51",75.05,75.05,103.58,103.58,95,103,8,26.24,26.24,104.43,"Thunderstorms. Scattered clouds. Warm.",31.00
180,1,"YL CASH & CARRY",2.675555,101.976645,"46",75.14,75.14,91.82,91.82,81,106,25,23.91,23.91,91.85,"Thunderstorms. Scattered clouds. Warm.",31.00
181,1,"TF MULTI FOOD MARKETING SDN BHD (SAT NO RECEIVE)",2.675369,101.977762,"47",75.23,75.23,93.08,93.08,80,106,26,24.28,24.28,91.59,"Thunderstorms. Scattered clouds. Warm.",31.00
182,1,"KEDAI BORONG WAJA SDN BHD *MESTI NAK HANTAR 1ST KEDAI-PAGI (JUMAAT TUTUP)",2.675365,101.977882,"54",75.24,75.24,91.70,91.70,81,106,25,23.88,23.88,91.60,"Thunderstorms. Scattered clouds. Warm.",31.00
183,1,"SHANTI MASPADI SDN BHD",3.817922656,101.8519693,"48",75.60,75.60,111.12,111.12,100,116,15,28.48,28.48,109.91,"Thunderstorms. Scattered clouds. Warm.",29.00
184,1,"MATHIALAGAN FAMILY STORE (10am-5pm) (Saturday & Lunch hour : no receiving)",2.671145,101.982496,"53",75.93,75.93,94.91,94.91,83,110,27,24.80,24.80,91.87,"Thunderstorms. Scattered clouds. Warm.",31.00
185,1,"CMM CHITA ENTERPRISE",2.6707521,101.9825646,"85",75.96,75.96,93.79,93.79,82,108,27,24.50,24.50,91.98,"Thunderstorms. Scattered clouds. Warm.",31.00
186,1,"K JAYAKUMAR ENTERPRISE (open 10am-6pm)",2.574131,101.827276,"54",76.35,76.35,106.46,106.46,93,119,26,27.77,27.77,103.50,"Thunderstorms. Scattered clouds. Warm.",31.00
187,1,"PASARAYA TTJ FAMILY SDN BHD (Receiving: After 11am)",2.675131,101.993652,"50",76.36,76.36,95.09,95.09,83,109,26,24.80,24.80,93.38,"Thunderstorms. Scattered clouds. Warm.",31.00
188,1,"YAKIN HALAL MART",2.674543,101.993237,"46",76.38,76.38,94.99,94.99,82,109,26,24.78,24.78,92.59,"Thunderstorms. Scattered clouds. Warm.",31.00
189,1,"PASAR MINI NURSARI",2.6743991,101.9931765,"50",76.39,76.39,95.06,95.06,83,109,26,24.80,24.80,93.31,"Thunderstorms. Scattered clouds. Warm.",31.00
190,1,"RAHIMA MINI MARKET - TAMAN SRI LUKUT",2.578881,101.8442535,"49",76.63,76.63,104.39,104.39,88,116,27,27.27,27.27,101.23,"Thunderstorms. Scattered clouds. Warm.",31.00
191,1,"AKPS CASH & CARRY",2.5732709,101.8330101,"83",76.69,76.69,106.11,106.11,90,118,28,27.77,27.77,103.70,"Thunderstorms. Scattered clouds. Warm.",31.00
192,1,"SINAR JMART ENTERPRISE - Off every Friday",2.664112,101.98577,"47",76.76,76.76,95.25,95.25,84,111,27,24.88,24.88,94.74,"Thunderstorms. Scattered clouds. Warm.",31.00
193,1,"RAJBARI ENTERPRISE (FRIDAY 12.30PM-3PM OFF)",2.665372,101.987995,"49",76.81,76.81,97.50,97.50,84,111,27,25.47,25.47,92.89,"Thunderstorms. Scattered clouds. Warm.",31.00
194,1,"MING TAI FOOD (M) SDN BHD",2.5696012,101.829262,"52",76.90,76.90,106.56,106.56,91,120,28,27.88,27.88,103.41,"Thunderstorms. Scattered clouds. Warm.",31.00
195,1,"ELEN FRESH MART",2.6640302,101.9877915,"57",76.91,76.91,97.67,97.67,85,111,27,25.52,25.52,94.42,"Thunderstorms. Scattered clouds. Warm.",31.00
196,1,"SAIKUMARANS CASH & CARRY",2.568588,101.828739,"48",76.98,76.98,106.65,106.65,91,119,29,27.95,27.95,103.93,"Thunderstorms. Scattered clouds. Warm.",31.00
197,1,"ANTHONY A/L AROKIAM",2.5678068,101.8269905,"31",76.98,76.98,106.96,106.96,92,121,29,28.03,28.03,103.78,"Thunderstorms. Scattered clouds. Warm.",31.00
198,1,"MR MART TRADING (DELIVERY: 1pm-6pm)",2.5608222,101.8112615,"52",77.04,77.04,109.01,109.01,94,124,30,28.62,28.62,105.83,"Thunderstorms. Scattered clouds. Warm.",31.00
199,1,"UYIR INSPIRED SDN. BHD.",2.5603146,101.81157,"46",77.11,77.11,108.94,108.94,94,123,30,28.60,28.60,105.76,"Thunderstorms. Scattered clouds. Warm.",31.00
200,1,"SEGAR MINI MARKET",2.5609882,101.8153255,"48",77.19,77.19,109.43,109.43,95,124,30,28.73,28.73,105.53,"Thunderstorms. Scattered clouds. Warm.",31.00
201,1,"SHC SUCCESS WHOLESALER SDN BHD (Receiving 1pm-5pm)",2.5656164,101.8274333,"48",77.23,77.23,107.09,107.09,92,121,29,28.07,28.07,104.15,"Thunderstorms. Scattered clouds. Warm.",31.00
202,1,"M FAMILY MINI MART",2.5608411,101.8159328,"53",77.23,77.23,108.96,108.96,95,124,29,28.56,28.56,105.56,"Thunderstorms. Scattered clouds. Warm.",31.00
203,1,"M FAMILY MINI MARKET (DEL: 12pm to 6pm) Tuesday off",2.5605253,101.8156879,"53",77.25,77.25,109.00,109.00,95,124,29,28.57,28.57,105.59,"Thunderstorms. Scattered clouds. Warm.",31.00
204,1,"SIN NG WING SUN MINI MARKET",2.553235,101.8059851,"47",77.62,77.62,109.95,109.95,96,125,30,28.86,28.86,106.76,"Thunderstorms. Scattered clouds. Warm.",31.00
205,1,"LK MINI MART (Open everyday|Fri: 12.30pm-2.30pm close)",2.5744354,101.8558772,"53",77.62,77.62,104.87,104.87,91,118,27,27.40,27.40,102.22,"Thunderstorms. Scattered clouds. Warm.",31.00
206,1,"SENAWANG MART SDN. BHD.",2.656777,101.993386,"48",77.93,77.93,97.00,97.00,83,110,26,25.30,25.30,94.13,"Thunderstorms. Scattered clouds. Warm.",31.00
207,1,"ALANGACU UB TRADING",2.7312522,102.0785258,"91",78.34,78.34,109.84,109.84,99,105,6,27.74,27.74,111.15,"Overcast. Extremely hot.",35.28
208,1,"PASAR MINI AMPANGAN (Please call before arrange for delivery)",2.7312522,102.0785258,"51",78.34,78.34,109.84,109.84,99,105,6,27.74,27.74,111.15,"Overcast. Extremely hot.",35.28
209,1,"FADILA UNGGUL ENTERPRISE",2.662316,102.007342,"57",78.43,78.43,96.86,96.86,83,109,26,25.27,25.27,95.04,"Thunderstorms. Scattered clouds. Warm.",31.00
210,1,"KM BERSATU RESOURCES SDN. BHD. - PASAR SEGAR JIMAT PLUS",2.654857,102.003952,"53",78.83,78.83,98.25,98.25,87,113,26,25.63,25.63,95.35,"Thunderstorms. Scattered clouds. Warm.",31.00
211,1,"PD JIMAT ENTERPRISE",2.538253,101.797022,"49",78.83,78.83,112.00,112.00,97,128,30,29.40,29.40,108.81,"Thunderstorms. Scattered clouds. Warm.",31.00
212,1,"KIM GUAN HUAT",2.529281,101.799888,"53",79.88,79.88,112.95,112.95,99,130,31,29.70,29.70,109.78,"Thunderstorms. Scattered clouds. Warm.",31.00
213,1,"SUN HUP KI TRADING (open 10am - 6pm)",2.5300141,101.8031274,"47",79.92,79.92,112.63,112.63,97,128,30,29.57,29.57,109.62,"Thunderstorms. Scattered clouds. Warm.",31.00
214,1,"PEMBORONG MAKANAN & MINUMAN MUHIBAH",2.527122,101.798514,"49",80.05,80.05,113.30,113.30,100,130,31,29.79,29.79,110.14,"Thunderstorms. Scattered clouds. Warm.",31.00
215,1,"PEMBORONG MAKANAN & MINUMAN CERIA - PORT DICKSON",2.522651,101.797759,"49",80.49,80.49,114.58,114.58,102,133,31,30.13,30.13,111.31,"Thunderstorms. Scattered clouds. Warm.",31.00
216,1,"KEDAI RUNCIT SHARI (Delivery: 8am-11.30am)",2.5894446,101.964009,"54",82.08,82.08,102.89,102.89,90,119,28,26.92,26.92,99.75,"Thunderstorms. Scattered clouds. Warm.",31.00
217,1,"HANAMAN MAJU ENTERPRISE",2.5840205,101.9612125,"55",82.41,82.41,103.60,103.60,92,121,29,27.15,27.15,100.46,"Thunderstorms. Scattered clouds. Warm.",31.00
218,1,"BERKAT NORA FAMILY ENTERPRISE (Open 8am-6pm)",2.7483076,102.1822433,"43",86.07,86.07,122.61,122.61,111,119,8,31.06,31.06,123.93,"Overcast. Extremely hot.",35.28
219,1,"PIRAMILA A/P ARUMUGAM",2.5482813,101.9753894,"49",86.60,86.60,108.67,108.67,96,125,29,28.48,28.48,105.53,"Thunderstorms. Scattered clouds. Warm.",31.00
220,1,"KEDAI RUNCIT MESTINA JAYA",2.7412015,102.1842105,"54",86.72,86.72,121.72,121.72,110,117,8,30.84,30.84,123.04,"Overcast. Hot.",31.78
221,1,"DSENARA ENTERPRISE (Mon-Fri: 7am-4pm|Sat-Sun close)",2.7012793,102.1629923,"94",87.61,87.61,124.13,124.13,113,120,7,31.40,31.40,125.36,"Overcast. Hot.",31.78
222,1,"PASAR MINI PEDAS",2.58707,102.049179,"50",87.85,87.85,109.62,109.62,92,117,26,28.59,28.59,108.39,"Thunderstorms. Scattered clouds. Warm.",31.00
223,1,"MY FRESH BOX SDN. BHD.",3.500195132,102.2918905,"52",87.96,87.96,121.12,121.12,103,116,13,30.94,30.94,118.05,"Thunderstorms. Scattered clouds. Warm.",29.00
224,1,"AD DIN TEGUH RESOURCES",2.8609839,102.2711055,"61",88.09,88.09,151.29,151.29,140,152,12,38.58,38.58,152.61,"Overcast. Extremely hot.",35.28
225,1,"NEPHRO MESRA SDN. BHD. - PASAR MINI JUASSEH SENTOSA",2.8610535,102.2713192,"52",88.11,88.11,151.28,151.28,140,152,12,38.58,38.58,152.61,"Overcast. Extremely hot.",35.28
226,1,"PASAR MINI HAFIZI",2.575877,102.045429,"51",88.57,88.57,108.41,108.41,90,116,26,28.28,28.28,109.79,"Overcast. Hot.",31.78
227,1,"RESTORAN MOHAMADUNNI",2.4627127,101.8543241,"48",88.95,88.95,118.56,118.56,99,127,27,30.97,30.97,115.76,"Thunderstorms. Scattered clouds. Warm.",31.00
228,1,"SHU BEE ENTERPRISE",2.594095,102.078388,"48",89.31,89.31,109.47,109.47,94,122,27,28.60,28.60,107.66,"Overcast. Hot.",31.78
229,1,"SARVANA TRADING (Call Before Delivery)",2.739467,102.223562,"48",90.38,90.38,126.73,126.73,116,125,9,32.16,32.16,128.04,"Overcast. Hot.",31.78
230,1,"JALIL MINI MART ( FRIDAY 12.30PM-3PM OFF )",2.589372,102.093896,"55",90.83,90.83,111.59,111.59,98,125,28,29.20,29.20,109.69,"Overcast. Hot.",31.78
231,1,"KEDAI RUNCIT SAFIUDEEN (FRIDAY 12PM-2PM OFF)",2.589137,102.093841,"54",90.85,90.85,111.61,111.61,98,125,28,29.21,29.21,109.67,"Overcast. Hot.",31.78
232,1,"SI RUSA MINI MARKET",2.4456901,101.8590868,"48",90.90,90.90,120.55,120.55,101,129,27,31.49,31.49,117.77,"Thunderstorms. Scattered clouds. Warm.",31.00
233,1,"PASAR MINI AL FATIMAH - PORT DICKSON",2.448229,101.869155,"51",91.06,91.06,122.51,122.51,105,133,28,32.06,32.06,119.64,"Thunderstorms. Scattered clouds. Warm.",31.00
234,1,"JALIL MINI MART (FRIDAY 2PM-3.30PM OFF)",2.591818,102.100117,"55",91.09,91.09,112.08,112.08,98,126,28,29.33,29.33,110.34,"Overcast. Hot.",31.78
235,1,"HUP CHON CHAN (Monday to Friday - 9am to 5pm)",3.479771578,102.3308234,"55",91.20,91.20,127.11,127.11,110,123,14,32.52,32.52,124.07,"Thunderstorms. Scattered clouds. Warm.",29.00
236,1,"JATI FROZEN SDN BHD (REMBAU BRANCH) - Open 9am-9pm",2.589475,102.099087,"55",91.21,91.21,112.00,112.00,97,125,28,29.31,29.31,110.19,"Overcast. Hot.",31.78
237,1,"KELUARGA IMAM ENTERPRISE (7am-6pm|Fri close)",2.8965716,102.3183315,"54",91.28,91.28,128.44,128.44,127,142,14,32.86,32.86,155.74,"Overcast. Hot.",31.78
238,1,"NEW HUP CHONG ( MON-SAT 9AM-6PM)",3.487490745,102.3288132,"51",91.28,91.28,126.24,126.24,107,121,14,32.30,32.30,123.00,"Thunderstorms. Scattered clouds. Warm.",29.00
239,1,"PASARAYA PEBBLE BEACH",2.442176,101.8648555,"50",91.50,91.50,121.51,121.51,103,130,28,31.80,31.80,118.68,"Thunderstorms. Scattered clouds. Warm.",31.00
240,1,"JATI FROZEN SDN BHD (KUALA PILAH BRANCH)",2.735137,102.234947,"55",91.69,91.69,127.50,127.50,115,125,10,32.41,32.41,129.14,"Overcast. Hot.",31.78
241,1,"CHIA YEN LAI ENTERPRISE (Open 7am-4pm|Tue close)",2.7366944,102.2385201,"81",91.92,91.92,128.14,128.14,117,126,10,32.57,32.57,130.85,"Overcast. Hot.",31.78
242,1,"SYARIKAT SARVANA",2.734932,102.240854,"47",92.24,92.24,128.16,128.16,116,126,10,32.57,32.57,130.28,"Overcast. Hot.",31.78
243,1,"KEDAI RUNCIT ROBI",2.7416036,102.2461086,"54",92.31,92.31,130.03,130.03,119,129,11,33.10,33.10,131.39,"Overcast. Hot.",31.78
244,1,"AMAZING INDUSTRIES SDN BHD - Monday to saturday",3.449908117,102.3515554,"34",92.34,92.34,130.43,130.43,112,125,14,33.37,33.37,127.60,"Thunderstorms. Scattered clouds. Warm.",29.00
245,1,"SYARIKAT MOHD.ISA BERSAUDARA (Fri-Sat: Close)",2.7390995,102.2453252,"47",92.39,92.39,129.35,129.35,118,128,10,32.88,32.88,130.81,"Overcast. Hot.",31.78
246,1,"MHD YUNUS BIN A.MANAP (Fri: Close)",2.8793555,102.3230852,"53",92.50,92.50,150.28,150.28,137,149,12,38.32,38.32,157.71,"Overcast. Hot.",31.78
247,1,"PERNIAGAAN BANGLANG SERI SERTING",2.8785885,102.3234398,"49",92.57,92.57,150.19,150.19,137,149,12,38.30,38.30,157.79,"Overcast. Hot.",31.78
248,1,"TEE HIAP HUAT TRADING",2.740523,102.248994,"47",92.64,92.64,129.63,129.63,119,130,10,32.95,32.95,130.76,"Overcast. Hot.",31.78
