cluster_id,sequence,store_name,tonnage,cumulative_tonnage,p2p_dist_km,cumulative_dist_km,dist_to_origin_km,fuel_litres,latitude,longitude
1,1,"PASAR MINI PAYA JARAS",50,50.000,0.813,0.813,0.813,0.234,3.2002098,101.5507472
2,1,"HAI SOON HENG TRADING (Delivery after 12pm)",56,56.000,1.260,1.260,1.260,0.374,3.21061,101.566028
3,1,"RESTORAN C&Y - (OPEN 7AM-12PM)",49,49.000,1.431,1.431,1.431,0.409,3.1968558,101.5657222
3,2,"RESTORAN KONG MAH SDN BHD (open 7am - 4pm)(tuesday closed)",48,97.000,0.085,1.516,1.355,0.024,3.1975612,101.5654258
4,1,"ADA CASH & CARRY SDN BHD (Mon: No delivery after 2 pm)",96,96.000,1.381,1.381,1.381,0.516,3.210918,101.567095
5,1,"LASHIKA SPICES - OPEN 7AM-10PM & 2PM-4:30PM - (11AM-2PM TAK BOLEH DELIVERY)",53,53.000,1.425,1.425,1.425,0.416,3.1957531,101.5645649
6,1,"PASAR MINI KURNIA MAJU - JUMAAT TUTUP",50,50.000,1.439,1.439,1.439,0.414,3.1984813,101.5670179
7,1,"ENG SIANG GROCER (Mon: Close|Loading at 9.30am-7.30pm)",57,57.000,1.521,1.521,1.521,0.453,3.1968201,101.5667535
8,1,"AZIZI MINI MARKET",58,58.000,1.544,1.544,1.544,0.462,3.1973148,101.567381
9,1,"ST.MARK'S COZY HOME",47,47.000,1.595,1.595,1.595,0.452,3.197425,101.56801
9,2,"KS MART SDN BHD",53,100.000,0.033,1.628,1.584,0.010,3.197716,101.568073
10,1,"BERAS AGRO (M) SDN BHD",40,40.000,1.970,1.970,1.970,0.539,3.1899834,101.5649231
10,2,"NUR SAKINAH TRADING",51,91.000,0.397,2.368,1.584,0.115,3.192631,101.5625203
11,1,"RAJDHANI SDN BHD",49,49.000,1.999,1.999,1.999,0.572,3.2121628,101.5726418
11,2,"AURA NURILHAM ENTERPRISE",45,94.000,0.797,2.796,1.594,0.223,3.2153632,101.5662228
12,1,"CHIA SHING FOOD INDUSTRIES SDN BHD",53,53.000,1.661,1.661,1.661,0.485,3.198458,101.5692969
12,2,"SUN THONG HING SDN BHD",47,100.000,0.297,1.958,1.600,0.084,3.196536,101.567435
13,1,"RESTORAN LEE HONG KEE SDN. BHD.OPEN-12-3PM MONDAY HALF DAY ONLY",48,48.000,3.065,3.065,3.065,0.873,3.1827378,101.5401381
13,2,"NAD SAMUDERA ENTERPRISE (Fri: Close 12pm-3pm)",52,100.000,1.333,4.399,1.747,0.387,3.1932652,101.5458882
14,1,"FK SALMA ENTERPRISE",56,56.000,1.954,1.954,1.954,0.579,3.1905493,101.565561
15,1,"PINNACLE FOODS (M) SDN BHD",49,49.000,2.142,2.142,2.142,0.613,3.1882442,101.5649721
15,2,"RESTORAN SERI RASA",48,97.000,0.273,2.415,1.970,0.078,3.1905466,101.5658297
16,1,"RESTORAN BAK KUT TEH KIM KEE",49,49.000,2.062,2.062,2.062,0.590,3.1982949,101.5732
17,1,"SOON CHEONG MARINE PRODUCTS SDN BHD(SG BULOH)",47,47.000,2.630,2.630,2.630,0.745,3.225815,101.56779
17,2,"PERNIAGAAN SUNGHO FOOD SDN BHD",49,96.000,0.539,3.169,2.264,0.154,3.224367,101.5631572
18,1,"MOITTRY INFINITY SDN BHD",52,52.000,2.316,2.316,2.316,0.673,3.187388,101.5666542
19,1,"PASA RAYA TOP CIRCUITS SDN BHD",51,51.000,2.356,2.356,2.356,0.681,3.1882925,101.5686546
20,1,"ISKANDAR BIN HUSAINI (Open 9am-6pm|Fri: 12pm-3pm rest)",55,55.000,2.373,2.373,2.373,0.700,3.2018728,101.5349002
21,1,"KEDAI RUNCIT MOHD FADZIL HAIRI",54,54.000,2.392,2.392,2.392,0.702,3.1993666,101.5352935
22,1,"KEDAI RUNCIT MOHD FADZIL HAIRI (12pm-3pm close)",54,54.000,2.392,2.392,2.392,0.702,3.1993666,101.5352935
23,1,"HOCK SOON BAK KUT TEH (MONDAY OFF)",55,55.000,2.519,2.519,2.519,0.743,3.1927097,101.5748633
24,1,"ASIAN DINE SDN BHD",94,94.000,2.615,2.615,2.615,0.964,3.187566,101.571467
25,1,"ENG HUP SENG SESAME OIL & SAUCE FACTORY SDN BHD-DELIVER BY FORKLIFT",57,57.000,2.665,2.665,2.665,0.794,3.188169,101.572788
26,1,"RESTORAN MEI JING (Open 2pm-10pm,KHAMIS TUTUP)",48,48.000,2.689,2.689,2.689,0.766,3.188149,101.573081
27,1,"PERNIAGAAN HE SOON (no delivery on Monday)",49,49.000,2.690,2.690,2.690,0.769,3.188298,101.573231
28,1,"HO KIM WEI (1pm - 3pm : no delivery)",55,55.000,2.691,2.691,2.691,0.793,3.188286,101.573236
29,1,"SEMAQ IQHLAS SDN BHD",48,48.000,2.692,2.692,2.692,0.766,3.188219,101.57318
29,2,"PANTAI SELAMAT (IM) S/B",51,99.000,0.003,2.695,2.691,0.001,3.188202,101.573154
30,1,"SRI RANTAU FOOD MART (8.00am – 12.00pm / 2.00pm – 5.00pm) (Tue & Sun Off)",47,47.000,2.692,2.692,2.692,0.763,3.188163,101.573131
31,1,"BUMI SEHATI FROZEN FOOD SDN BHD",85,85.000,2.693,2.693,2.693,0.938,3.188154,101.573128
32,1,"OLIVAS BAKERY INGREDIENTS SDN BHD",51,51.000,2.703,2.703,2.703,0.781,3.1881,101.573205
32,2,"YOW SENG SDN BHD",46,97.000,0.006,2.709,2.699,0.002,3.1881,101.573155
33,1,"KEDAI BORONG DAN RUNCIT YUSOF MAJU (OPEN 9AM-5PM) (FRIDAY CLOSE) (12PM-2PM REHAT)",54,54.000,2.768,2.768,2.768,0.812,3.1972137,101.5324219
34,1,"NORLYS KITCHEN & CATERING",51,51.000,2.793,2.793,2.793,0.807,3.2134363,101.5321978
35,1,"DISTINCTIVE MODEL SDN BHD (TOYOTA SERVIS CENTRE)",66,66.000,2.940,2.940,2.940,0.919,3.1877839,101.5758332
36,1,"BINTANG HU TRADING(FRIDAY CLOSED)",82,82.000,2.967,2.967,2.967,1.016,3.2118755,101.5300983
37,1,"KEDAI RUNCIT ZULKIFLY (OPEN 7AM-6 PM) (CLOSE ON FRIDAY 12PM-3PM)",54,54.000,3.224,3.224,3.224,0.946,3.1993933,101.5275686
38,1,"MITAJAYA TRADING",52,52.000,3.286,3.286,3.286,0.954,3.1928766,101.5291471
39,1,"L & P MINI MARKET (khamis tutup)",53,53.000,3.890,3.890,3.890,1.135,3.1987847,101.590422
40,1,"MB RETAIL ENTERPRISE (9AM - 5PM)",53,53.000,3.928,3.928,3.928,1.146,3.1773599,101.5776437
41,1,"A&Z BARKAT MAJU MARKETING (12pm-3pm close)",93,93.000,3.945,3.945,3.945,1.445,3.1909023,101.5884752
42,1,"NASABE ENTERPRISE (12pm-3pm close)",52,52.000,3.999,3.999,3.999,1.161,3.190733,101.5889367
42,2,"DAMANSARA DAMAI ENTERPRISE (12pm-3pm close)",39,91.000,0.165,4.164,3.998,0.045,3.1893964,101.5883007
43,1,"NASI KANDAR ALI NAS MAJU (Restoran Alinas Aman Putri)",52,52.000,4.197,4.197,4.197,1.219,3.2174739,101.520213
44,1,"PASAR RAYA BORONG DAN RUNCIT SURIA (SATURDAY AFTER 2PM NO RECEIVED GOOD)",50,50.000,4.224,4.224,4.224,1.214,3.173116,101.576215
45,1,"REZAL TRADING - AL FALAH MART (Fri-Sat close)",48,48.000,5.128,5.128,5.128,1.460,3.19172,101.600144
45,2,"RAYYAN SPEEDMART(MOHD LUKMAN)",49,97.000,0.928,6.057,4.386,0.266,3.1981898,101.5948604
46,1,"FALAM ENTERPRISE (PASAR MINI SIRAJANE)",57,57.000,4.409,4.409,4.409,1.314,3.1673444,101.5674932
47,1,"PEMBORONG & PERUNCIT LINA (Sat: Close)",49,49.000,4.428,4.428,4.428,1.267,3.2219337,101.5197575
48,1,"KAMPONG KOH SAUCE (M) SDN BHD - (DELIVERY BEFORE 12PM)",54,54.000,5.428,5.428,5.428,1.592,3.20282,101.604827
48,2,"WHITE HERON PRARMACEUTICAL SDN BHD",46,100.000,0.161,5.589,5.274,0.045,3.20331,101.603463
49,1,"K.I.P FRESH MART ( ALL DAY OPEN )",54,54.000,5.708,5.708,5.708,1.675,3.206097,101.607407
50,1,"BINTANG HU TRADING (FRIDAY CLOSED)",57,57.000,6.559,6.559,6.559,1.954,3.2073436,101.4969526
51,1,"IPOH ROAD HAKKA YONG TAU FU",55,55.000,6.643,6.643,6.643,1.959,3.207375,101.615795
52,1,"TONG SIANG KITCHEN SDN BHD (Thursday Close)",46,46.000,6.649,6.649,6.649,1.874,3.208827,101.615782
53,1,"FOOK XIN TANG MINI MARKET SDN. BHD. (After 5pm: NO DELIVERY)",56,56.000,6.661,6.661,6.661,1.974,3.212246,101.615597
54,1,"KEDAI UBAT & RUNCIT HONG NING DESA AMAN PURI SDN BHD",54,54.000,6.669,6.669,6.669,1.956,3.212419,101.615643
55,1,"FOOK XIN TANG HERBS SDN. BHD.",56,56.000,6.676,6.676,6.676,1.979,3.212526,101.615695
56,1,"RESTORAN IPOH ROAD YTF",48,48.000,6.678,6.678,6.678,1.901,3.206805,101.616135
57,1,"RESTORAN NURI AL NISAR",48,48.000,7.959,7.959,7.959,2.266,3.2032786,101.4843394
57,2,"NASABE ENTERPRISE (12pm-3pm close)",52,100.000,2.865,10.824,6.785,0.832,3.2250317,101.4981694
58,1,"SETAPAK YONG TAU FU ENTERPRISE",48,48.000,6.795,6.795,6.795,1.934,3.212016,101.616831
59,1,"FOONG YUEN DIM SUM SDN BHD",56,56.000,6.820,6.820,6.820,2.021,3.210003,101.6172518
60,1,"H AND C FRESH SDN. BHD. (SAT-Closed, 1pm-3pm lunch)",56,56.000,6.823,6.823,6.823,2.022,3.183922,101.613608
61,1,"JIN HUANG",55,55.000,6.824,6.824,6.824,2.012,3.183931,101.613617
62,1,"TMS SUPER STORE",47,47.000,6.826,6.826,6.826,1.933,3.183918,101.613631
62,2,"PD DELIMEE FOOD INDUSTRIES",49,96.000,0.001,6.827,6.824,0.000,3.183922,101.61362
63,1,"JT FOOD MART",54,54.000,6.826,6.826,6.826,2.002,3.183989,101.613656
64,1,"HAJI SHARIFF CENDOL",56,56.000,6.826,6.826,6.826,2.023,3.183945,101.61364
65,1,"SOON CHEONG MARINE PRODUCTS SDN BHD",47,47.000,6.883,6.883,6.883,1.950,3.199847,101.617757
65,2,"SRI RANTAU SPEED MART - 3pm close every day",47,94.000,1.838,8.721,6.828,0.521,3.183843,101.613623
66,1,"K.H.H. DOUBLE LION FRUIT JUICE MANUFACTURING SDN BHD",54,54.000,7.098,7.098,7.098,2.082,3.2169131,101.6188698
67,1,"BEST RETAIL SDN BHD (BR INGREDIENTS) (Mon to Sat 9.30am-6.30pm) (Sun & PH 9.30am-3pm)",98,98.000,7.231,7.231,7.231,2.735,3.20312424,101.6210952
68,1,"PD DAILY FRESH",49,49.000,7.760,7.760,7.760,2.220,3.153949,101.60333
68,2,"YAYA NEW FLAVOURS SDN BHD (CLOSE: TUESDAY)",46,95.000,1.311,9.070,7.359,0.369,3.164639,101.6083
69,1,"JW GROCERY STORE (Mon-Sat: 9.30am-6pm|Fri: 12pm-3pm rest)",54,54.000,7.767,7.767,7.767,2.279,3.153636,101.603084
70,1,"PERNIAGAAN MAHAMAS (Tue-Sun:7.30am-7pm|Except Mon 7.30am-2pm)",49,49.000,7.825,7.825,7.825,2.239,3.2168783,101.6255266
71,1,"MKR STORE",52,52.000,7.848,7.848,7.848,2.279,3.2160498,101.6258664
72,1,"BIG TREE CORNER",74,74.000,8.306,8.306,8.306,2.714,3.219705044,101.6294093
73,1,"KINDNESS ENTERPRISE (CLOSED MONDAY)",53,53.000,8.414,8.414,8.414,2.456,3.201396,101.631682
74,1,"CAMP FOREST RESTAURANT (Open 11.30am-10.30pm)",64,64.000,8.510,8.510,8.510,2.631,3.214478948,101.6320953
75,1,"RING ZHI VAGETARIAN RESTAURANT (11AM-7PM)",48,48.000,9.140,9.140,9.140,2.602,3.212824,101.6379809
75,2,"PAN HEONG BAK KUT TEH",51,99.000,0.436,9.576,8.728,0.126,3.213731,101.6341568
76,1,"KS SMART MART SDN. BHD. (Mon-Sat: 9am-7pm)",53,53.000,11.180,11.180,11.180,3.263,3.1995828,101.4554655
76,2,"AMA WORLDWIDE SDN BHD (Open 8am-8pm) Friday closed",10,63.000,2.361,13.540,8.819,0.566,3.2009369,101.4766868
77,1,"AGRO 19 BERHAD",25,25.000,9.606,9.606,9.606,2.455,3.196037479,101.6420222
77,2,"OVAL LAKE DEVELOPMENT SDN BHD (Mon-Fri: 9am-4pm|Lunch: 12pm-2pm)",51,76.000,0.591,10.197,9.019,0.171,3.1972327,101.636834
78,1,"RESTORAN FERN HEONG (8.30AM-4.30PM)",49,49.000,9.205,9.205,9.205,2.633,3.212679,101.6385787
79,1,"WONG YEE HUEK (THURSDAY OFF)",46,46.000,9.709,9.709,9.709,2.737,3.212531,101.64315
79,2,"JODAN WORLD SDN BHD",54,100.000,0.538,10.247,9.306,0.158,3.215355,101.639214
80,1,"HAPPY SAM VEGE GARDEN",55,55.000,9.376,9.376,9.376,2.765,3.1885897,101.6387798
81,1,"ABT FRESH & FROZEN FOOD SUPPLY S/B (MON-FRI 8AM-5 PM) (SAT 8AM-1PM)",55,55.000,9.672,9.672,9.672,2.852,3.156204699,101.6279132
82,1,"BI IZNILLAH ENTERPRISE (Open 9am - 7pm)",74,74.000,10.305,10.305,10.305,3.367,3.2465493,101.4728759
83,1,"PENG SOON",49,49.000,12.224,12.224,12.224,3.497,3.128451,101.634727
83,2,"RESTORAN AL-RIFAAHY MAJU",49,98.000,1.639,13.862,10.585,0.469,3.138613,101.624039
84,1,"PARK LOKE YUN SUPERMARKET",51,51.000,10.769,10.769,10.769,3.112,3.2204941,101.6517953
85,1,"BEN MART TRADING SDN BHD",71,71.000,10.804,10.804,10.804,3.470,3.206207093,101.6533077
86,1,"CHOP HONG CHAN (Open 8am)",82,82.000,10.906,10.906,10.906,3.733,3.214863859,101.653769
87,1,"JIT XING TRADING (DELIVERY MON-FRI : 10AM-5.30PM)",55,55.000,11.085,11.085,11.085,3.269,3.237704,101.650428
88,1,"ATHILAKSHMI CASH & CARRY SDN BHD",99,99.000,11.343,11.343,11.343,4.319,3.198416112,101.6579334
89,1,"ELIXIR IMPEX SDN. BHD. (Mon-Sat: 9am-6pm|Fri: 12pm-3pm)",57,57.000,11.821,11.821,11.821,3.522,3.305566,101.591379
90,1,"126 RESTAURANT (9AM-3.30PM)",99,99.000,12.105,12.105,12.105,4.609,3.196440575,101.6646699
91,1,"JAYA CASH & CARRY SDN BHD",55,55.000,12.528,12.528,12.528,3.694,3.316964,101.571058
92,1,"IPOH ROAD HAKKA YONG TAU FU RESTAURANT",55,55.000,12.563,12.563,12.563,3.705,3.3161076,101.5338966
93,1,"SINAR TEGUH RESOURCES (Mon-Sat: 9.30am-6pm| Fri: NO DELIVERY)",47,47.000,12.996,12.996,12.996,3.681,3.251992,101.448689
93,2,"KZ KIOSK (Mon-Fri: 8am-6pm| Fri: 12pm-3pm rest| Sat: 3pm close)",53,100.000,1.406,14.401,12.657,0.410,3.239434,101.447236
94,1,"RS VALLEY TRADING & SERVICES - PPAJ (Fri: 12pm-3pm rest)",48,48.000,13.224,13.224,13.224,3.764,3.25282,101.446804
94,2,"PASAR RAYA ASS SETIA",50,98.000,7.509,20.733,12.806,2.159,3.301924,101.493232
95,1,"CHIN SWEE FOOD SDN BHD (10am-5pm) (RABU TUTUP)",100,100.000,12.848,12.848,12.848,4.925,3.170735565,101.6664263
96,1,"SOON LEE & WTC SDN BHD (Monday off; 12pm-2pm lunch)",47,47.000,13.391,13.391,13.391,3.793,3.323644,101.578322
96,2,"YOW SENG SDN BHD",46,93.000,9.664,23.055,13.070,2.724,3.275233,101.650625
97,1,"LAVANIZ FRESH MART",53,53.000,13.164,13.164,13.164,3.842,3.129195,101.465181
98,1,"RS VALLEY TRADING & SERVICES - TIAJ (Fri: 12pm-3pm rest)",48,48.000,13.166,13.166,13.166,3.748,3.129189,101.465156
99,1,"CHOP LIAN HUP (SUNDAY CLOSE) MON-SAT 7AM-7PM",27,27.000,13.178,13.178,13.178,3.398,3.129092,101.465103
99,2,"GAYA BUMI ENTERPRISE (Mon-Sat: 9am-6pm)",56,83.000,0.005,13.182,13.174,0.001,3.129132,101.465112
100,1,"KT MAHESWARI FRESH MARKET ENTERPRISE (Mon-Sat: 9am-5pm)",53,53.000,13.174,13.174,13.174,3.845,3.129055,101.465173
101,1,"SAKTHI RS SDN BHD (Mon-Sat: 9am-6pm)",48,48.000,13.174,13.174,13.174,3.750,3.129055,101.465173
102,1,"WAAJIBA TRADING (Mon-Sat: 9am-6pm|Fri: 12pm-3pm rest)",46,46.000,13.176,13.176,13.176,3.714,3.129065,101.465149
103,1,"KEDAI RUNCIT MUTIARA BARU (Mon-Sat: 8am-6pm| Fri: 12pm-3pm rest| Sat: 4pm close)",54,54.000,13.177,13.177,13.177,3.866,3.128985,101.465202
104,1,"CLC WHOLESALER (BANTING) SDN BHD",63,63.000,13.177,13.177,13.177,4.052,3.129043,101.46515
105,1,"HO HO TRADING COMPANY",55,55.000,13.177,13.177,13.177,3.886,3.129043,101.46515
106,1,"YUVAS CASH & CARRY (Mon-Sat: 9am-6pm)",46,46.000,13.179,13.179,13.179,3.715,3.129047,101.465127
106,2,"PEMBORONG BARANG RUNCIT SM LEE",49,95.000,0.003,13.182,13.177,0.001,3.129043,101.46515
107,1,"MINI MARKET NIRMALA (Mon-Sat: 9.30am-6pm)",52,52.000,13.178,13.178,13.178,3.827,3.129083,101.465105
108,1,"PASAR MINI NUR AZAINAH (Fri: 12pm-4pm rest)",50,50.000,13.179,13.179,13.179,3.789,3.129063,101.465117
109,1,"PASAR MINI FAIRPRICE TAMAN SENTOSA (Mon-Sat: 9am-6pm)",51,51.000,13.180,13.180,13.180,3.808,3.129071,101.465099
110,1,"KEDAI UBAT TONG SENG",54,54.000,13.180,13.180,13.180,3.867,3.128973,101.465176
111,1,"RESTORAN OON OON (1pm - 5pm) (ISNIN CUTI)",48,48.000,13.181,13.181,13.181,3.752,3.129041,101.465112
111,2,"VSM STORES SDN BHD (Mon-Sat: 10am-6pm)",46,94.000,0.002,13.183,13.180,0.001,3.129028,101.465126
112,1,"PASAR RAYA SMART (Fri: 1pm-3pm rest)",50,50.000,13.181,13.181,13.181,3.790,3.129065,101.465087
112,2,"BUN VIET RESTAURANT (Mon-Sat: 11am-8pm)",42,92.000,0.006,13.187,13.181,0.002,3.12911,101.465052
113,1,"PASAR MINI SETIA ALAM (Mon-Sat: 2pm-8pm)",50,50.000,13.182,13.182,13.182,3.790,3.128994,101.465137
113,2,"SUNSEEN TRADING",47,97.000,0.001,13.183,13.182,0.000,3.128987,101.465145
114,1,"PASAR MINI MESRA RKS (Mon-Fri: 8.30am-6pm|Sat: 3pm close)",50,50.000,13.182,13.182,13.182,3.790,3.128971,101.465152
115,1,"KEDAI RUNCIT RAMLI MUHAMMAD MAJU (Mon-Sat: 9.30am-6pm|Fri:12pm-3pm rest)",54,54.000,13.183,13.183,13.183,3.867,3.128946,101.465166
116,1,"SOHEL DAILY FRESH ENTERPRISE (Mon-Sat: 10am-6pm|Fri: 12pm-3pm close)",47,47.000,13.184,13.184,13.184,3.734,3.128928,101.465163
116,2,"SUMON MAJU SDN. BHD. (Mon-Sat: 10am-8pm|Fri: 12pm-3pm rest)",47,94.000,0.002,13.186,13.183,0.001,3.128945,101.465163
117,1,"JANNAH MAMA ENTERPRISE (Mon-Fri: 8am-6pm| Fri: 12pm-3pm rest| Sat: 5pm close)",55,55.000,13.183,13.183,13.183,3.887,3.129043,101.465079
118,1,"CRESCENT STAR IMPEX SDN. BHD.",69,69.000,13.184,13.184,13.184,4.188,3.129036,101.465082
119,1,"AZVA GLOBAL SDN BHD (Mon-Fri: 8am-6pm|Fri: 12pm-3pm rest|Sat: 4pm close)",92,92.000,13.184,13.184,13.184,4.798,3.129033,101.465084
120,1,"KEDAI RUNCIT AMIRUDDIN (Fri: 12pm-3pm rest)",54,54.000,13.184,13.184,13.184,3.868,3.129018,101.465089
121,1,"BEST FRESH MART SDN BHD - KLANG (Open at 10am|Sat: NO DELIVERY)",61,61.000,13.185,13.185,13.185,4.011,3.128967,101.465128
122,1,"PEMBORNG BARANG RUNCIT PELANGI (Mon-Sat: 10am-6pm)",49,49.000,13.185,13.185,13.185,3.772,3.128967,101.465128
123,1,"PASAR MINI AZAM BARUNA (Mon-Sat: 9.30am-6pm|Fri: 12pm-3pm rest)",51,51.000,13.185,13.185,13.185,3.810,3.128983,101.465114
124,1,"AHMAD PATANG ENTERPRISE (Mon-Sat: 9am-6pm)",66,66.000,13.185,13.185,13.185,4.120,3.12898,101.465116
125,1,"THAYA MINI MARKET SDN BHD (Mon-Sat: 9.30am-6pm)",47,47.000,13.185,13.185,13.185,3.735,3.128979,101.46511
125,2,"PASAR RAYA KAMKA",50,97.000,0.001,13.186,13.185,0.000,3.12898,101.465116
126,1,"KEDAI UBAT & PASAR MINI WENG HONG ONN SDN. BHD",54,54.000,13.185,13.185,13.185,3.868,3.12897,101.465122
127,1,"PAK DEEN GROCERS SDN. BHD. (Mon-Sat: 9am-6pm|Fri: 12pm-3pm rest)",51,51.000,13.185,13.185,13.185,3.810,3.12897,101.465122
128,1,"PASAR MINI SRI EHSAN (Mon-Fri : 8am-6pm | Sat : 3pm closed)",50,50.000,13.185,13.185,13.185,3.791,3.12897,101.465122
129,1,"DWELLING MAKERS SDN BHD - WYNDHAM (ACMAR KLANG) (Mon-Fri: 9am-12pm, 2pm-5pm)",98,98.000,13.185,13.185,13.185,4.988,3.128992,101.465101
130,1,"A&T ASTAKA MART-PORT KLANG (Mon-Sat: 9am-6m)",90,90.000,13.186,13.186,13.186,4.739,3.128957,101.465118
131,1,"A.RENGASAMY & SONS (MON-FRI : 8AM-6PM | SAT CLOSED AT 3PM)",97,97.000,13.186,13.186,13.186,4.956,3.128957,101.465118
132,1,"AL HISHA MINI MARKET (Mon-Sat: 9am-6pm| Fri: NO DELIVERY)",97,97.000,13.186,13.186,13.186,4.956,3.128957,101.465118
133,1,"ASHOKAH GROCERY & SPICE MART (Mon-Sat: 10am-6pm)",31,31.000,13.186,13.186,13.186,3.462,3.128957,101.465118
133,2,"AMSB RESOURCES SERVICES SDN. BHD. (Mon-Sat: 9.30am-6pm|Fri: 12pm-3pm rest)",16,47.000,0.000,13.186,13.186,0.000,3.128957,101.465118
134,1,"AYANG MAJU ENTERPRISE (Fri: 12pm-3pm close)",63,63.000,13.186,13.186,13.186,4.055,3.128957,101.465118
135,1,"AZHALAGAN RESOURCES (Friday close)",81,81.000,13.186,13.186,13.186,4.486,3.128957,101.465118
136,1,"BAN JOO TRADING CO. *",56,56.000,13.186,13.186,13.186,3.908,3.128957,101.465118
137,1,"BINA SEMULA ENTERPRISE (Mon-Sat: 10am-8pm|Fri: 12pm-3pm rest)",91,91.000,13.186,13.186,13.186,4.769,3.128957,101.465118
138,1,"HARUNA CASH & CARRY (Mon-Sat: 10am-6pm)",55,55.000,13.186,13.186,13.186,3.888,3.128957,101.465118
138,2,"ECO MART & CAFE (Mon-Sat: 10am-6pm)",36,91.000,0.000,13.186,13.186,0.000,3.128957,101.465118
139,1,"JAZAM SEPAKAT SDN BHD (DELIVERY MON-THU : 9AM - 12.30PM/2PM - 5PM)",55,55.000,13.186,13.186,13.186,3.888,3.128957,101.465118
140,1,"JKS HARMONI ENTERPERISE (Mon-Sat: 9am-6pm|Fri: No delivery)",55,55.000,13.186,13.186,13.186,3.888,3.128957,101.465118
141,1,"KEDAI RUNCIT MADIYO (Mon-Sat: 9am-6pm|Fri: 12pm-3pm rest)",54,54.000,13.186,13.186,13.186,3.868,3.128957,101.465118
142,1,"KEDAI RUNCIT MUTIARA BARU (Mon-Sat: 9.30am-6pm|Fri: 12pm-3pm rest)",54,54.000,13.186,13.186,13.186,3.868,3.128957,101.465118
143,1,"KONG FAAT TRADING PLT (Mon-Sat: 8.30am-3pm)",53,53.000,13.186,13.186,13.186,3.849,3.128957,101.465118
144,1,"LAKSHMI MINI MARKET (Mon-Sat : 8am-8pm)",53,53.000,13.186,13.186,13.186,3.849,3.128957,101.465118
145,1,"MILLIONSZ ENTERPRISE (Mon-Sat: 9.30am-6pm|Fri: 12pm-3pm rest)",52,52.000,13.186,13.186,13.186,3.829,3.128957,101.465118
146,1,"NK JAYA PLT (Everyday 1pm-3pm close)",51,51.000,13.186,13.186,13.186,3.810,3.128957,101.465118
147,1,"PAPPATHY PROVISIONING STORES (Mon-Sat: 9am-6pm|Thu, after 12pm-Fri: NO DELIVERY)",51,51.000,13.186,13.186,13.186,3.810,3.128957,101.465118
148,1,"PASAR MINI A.M.S",51,51.000,13.186,13.186,13.186,3.810,3.128957,101.465118
149,1,"QASEH AMEERA RESOURCES (Mon-Sat: 9am-6pm|Fri: 12pm-3pm rest)",49,49.000,13.186,13.186,13.186,3.772,3.128957,101.465118
149,2,"PASAR SEGAR TELOK AIYAPPAN RENAS (Mon-Sat: 8.30am-6pm|Sat: Close at 5pm)",50,99.000,0.000,13.186,13.186,0.000,3.128957,101.465118
150,1,"WAHYUNI EDUTAINMENT SDN BHD (Mon-Sat: 9am-6pm|Fri: NO DELIVERY)",46,46.000,13.186,13.186,13.186,3.717,3.128957,101.465118
150,2,"ROHAN MAJU MII MARKET (Mon-Sat: 10am-6pm|Fri: 12pm-3pm rest)",48,94.000,0.000,13.186,13.186,0.000,3.128957,101.465118
151,1,"AJ AARYAN MINI MARKET (Mon-Sat: 9am-6pm|Fri: 12pm-3pm rest)",44,44.000,13.186,13.186,13.186,3.681,3.129056,101.465033
152,1,"DIYA AL DIN ENTERPRISE (Mon-fri : 8am-6pm | Fri 12pm-3pm closed)",43,43.000,13.186,13.186,13.186,3.663,3.128986,101.465091
153,1,"MEGA INDAH MART (LORI KECIL)-DELIVER AFTER 12PM",53,53.000,13.187,13.187,13.187,3.849,3.12903,101.465047
153,2,"VITTA ENTERPRISE (Mon-Sat: 9am-6pm)",46,99.000,0.002,13.189,13.187,0.000,3.129019,101.465057
154,1,"GUNA CASH & CARRY (Mon-Sat: 9.30am-6pm)",56,56.000,13.187,13.187,13.187,3.908,3.128959,101.465107
154,2,"CHETTIES MART (Mon-Sat:10am-6pm)",36,92.000,0.000,13.187,13.187,0.000,3.128959,101.465107
155,1,"RAHIMA STORE (Mon-Fri: 8am-6pm|Fri: 12pm close|Sat: 3pm close)",49,49.000,13.187,13.187,13.187,3.772,3.128959,101.465107
156,1,"A&T ASTAKA MART (Mon-Fri: 8am-6pm| Sat: 3pm closed)",86,86.000,13.187,13.187,13.187,4.623,3.129044,101.465035
157,1,"88 FRESHMART SDN. BHD. (Mon-Sat: 9.30am-8pm|Fri: 12pm-3pm rest)",71,71.000,13.187,13.187,13.187,4.236,3.128969,101.465095
158,1,"GOLDEN GROCERY MART (Mon-Sat: 9am-7pm)",56,56.000,13.187,13.187,13.187,3.909,3.129032,101.465039
159,1,"RAINDROP RESOURCES SDN BHD (Mon-Sat: 9am-6pm|Fri: 12pm-3pm)",49,49.000,13.189,13.189,13.189,3.773,3.128918,101.465123
160,1,"IDA & JOYNAL ENTERPRISE (Mon-Sat: 9am-6pm|Fri: 12pm-3pm rest)",55,55.000,13.189,13.189,13.189,3.889,3.129023,101.465034
161,1,"ENG TA TRADING (MON-FRI 8.30AM-6PM)(SAT 8.30AM-4PM)",57,57.000,13.191,13.191,13.191,3.930,3.128942,101.465071
162,1,"ABIRAMIS CASH & CARRY",86,86.000,13.193,13.193,13.193,4.625,3.128912,101.465079
163,1,"PASAR RAYA BISMI (Mon-Sat: 10am-8pm|Fri: NO DELIVERY)",50,50.000,13.194,13.194,13.194,3.793,3.128905,101.465069
163,2,"TAI ON MEDICAL HALL(MONDAY CLOSED)",47,97.000,0.001,13.195,13.193,0.000,3.128912,101.465079
164,1,"PASAR MINI RAM SUNWAY VILLA APARTMENT",50,50.000,13.197,13.197,13.197,3.794,3.128855,101.465078
164,2,"PASARAYA UPSANA (Mon-Sat: 10am-6pm|Fri: 12pm-3pm rest)",49,99.000,0.006,13.202,13.194,0.002,3.128905,101.465069
165,1,"KEDAI RUNCIT ANDA (MON-FRI : 10AM-6PM | SATURDAY CLOSED AT 3PM)",54,54.000,13.198,13.198,13.198,3.872,3.128811,101.465098
166,1,"MY AL MADEENA ENTERPRISE (Mon-Sat: 9.30am-6pm|Fri: 12pm-3pm rest)",52,52.000,13.199,13.199,13.199,3.833,3.128974,101.464952
167,1,"PASAR MINI AL MADINA (Mon-Fri: 8am-6pm| Fri: 12pm close|Sat: 3pm close)",51,51.000,13.203,13.203,13.203,3.815,3.128823,101.465037
168,1,"THARAS CASH & CARRY (Mon-Sat: 9.30am-6.30pm)",47,47.000,13.203,13.203,13.203,3.740,3.128823,101.465037
168,2,"PASARAYA TY SDN. BHD.",50,97.000,0.000,13.203,13.203,0.000,3.128823,101.465037
169,1,"NUR HAZIQAH ENTERPRISE",51,51.000,13.206,13.206,13.206,3.816,3.128836,101.464981
170,1,"AINUR NADI ENTERPRISE (Fri: 12pm-3pm rest)",12,12.000,13.457,13.457,13.457,3.251,3.133395,101.45851
170,2,"PASAR RAYA KANESH",50,62.000,0.865,14.321,13.224,0.249,3.12881,101.464801
171,1,"MK GROCERY MART (Mon close)",52,52.000,13.337,13.337,13.337,3.873,3.323323,101.577413
172,1,"PALANI MINI MARKET",51,51.000,13.545,13.545,13.545,3.914,3.327003,101.561192
173,1,"ALI FOOD CORNER - RESTORAN ALI FOOD'S CORNER (SEGAMBUT)",65,65.000,13.666,13.666,13.666,4.247,3.185554228,101.6774922
174,1,"BRICK HOUSE SDN. BHD.",76,76.000,14.138,14.138,14.138,4.672,3.118793521,101.6493211
175,1,"SFS KOPITIAM CAFE",48,48.000,14.669,14.669,14.669,4.176,3.1198698,101.4553197
176,1,"PASARAYA DANIYA SDN BHD - sunday closed ( business hour 11.00 am- 08.00 pm)",50,50.000,14.887,14.887,14.887,4.280,3.177282,101.687117
177,1,"BABAU SENTOSA ENTERPRISE (SELANGA FRESH MART) (Open 7am-10pm | Close Fri:12pm-2.30pm)",64,64.000,15.020,15.020,15.020,4.643,3.245137,101.426723
178,1,"KEDAI UBAT DAN RUNCIT HUAKSON",54,54.000,15.126,15.126,15.126,4.437,3.188843,101.691243
178,2,"AS BISMI MINI MART (9am-9pm|Fri: 12pm-3pm)",46,100.000,0.708,15.834,15.105,0.200,3.195193933,101.6916745
179,1,"BIG FAMILY RESTAURANT SDN BHD",65,65.000,15.133,15.133,15.133,4.703,3.1665038,101.4253537
180,1,"ANDA MINI MARKET",99,99.000,15.156,15.156,15.156,5.771,3.339879,101.577612
181,1,"NURUL AFEEFAH ENTERPRISE (Mon-Sat: 9am-6pm| Fri: NO DELIVERY)",51,51.000,15.369,15.369,15.369,4.441,3.078465,101.611016
182,1,"FU MI TRADING (Mon-Sat: 8.30am-6pm)",56,56.000,15.426,15.426,15.426,4.572,3.077938,101.611086
183,1,"V GOOD STORE RESOURCES- (ISNIN TUTUP)",46,46.000,15.426,15.426,15.426,4.348,3.077938,101.611086
183,2,"KEDAI RUNCIT JAYAS - DELIVERY 11:45AM",54,100.000,0.000,15.426,15.426,0.000,3.077938,101.611086
184,1,"MIZA JAYA MARKETING (Mon-Sat: 9am-6pm| Fri: NO DELIVERY)",52,52.000,15.616,15.616,15.616,4.535,3.075875,101.61059
184,2,"VO FON TRADING SDN BHD (SATURDAY CLOSE 12.30PM)",46,98.000,0.236,15.852,15.426,0.066,3.077938,101.611086
185,1,"KIB MINI MART(Mon-Fri: 9am-6pm|Fri: 12pm-3pm rest|Sat: 4.30pm close)",53,53.000,15.626,15.626,15.626,4.561,3.075769,101.610578
186,1,"AMPLE PROSPERITY SDN. BHD. (DELIVERY : MON - FRI)",57,57.000,15.822,15.822,15.822,4.714,3.074688,101.61253
187,1,"KAMPONG FRESH MART SDN BHD (Mon-Sat: 10am-6pm)",54,54.000,15.887,15.887,15.887,4.661,3.083086,101.630118
188,1,"RESTORAN JAHANGEER",48,48.000,16.037,16.037,16.037,4.565,3.073706,101.61511
189,1,"SINAR BARUNA ENTERPRISE (Mon-Fri: 8am to 6pm | Fri: 12pm to 3pm close)",47,47.000,18.546,18.546,18.546,5.253,3.049872,101.495407
189,2,"PASARAYA BAN SOON SDN BHD",50,97.000,2.967,21.513,16.195,0.853,3.075824,101.489194
190,1,"CEMPAKA ROSINAR ENTERPRISE (Fri close)",75,75.000,16.612,16.612,16.612,5.458,3.109566523,101.6708643
191,1,"HOCK MEI TRADING SDN. BHD. - PASARAYA HM (TAMAN MEDAN BRANCH)",55,55.000,16.845,16.845,16.845,4.967,3.074734,101.632945
192,1,"MEDAN FROZEN FOOD",53,53.000,17.061,17.061,17.061,4.980,3.074129,101.635719
192,2,"YONG SOON FATT SDN. BHD",46,99.000,0.004,17.065,17.059,0.001,3.074126,101.635687
193,1,"SHAN MGT ENTERPRISE (Fri: 1pm-5pm close)",48,48.000,17.105,17.105,17.105,4.869,3.196506,101.709813
194,1,"PASARAYA T.S MEGA",50,50.000,20.028,20.028,20.028,5.758,3.098239,101.701066
194,2,"51 GROCER (8AM-8PM)",40,90.000,3.100,23.128,17.139,0.849,3.121364778,101.6854691
195,1,"MHZ NIAGA RESOURCES (Mon-Sat: 9.30am-6pm|Fri: 12pm-3pm rest)",53,53.000,17.322,17.322,17.322,5.056,3.096309,101.444524
196,1,"PASARAYA MEKODA (M) SDN BHD (Fri: 12pm-3pm rest)",50,50.000,17.322,17.322,17.322,4.980,3.096309,101.444524
