cluster_id,sequence_order,lat,lon,cumulative_distance_km,store_name
826,1,1.512067726,103.8169076,317.1631,"ECONSAVE CASH & CARRY (PJ) SDN BHD"
827,1,5.831846474,102.4041291,318.0670,"ECONSAVE CASH & CARRY (PP) SDN BHD"
828,1,5.852035255,102.3726214,319.0704,"INAI REKA SDN BHD"
829,1,1.59075379,103.8991659,319.9665,"ECONSAVE CASH & CARRY (DC) SDN BHD"
830,1,1.488490842,103.8648747,323.0422,"EDARAN S.A.AL-HABSHEE S/B-MYDIN TAMAN RINTING HYPERMARKET-MON-SAT 9AM-5.30PM"
831,1,6.01818577,101.9760834,326.2270,"MYDIN MOHAMED HOLDINGS BHD - MYDIN RANTAU PANJANG EMPORIUM"
832,1,1.491899027,103.9123627,327.1990,"ECONSAVE CASH & CARRY (KM) SDN BHD"
833,1,5.45158034,103.3553971,332.6118,"HAROLDS BREAD (FACTORY) SDN BHD - K.TERENGGANU (Mon-Sun: 9am-3:30pm|Fri: Close)"
834,1,5.971514518,100.401395,337.3547,"BAN SENG HIN CO.SDN BHD"
835,1,6.075036828,102.2342009,338.5022,"GCH RETAIL (MALAYSIA) SDN BHD - GIANT SUPERSTORE TUNJUNG"
836,1,6.076619331,102.2584462,339.3587,"MYDIN MOHAMED HOLDING BHD - MYDIN TUNJONG HYPERMARKET"
837,1,6.098225693,102.2781889,342.2489,"MYDIN KUBANG KERIAN HYPERMARKET"
838,1,6.099543156,102.282592,342.5190,"MYDIN MOHAMED HOLDINGS BERHAD - KKH"
839,1,6.129625571,102.241885,344.5909,"MYDIN MOHAMED HOLDING BHD - KOTA BARU EMPORIUM"
840,1,6.130463012,102.242775,344.7057,"GIANT SUPERSTORE KOTA BHARU TC"
841,1,6.058351724,100.4437012,344.8481,"CHANTIKA KELANG BERAS SDN BHD"
842,1,6.058697979,100.4433523,344.8971,"88 DISTRIBUTION (MALAYSIA) SDN.BHD."
843,1,6.13184362,102.2444599,344.9010,"MYDIN MOHAMED HOLDING BHD - KOTA BARU WAREHOUSE"
844,1,6.141626339,100.6204438,347.8311,"KILANG BERAS MIHODA SDN BHD"
845,1,6.093250295,100.4289158,349.0506,"TRAK UTARA (M) SDN BHD"
846,1,6.080506369,100.3631643,350.1871,"SKAWAN SDN BHD"
847,1,6.096478397,100.3944231,350.6644,"IMAN IKHLAS (M) SDN BHD - TSB"
848,1,6.097617561,100.3753991,351.5023,"HL UTARA ENTERPRISE SDN BHD"
849,1,6.096712171,100.3546899,352.2031,"SYARIKAT PERTAMAI SDN BHD"
850,1,6.125247213,100.3651919,354.7753,"MYDIN AMAN CENTRAL SUPERMARKET"
851,1,6.125845367,100.3579419,355.1145,"WENG AIK TRANSPORT TRADING COMPANY"
852,1,6.129278957,100.3592224,355.4238,"GULA PADANG TERAP SDN BHD"
853,1,6.200808258,100.5470581,356.4078,"ECONSAVE CASH & CARRY (PS) SDN. BHD."
854,1,6.142747202,100.3662682,356.5620,"TEGUH MURNI JAYA SDN BHD"
855,1,6.143247504,100.3634506,356.7211,"GIANT HYPERMARKET ALOR SETAR"
856,1,6.245517549,100.4472304,364.4444,"DXN INDUSTRIES (M) SDN BHD"
857,1,1.370150133,104.272228,368.1275,"ECONSAVE CASH & CARRY (AD) SDN BHD"
858,1,6.318787394,100.4131889,373.3585,"NINAMAJU SDN BHD"
859,1,6.357713814,100.4206005,377.2191,"SUN LEAN BRAN MILL SDN BHD"
860,1,6.372115002,100.3062693,382.8039,"MAHACERGAS SDN BHD"
861,1,6.374759069,100.302686,383.2141,"KIHOLE RESOURCES (M) SDN BHD"
862,1,6.419633925,100.1965996,391.9748,"GIANT SUPERSTORE KANGAR"
863,1,4.26043508,117.8956429,1827.4761,"JOO LOONG TRADING COMPANY SDN BHD"
864,1,13.5300007,75.3663962,3091.1910,"Test Store"