cluster_id,sequence_order,lat,lon,cumulative_distance_km,store_name
1,1,3.128912,101.465079,0.0027,"ABIRAMIS CASH & CARRY"
1,2,3.128912,101.465079,0.0027,"TAI ON MEDICAL HALL(MONDAY CLOSED)"
1,3,3.128905,101.465069,0.0040,"PASAR RAYA BISMI (Mon-Sat: 10am-8pm|Fri: NO DELIVERY)"
1,4,3.128905,101.465069,0.0040,"PASARAYA UPSANA (Mon-Sat: 10am-6pm|Fri: 12pm-3pm rest)"
1,5,3.128942,101.465071,0.0082,"ENG TA TRADING (MON-FRI 8.30AM-6PM)(SAT 8.30AM-4PM)"
1,6,3.128969,101.465095,0.0122,"88 FRESHMART SDN. BHD. (Mon-Sat: 9.30am-8pm|Fri: 12pm-3pm rest)"
1,7,3.128959,101.465107,0.0139,"CHETTIES MART (Mon-Sat:10am-6pm)"
1,8,3.128959,101.465107,0.0139,"GUNA CASH & CARRY (Mon-Sat: 9.30am-6pm)"
1,9,3.128959,101.465107,0.0139,"RAHIMA STORE (Mon-Fri: 8am-6pm|Fri: 12pm close|Sat: 3pm close)"
1,10,3.128957,101.465118,0.0152,"A&T ASTAKA MART-PORT KLANG (Mon-Sat: 9am-6m)"
1,11,3.128957,101.465118,0.0152,"A.RENGASAMY & SONS (MON-FRI : 8AM-6PM | SAT CLOSED AT 3PM)"
1,12,3.128957,101.465118,0.0152,"AL HISHA MINI MARKET (Mon-Sat: 9am-6pm| Fri: NO DELIVERY)"
1,13,3.128957,101.465118,0.0152,"AMSB RESOURCES SERVICES SDN. BHD. (Mon-Sat: 9.30am-6pm|Fri: 12pm-3pm rest)"
1,14,3.128957,101.465118,0.0152,"ASHOKAH GROCERY & SPICE MART (Mon-Sat: 10am-6pm)"
1,15,3.128957,101.465118,0.0152,"AYANG MAJU ENTERPRISE (Fri: 12pm-3pm close)"
1,16,3.128957,101.465118,0.0152,"AZHALAGAN RESOURCES (Friday close)"
1,17,3.128957,101.465118,0.0152,"BAN JOO TRADING CO. *"
1,18,3.128957,101.465118,0.0152,"BINA SEMULA ENTERPRISE (Mon-Sat: 10am-8pm|Fri: 12pm-3pm rest)"
1,19,3.128957,101.465118,0.0152,"ECO MART & CAFE (Mon-Sat: 10am-6pm)"
1,20,3.128957,101.465118,0.0152,"HARUNA CASH & CARRY (Mon-Sat: 10am-6pm)"
1,21,3.128957,101.465118,0.0152,"JAZAM SEPAKAT SDN BHD (DELIVERY MON-THU : 9AM - 12.30PM/2PM - 5PM)"
1,22,3.128957,101.465118,0.0152,"JKS HARMONI ENTERPERISE (Mon-Sat: 9am-6pm|Fri: No delivery)"
1,23,3.128957,101.465118,0.0152,"KEDAI RUNCIT MADIYO (Mon-Sat: 9am-6pm|Fri: 12pm-3pm rest)"
1,24,3.128957,101.465118,0.0152,"KEDAI RUNCIT MUTIARA BARU (Mon-Sat: 9.30am-6pm|Fri: 12pm-3pm rest)"
1,25,3.128957,101.465118,0.0152,"KONG FAAT TRADING PLT (Mon-Sat: 8.30am-3pm)"
1,26,3.128957,101.465118,0.0152,"LAKSHMI MINI MARKET (Mon-Sat : 8am-8pm)"
1,27,3.128957,101.465118,0.0152,"MILLIONSZ ENTERPRISE (Mon-Sat: 9.30am-6pm|Fri: 12pm-3pm rest)"
1,28,3.128957,101.465118,0.0152,"NK JAYA PLT (Everyday 1pm-3pm close)"
1,29,3.128957,101.465118,0.0152,"PAPPATHY PROVISIONING STORES (Mon-Sat: 9am-6pm|Thu, after 12pm-Fri: NO DELIVERY)"
1,30,3.128957,101.465118,0.0152,"PASAR MINI A.M.S"
1,31,3.128957,101.465118,0.0152,"PASAR SEGAR TELOK AIYAPPAN RENAS (Mon-Sat: 8.30am-6pm|Sat: Close at 5pm)"
1,32,3.128957,101.465118,0.0152,"QASEH AMEERA RESOURCES (Mon-Sat: 9am-6pm|Fri: 12pm-3pm rest)"
1,33,3.128957,101.465118,0.0152,"ROHAN MAJU MII MARKET (Mon-Sat: 10am-6pm|Fri: 12pm-3pm rest)"
1,34,3.128957,101.465118,0.0152,"WAHYUNI EDUTAINMENT SDN BHD (Mon-Sat: 9am-6pm|Fri: NO DELIVERY)"
1,35,3.12897,101.465122,0.0167,"KEDAI UBAT & PASAR MINI WENG HONG ONN SDN. BHD"
1,36,3.12897,101.465122,0.0167,"PAK DEEN GROCERS SDN. BHD. (Mon-Sat: 9am-6pm|Fri: 12pm-3pm rest)"
1,37,3.12897,101.465122,0.0167,"PASAR MINI SRI EHSAN (Mon-Fri : 8am-6pm | Sat : 3pm closed)"
1,38,3.128967,101.465128,0.0174,"BEST FRESH MART SDN BHD - KLANG (Open at 10am|Sat: NO DELIVERY)"
1,39,3.128967,101.465128,0.0174,"PEMBORNG BARANG RUNCIT PELANGI (Mon-Sat: 10am-6pm)"
1,40,3.12898,101.465116,0.0194,"AHMAD PATANG ENTERPRISE (Mon-Sat: 9am-6pm)"
1,41,3.12898,101.465116,0.0194,"PASAR RAYA KAMKA"
1,42,3.128983,101.465114,0.0198,"PASAR MINI AZAM BARUNA (Mon-Sat: 9.30am-6pm|Fri: 12pm-3pm rest)"
1,43,3.128979,101.46511,0.0204,"THAYA MINI MARKET SDN BHD (Mon-Sat: 9.30am-6pm)"
1,44,3.128992,101.465101,0.0222,"DWELLING MAKERS SDN BHD - WYNDHAM (ACMAR KLANG) (Mon-Fri: 9am-12pm, 2pm-5pm)"
1,45,3.128986,101.465091,0.0235,"DIYA AL DIN ENTERPRISE (Mon-fri : 8am-6pm | Fri 12pm-3pm closed)"
1,46,3.129018,101.465089,0.0270,"KEDAI RUNCIT AMIRUDDIN (Fri: 12pm-3pm rest)"
1,47,3.129033,101.465084,0.0288,"AZVA GLOBAL SDN BHD (Mon-Fri: 8am-6pm|Fri: 12pm-3pm rest|Sat: 4pm close)"
1,48,3.129036,101.465082,0.0292,"CRESCENT STAR IMPEX SDN. BHD."
1,49,3.129043,101.465079,0.0300,"JANNAH MAMA ENTERPRISE (Mon-Fri: 8am-6pm| Fri: 12pm-3pm rest| Sat: 5pm close)"
1,50,3.129065,101.465087,0.0326,"PASAR RAYA SMART (Fri: 1pm-3pm rest)"
1,51,3.129071,101.465099,0.0341,"PASAR MINI FAIRPRICE TAMAN SENTOSA (Mon-Sat: 9am-6pm)"
1,52,3.129083,101.465105,0.0356,"MINI MARKET NIRMALA (Mon-Sat: 9.30am-6pm)"
1,53,3.129092,101.465103,0.0366,"CHOP LIAN HUP (SUNDAY CLOSE) MON-SAT 7AM-7PM"
1,54,3.129063,101.465117,0.0402,"PASAR MINI NUR AZAINAH (Fri: 12pm-4pm rest)"
1,55,3.129047,101.465127,0.0423,"YUVAS CASH & CARRY (Mon-Sat: 9am-6pm)"
1,56,3.129041,101.465112,0.0441,"RESTORAN OON OON (1pm - 5pm) (ISNIN CUTI)"
1,57,3.129028,101.465126,0.0462,"VSM STORES SDN BHD (Mon-Sat: 10am-6pm)"
1,58,3.129043,101.46515,0.0494,"CLC WHOLESALER (BANTING) SDN BHD"
1,59,3.129043,101.46515,0.0494,"HO HO TRADING COMPANY"
1,60,3.129043,101.46515,0.0494,"PEMBORONG BARANG RUNCIT SM LEE"
1,61,3.129065,101.465149,0.0518,"WAAJIBA TRADING (Mon-Sat: 9am-6pm|Fri: 12pm-3pm rest)"
1,62,3.129055,101.465173,0.0547,"KT MAHESWARI FRESH MARKET ENTERPRISE (Mon-Sat: 9am-5pm)"
1,63,3.129055,101.465173,0.0547,"SAKTHI RS SDN BHD (Mon-Sat: 9am-6pm)"
1,64,3.128994,101.465137,0.0626,"PASAR MINI SETIA ALAM (Mon-Sat: 2pm-8pm)"
1,65,3.128987,101.465145,0.0638,"SUNSEEN TRADING"
1,66,3.128971,101.465152,0.0657,"PASAR MINI MESRA RKS (Mon-Fri: 8.30am-6pm|Sat: 3pm close)"
1,67,3.128973,101.465176,0.0684,"KEDAI UBAT TONG SENG"
1,68,3.128985,101.465202,0.0716,"KEDAI RUNCIT MUTIARA BARU (Mon-Sat: 8am-6pm| Fri: 12pm-3pm rest| Sat: 4pm close)"
1,69,3.128946,101.465166,0.0775,"KEDAI RUNCIT RAMLI MUHAMMAD MAJU (Mon-Sat: 9.30am-6pm|Fri:12pm-3pm rest)"
1,70,3.128945,101.465163,0.0778,"SUMON MAJU SDN. BHD. (Mon-Sat: 10am-8pm|Fri: 12pm-3pm rest)"
1,71,3.128928,101.465163,0.0797,"SOHEL DAILY FRESH ENTERPRISE (Mon-Sat: 10am-6pm|Fri: 12pm-3pm close)"
1,72,3.128918,101.465123,0.0843,"RAINDROP RESOURCES SDN BHD (Mon-Sat: 9am-6pm|Fri: 12pm-3pm)"
1,73,3.128855,101.465078,0.0929,"PASAR MINI RAM SUNWAY VILLA APARTMENT"
1,74,3.128811,101.465098,0.0983,"KEDAI RUNCIT ANDA (MON-FRI : 10AM-6PM | SATURDAY CLOSED AT 3PM)"
1,75,3.128823,101.465037,0.1052,"PASAR MINI AL MADINA (Mon-Fri: 8am-6pm| Fri: 12pm close|Sat: 3pm close)"
1,76,3.128823,101.465037,0.1052,"PASARAYA TY SDN. BHD."
1,77,3.128823,101.465037,0.1052,"THARAS CASH & CARRY (Mon-Sat: 9.30am-6.30pm)"
1,78,3.128836,101.464981,0.1115,"NUR HAZIQAH ENTERPRISE"
1,79,3.128974,101.464952,0.1272,"MY AL MADEENA ENTERPRISE (Mon-Sat: 9.30am-6pm|Fri: 12pm-3pm rest)"
1,80,3.129023,101.465034,0.1378,"IDA & JOYNAL ENTERPRISE (Mon-Sat: 9am-6pm|Fri: 12pm-3pm rest)"
1,81,3.129032,101.465039,0.1390,"GOLDEN GROCERY MART (Mon-Sat: 9am-7pm)"
1,82,3.12903,101.465047,0.1399,"MEGA INDAH MART (LORI KECIL)-DELIVER AFTER 12PM"
1,83,3.129019,101.465057,0.1415,"VITTA ENTERPRISE (Mon-Sat: 9am-6pm)"
1,84,3.129044,101.465035,0.1452,"A&T ASTAKA MART (Mon-Fri: 8am-6pm| Sat: 3pm closed)"
1,85,3.129056,101.465033,0.1466,"AJ AARYAN MINI MARKET (Mon-Sat: 9am-6pm|Fri: 12pm-3pm rest)"
1,86,3.12911,101.465052,0.1530,"BUN VIET RESTAURANT (Mon-Sat: 11am-8pm)"
1,87,3.129132,101.465112,0.1601,"GAYA BUMI ENTERPRISE (Mon-Sat: 9am-6pm)"
1,88,3.129189,101.465156,0.1681,"RS VALLEY TRADING & SERVICES - TIAJ (Fri: 12pm-3pm rest)"
1,89,3.129195,101.465181,0.1709,"LAVANIZ FRESH MART"
1,90,3.12881,101.464801,0.2310,"PASAR RAYA KANESH"
1,91,3.133395,101.45851,1.0958,"AINUR NADI ENTERPRISE (Fri: 12pm-3pm rest)"
1,92,3.1198698,101.4553197,2.6409,"SFS KOPITIAM CAFE"
1,93,3.096309,101.444524,5.5219,"MHZ NIAGA RESOURCES (Mon-Sat: 9.30am-6pm|Fri: 12pm-3pm rest)"
1,94,3.096309,101.444524,5.5219,"PASARAYA MEKODA (M) SDN BHD (Fri: 12pm-3pm rest)"
1,95,3.096273,101.44454,5.5263,"PAK DEEN FRESH & FROZEN SUPPLY (Mon-Sat: 9am-6pm)"
1,96,3.0995071,101.4167627,8.6314,"D A R RESOURCES (KEDAI MAKAN HARMONY)"
1,97,3.093395,101.37922,12.8549,"YK SEMENTA TRADING (MON: No receiving)"
1,98,3.133012,101.375926,17.2752,"PASAR MINI THANA (Mon-Sat: 8.30am-6pm)"
1,99,3.136069,101.372825,17.7591,"SCS JAYA ENTERPRISE (Fri: 12pm-3pm close)"
2,1,3.1665038,101.4253537,6.0793,"BIG FAMILY RESTAURANT SDN BHD"
2,2,3.1995828,101.4554655,11.0498,"KS SMART MART SDN. BHD. (Mon-Sat: 9am-7pm)"
2,3,3.2009369,101.4766868,13.4106,"AMA WORLDWIDE SDN BHD (Open 8am-8pm) Friday closed"
2,4,3.2032786,101.4843394,14.2992,"RESTORAN NURI AL NISAR"
2,5,3.2073436,101.4969526,15.7707,"BINTANG HU TRADING (FRIDAY CLOSED)"
2,6,3.2250317,101.4981694,17.7421,"NASABE ENTERPRISE (12pm-3pm close)"
3,1,3.075824,101.489194,6.4798,"PASARAYA BAN SOON SDN BHD"
3,2,3.049872,101.495407,9.4468,"SINAR BARUNA ENTERPRISE (Mon-Fri: 8am to 6pm | Fri: 12pm to 3pm close)"
3,3,3.046131,101.504283,10.5166,"PASAR MINI DAWOOD (Mon-Fri: 8.30am-6pm|Fri: 12pm-3pm rest|Sat: Close at 3pm)"
3,4,3.044568,101.526693,13.0110,"KA FRESH FARM SDN BHD (Fri: 12pm-3pm rest)"
3,5,3.031843,101.53548,14.7298,"PASARAYA WENG FOON SDN. BHD."
3,6,3.029864,101.535609,14.9503,"WANJIALI MARKETING SDN BHD"
3,7,3.014075,101.560209,18.1974,"AL AWWAL BISTRO"
4,1,3.052425,101.445092,8.7890,"RESTORAN LIAN SIANG (Delivery at Gate F|Mon-Fri: 9.30am-11.30am & 1.30pm-3.30pm|Sat: Normal time)"
4,2,3.0512,101.4456,8.9365,"HONG WAH RESTAURANT (Delivery time: 7am-11.30am & 3pm-5pm)"
4,3,3.051185,101.445569,8.9403,"KEDAI KOPI & MAKANAN NAM SIANG (12PM-2PM: NO DELIVERY)"
4,4,3.048432,101.444929,9.2545,"PENG HEONG HAKKA PAIKUT RESTAURANT"
4,5,3.040992,101.447262,10.1214,"SHREE MAP JAYA SDN BHD (Mon-Fri: 9am-6pm|Sat: 9am-3pm)"
4,6,3.034434,101.432771,11.8880,"SAJIAN AMBANG SDN BHD"
4,7,3.034387,101.432778,11.8933,"MM MULTIPURPORSE MARKET (Mon-Sat: 9.30am-6pm|Fri: 12pm-3pm rest)"
4,8,3.03442,101.432716,11.9011,"PASAR MINI AM (OPEN ON MONDAY-SUNDAY | CLOSE ON FRIDAY AT 12PM-3PM)"
4,9,3.034433,101.432673,11.9061,"NAZURAH RESOURCES (MON-SAT : 8AM-6PM | FRI CLOSED AT 12PM-3PM)"
4,10,3.034433,101.432673,11.9061,"PASARAYA HAPPY HAPPY (Mon-Sat: 9am-6pm)"
4,11,3.034461,101.432692,11.9099,"KZ KIOSK (Mon-Sat: 9am-6pm|Fri: 12pm-3pm)"
4,12,3.034471,101.432701,11.9114,"MAFANA RESOURCES SDN BHD (Fri: 1pm-2pm rest)"
4,13,3.034485,101.43268,11.9142,"BNS MINI MARKET (Mon-Sat: 10am-7pm|Fri: 12pm-3pm rest)"
4,14,3.0345,101.432688,11.9161,"KEDAI RUNCIT YUSUF ALI ENTERPRISE (Mon-Sat: 9am-6pm|Fri: No delivery)"
4,15,3.034498,101.432695,11.9169,"PASAR MINI EUPHORIA (Mon-Sat: 9am-6pm|Fri: 12pm-3pm rest)"
4,16,3.03432,101.432747,11.9375,"NOVI FROZEN FOODS (Mon-Sat: 10am-6pm|Fri: No delivery)"
4,17,3.026502,101.428519,12.9255,"SRI DEVI STORE (Delivery by salesman)"
4,18,3.003932,101.465793,17.7659,"WING SMG TRADING (MON-FRI : 8AM-6PM | SAT CLOSED AT 3PM)"
4,19,2.986935,101.46782,19.6692,"DIVINE MART (Mon-Sat: 9am-6pm)"
5,1,3.1928766,101.5291471,10.0584,"MITAJAYA TRADING"
5,2,3.1972137,101.5324219,10.6624,"KEDAI BORONG DAN RUNCIT YUSOF MAJU (OPEN 9AM-5PM) (FRIDAY CLOSE) (12PM-2PM REHAT)"
5,3,3.1993666,101.5352935,11.0611,"KEDAI RUNCIT MOHD FADZIL HAIRI"
5,4,3.1993666,101.5352935,11.0611,"KEDAI RUNCIT MOHD FADZIL HAIRI (12pm-3pm close)"
5,5,3.2018728,101.5349002,11.3431,"ISKANDAR BIN HUSAINI (Open 9am-6pm|Fri: 12pm-3pm rest)"
5,6,3.1993933,101.5275686,12.2025,"KEDAI RUNCIT ZULKIFLY (OPEN 7AM-6 PM) (CLOSE ON FRIDAY 12PM-3PM)"
5,7,3.2118755,101.5300983,13.6186,"BINTANG HU TRADING(FRIDAY CLOSED)"
5,8,3.2134363,101.5321978,13.9092,"NORLYS KITCHEN & CATERING"
5,9,3.2174739,101.520213,15.3135,"NASI KANDAR ALI NAS MAJU (Restoran Alinas Aman Putri)"
5,10,3.2219337,101.5197575,15.8120,"PEMBORONG & PERUNCIT LINA (Sat: Close)"
6,1,3.1827378,101.5401381,10.2590,"RESTORAN LEE HONG KEE SDN. BHD.OPEN-12-3PM MONDAY HALF DAY ONLY"
6,2,3.1932652,101.5458882,11.5924,"NAD SAMUDERA ENTERPRISE (Fri: Close 12pm-3pm)"
6,3,3.2002098,101.5507472,12.5343,"PASAR MINI PAYA JARAS"
6,4,3.192631,101.5625203,14.0895,"NUR SAKINAH TRADING"
6,5,3.1899834,101.5649231,14.4868,"BERAS AGRO (M) SDN BHD"
6,6,3.1905493,101.565561,14.5815,"FK SALMA ENTERPRISE"
6,7,3.1905466,101.5658297,14.6114,"RESTORAN SERI RASA"
6,8,3.1882442,101.5649721,14.8845,"PINNACLE FOODS (M) SDN BHD"
6,9,3.187388,101.5666542,15.0941,"MOITTRY INFINITY SDN BHD"
6,10,3.1882925,101.5686546,15.3379,"PASA RAYA TOP CIRCUITS SDN BHD"
6,11,3.187566,101.571467,15.6605,"ASIAN DINE SDN BHD"
6,12,3.188169,101.572788,15.8217,"ENG HUP SENG SESAME OIL & SAUCE FACTORY SDN BHD-DELIVER BY FORKLIFT"
6,13,3.188149,101.573081,15.8543,"RESTORAN MEI JING (Open 2pm-10pm,KHAMIS TUTUP)"
6,14,3.188154,101.573128,15.8596,"BUMI SEHATI FROZEN FOOD SDN BHD"
6,15,3.188163,101.573131,15.8606,"SRI RANTAU FOOD MART (8.00am – 12.00pm / 2.00pm – 5.00pm) (Tue & Sun Off)"
6,16,3.188202,101.573154,15.8657,"PANTAI SELAMAT (IM) S/B"
6,17,3.188219,101.57318,15.8691,"SEMAQ IQHLAS SDN BHD"
6,18,3.188286,101.573236,15.8788,"HO KIM WEI (1pm - 3pm : no delivery)"
6,19,3.188298,101.573231,15.8803,"PERNIAGAAN HE SOON (no delivery on Monday)"
6,20,3.1881,101.573205,15.9025,"OLIVAS BAKERY INGREDIENTS SDN BHD"
6,21,3.1881,101.573155,15.9080,"YOW SENG SDN BHD"
6,22,3.1877839,101.5758332,16.2074,"DISTINCTIVE MODEL SDN BHD (TOYOTA SERVIS CENTRE)"
6,23,3.1927097,101.5748633,16.7656,"HOCK SOON BAK KUT TEH (MONDAY OFF)"
6,24,3.1982949,101.5732,17.4136,"RESTORAN BAK KUT TEH KIM KEE"
6,25,3.198458,101.5692969,17.8473,"CHIA SHING FOOD INDUSTRIES SDN BHD"
6,26,3.197716,101.568073,18.0062,"KS MART SDN BHD"
6,27,3.197425,101.56801,18.0393,"ST.MARK'S COZY HOME"
6,28,3.1973148,101.567381,18.1102,"AZIZI MINI MARKET"
6,29,3.196536,101.567435,18.1970,"SUN THONG HING SDN BHD"
6,30,3.1968201,101.5667535,18.2790,"ENG SIANG GROCER (Mon: Close|Loading at 9.30am-7.30pm)"
6,31,3.1968558,101.5657222,18.3936,"RESTORAN C&Y - (OPEN 7AM-12PM)"
6,32,3.1975612,101.5654258,18.4787,"RESTORAN KONG MAH SDN BHD (open 7am - 4pm)(tuesday closed)"
6,33,3.1984813,101.5670179,18.6829,"PASAR MINI KURNIA MAJU - JUMAAT TUTUP"
6,34,3.1957531,101.5645649,19.0906,"LASHIKA SPICES - OPEN 7AM-10PM & 2PM-4:30PM - (11AM-2PM TAK BOLEH DELIVERY)"
7,1,3.1673444,101.5674932,12.1456,"FALAM ENTERPRISE (PASAR MINI SIRAJANE)"
7,2,3.173116,101.576215,13.3073,"PASAR RAYA BORONG DAN RUNCIT SURIA (SATURDAY AFTER 2PM NO RECEIVED GOOD)"
7,3,3.1773599,101.5776437,13.8051,"MB RETAIL ENTERPRISE (9AM - 5PM)"
7,4,3.1893964,101.5883007,15.5915,"DAMANSARA DAMAI ENTERPRISE (12pm-3pm close)"
7,5,3.190733,101.5889367,15.7561,"NASABE ENTERPRISE (12pm-3pm close)"
7,6,3.1909023,101.5884752,15.8107,"A&Z BARKAT MAJU MARKETING (12pm-3pm close)"
7,7,3.1987847,101.590422,16.7134,"L & P MINI MARKET (khamis tutup)"
7,8,3.1981898,101.5948604,17.2106,"RAYYAN SPEEDMART(MOHD LUKMAN)"
7,9,3.19172,101.600144,18.1388,"REZAL TRADING - AL FALAH MART (Fri-Sat close)"
7,10,3.20282,101.604827,19.4781,"KAMPONG KOH SAUCE (M) SDN BHD - (DELIVERY BEFORE 12PM)"
7,11,3.20331,101.603463,19.6391,"WHITE HERON PRARMACEUTICAL SDN BHD"
8,1,3.239434,101.447236,12.4498,"KZ KIOSK (Mon-Fri: 8am-6pm| Fri: 12pm-3pm rest| Sat: 3pm close)"
8,2,3.251992,101.448689,13.8555,"SINAR TEGUH RESOURCES (Mon-Sat: 9.30am-6pm| Fri: NO DELIVERY)"
8,3,3.25282,101.446804,14.0841,"RS VALLEY TRADING & SERVICES - PPAJ (Fri: 12pm-3pm rest)"
8,4,3.245137,101.426723,16.4715,"BABAU SENTOSA ENTERPRISE (SELANGA FRESH MART) (Open 7am-10pm | Close Fri:12pm-2.30pm)"
9,1,3.2465493,101.4728759,13.1105,"BI IZNILLAH ENTERPRISE (Open 9am - 7pm)"
9,2,3.301924,101.493232,19.6694,"PASAR RAYA ASS SETIA"
10,1,3.2040912,101.3708626,13.3930,"PASAR MINI LAILA ENTERPERISE (Fri: Close 12pm-3pm)"
10,2,3.2021103,101.3406998,16.7490,"MY A1 SDN BHD"
10,3,3.2021103,101.3406998,16.7490,"MY A1 SDN BHD-DESA COALFIELDS"
10,4,3.192175,101.314981,19.8106,"KOPITIAM SIN LAI KEE (9am-4pm)"
11,1,3.21061,101.566028,14.4262,"HAI SOON HENG TRADING (Delivery after 12pm)"
11,2,3.210918,101.567095,14.5495,"ADA CASH & CARRY SDN BHD (Mon: No delivery after 2 pm)"
11,3,3.2153632,101.5662228,15.0531,"AURA NURILHAM ENTERPRISE"
11,4,3.2121628,101.5726418,15.8497,"RAJDHANI SDN BHD"
11,5,3.225815,101.56779,17.4605,"SOON CHEONG MARINE PRODUCTS SDN BHD(SG BULOH)"
11,6,3.224367,101.5631572,17.9994,"PERNIAGAAN SUNGHO FOOD SDN BHD"
12,1,3.153636,101.603084,15.5650,"JW GROCERY STORE (Mon-Sat: 9.30am-6pm|Fri: 12pm-3pm rest)"
12,2,3.153949,101.60333,15.6093,"PD DAILY FRESH"
12,3,3.164639,101.6083,16.9198,"YAYA NEW FLAVOURS SDN BHD (CLOSE: TUESDAY)"
12,4,3.183843,101.613623,19.1354,"SRI RANTAU SPEED MART - 3pm close every day"
12,5,3.183918,101.613631,19.1438,"TMS SUPER STORE"
12,6,3.183922,101.61362,19.1451,"PD DELIMEE FOOD INDUSTRIES"
12,7,3.183931,101.613617,19.1462,"JIN HUANG"
12,8,3.183922,101.613608,19.1476,"H AND C FRESH SDN. BHD. (SAT-Closed, 1pm-3pm lunch)"
12,9,3.183945,101.61364,19.1520,"HAJI SHARIFF CENDOL"
12,10,3.183989,101.613656,19.1572,"JT FOOD MART"
13,1,3.078465,101.611016,17.1445,"NURUL AFEEFAH ENTERPRISE (Mon-Sat: 9am-6pm| Fri: NO DELIVERY)"
13,2,3.077938,101.611086,17.2036,"FU MI TRADING (Mon-Sat: 8.30am-6pm)"
13,3,3.077938,101.611086,17.2036,"KEDAI RUNCIT JAYAS - DELIVERY 11:45AM"
13,4,3.077938,101.611086,17.2036,"V GOOD STORE RESOURCES- (ISNIN TUTUP)"
13,5,3.077938,101.611086,17.2036,"VO FON TRADING SDN BHD (SATURDAY CLOSE 12.30PM)"
13,6,3.075875,101.61059,17.4395,"MIZA JAYA MARKETING (Mon-Sat: 9am-6pm| Fri: NO DELIVERY)"
13,7,3.075769,101.610578,17.4514,"KIB MINI MART(Mon-Fri: 9am-6pm|Fri: 12pm-3pm rest|Sat: 4.30pm close)"
13,8,3.074688,101.61253,17.6992,"AMPLE PROSPERITY SDN. BHD. (DELIVERY : MON - FRI)"
13,9,3.073706,101.61511,18.0058,"RESTORAN JAHANGEER"
13,10,3.083086,101.630118,19.9717,"KAMPONG FRESH MART SDN BHD (Mon-Sat: 10am-6pm)"
14,1,3.138613,101.624039,17.6798,"RESTORAN AL-RIFAAHY MAJU"
14,2,3.128451,101.634727,19.3184,"PENG SOON"
15,1,3.035008,101.593601,17.6798,"FS NUSANTARA MART (Friday: 12pm-3pm close)"
15,2,3.045206,101.602822,19.2076,"MAMARAJ MINI MARKET (Mon-Sat: 9am-5.30pm|Fri: No delivery)"
16,1,2.990831,101.54759,17.8772,"HASIL LAUT SEONG KEE SDN BHD - KOTA KEMUNING"
17,1,3.206097,101.607407,17.9809,"K.I.P FRESH MART ( ALL DAY OPEN )"
17,2,3.207375,101.615795,18.9229,"IPOH ROAD HAKKA YONG TAU FU"
17,3,3.206805,101.616135,18.9967,"RESTORAN IPOH ROAD YTF"
17,4,3.208827,101.615782,19.2249,"TONG SIANG KITCHEN SDN BHD (Thursday Close)"
17,5,3.210003,101.6172518,19.4340,"FOONG YUEN DIM SUM SDN BHD"
17,6,3.212016,101.616831,19.6627,"SETAPAK YONG TAU FU ENTERPRISE"
17,7,3.212526,101.615695,19.8010,"FOOK XIN TANG HERBS SDN. BHD."
17,8,3.212419,101.615643,19.8142,"KEDAI UBAT & RUNCIT HONG NING DESA AMAN PURI SDN BHD"
17,9,3.212246,101.615597,19.8341,"FOOK XIN TANG MINI MARKET SDN. BHD. (After 5pm: NO DELIVERY)"
18,1,3.156204699,101.6279132,18.3300,"ABT FRESH & FROZEN FOOD SUPPLY S/B (MON-FRI 8AM-5 PM) (SAT 8AM-1PM)"
19,1,3.199847,101.617757,18.6948,"SOON CHEONG MARINE PRODUCTS SDN BHD"
19,2,3.20312424,101.6210952,19.2146,"BEST RETAIL SDN BHD (BR INGREDIENTS) (Mon to Sat 9.30am-6.30pm) (Sun & PH 9.30am-3pm)"
20,1,2.996204,101.574596,19.1189,"MUAR STATION SDN. BHD."
21,1,3.074734,101.632945,19.5853,"HOCK MEI TRADING SDN. BHD. - PASARAYA HM (TAMAN MEDAN BRANCH)"
21,2,3.074126,101.635687,19.8972,"YONG SOON FATT SDN. BHD"
21,3,3.074129,101.635719,19.9007,"MEDAN FROZEN FOOD"
22,1,3.2169131,101.6188698,19.6784,"K.H.H. DOUBLE LION FRUIT JUICE MANUFACTURING SDN BHD"
23,1,3.04684,101.62288,19.7527,"EIGHT ROAD RESTAURANT-deliver sebelum 12pm (angkat cheque)"
24,1,3.007,101.597852,20.0250,"KEDAI RUNCIT MULIA SEJATI"
25,1,3.201396,101.631682,20.1753,"KINDNESS ENTERPRISE (CLOSED MONDAY)"
26,1,3.2160498,101.6258664,20.3100,"MKR STORE"
27,1,3.2168783,101.6255266,20.3210,"PERNIAGAAN MAHAMAS (Tue-Sun:7.30am-7pm|Except Mon 7.30am-2pm)"
28,1,3.1885897,101.6387798,20.3933,"HAPPY SAM VEGE GARDEN"
29,1,3.118793521,101.6493211,20.4849,"BRICK HOUSE SDN. BHD."
30,1,3.1972327,101.636834,20.5251,"OVAL LAKE DEVELOPMENT SDN BHD (Mon-Fri: 9am-4pm|Lunch: 12pm-2pm)"
31,1,3.021559,101.616834,20.6473,"KOFFEE & CO ENTERPRISE"
32,1,3.055909,101.63768,20.8101,"AAA MINI MARKET (Mon-Sat: 10am-6pm|Friday close)"
33,1,3.214478948,101.6320953,20.8400,"CAMP FOREST RESTAURANT (Open 11.30am-10.30pm)"
34,1,3.055871,101.637959,20.8402,"I AND D ENTERPRISE (Mon-Sat: 9am-6pm| Fri: NO DELIVERY)"
35,1,3.055871,101.637959,20.8402,"KML MINI MARKET (Mon-Fri: 8.30am-6pm|Sat: 4pm close)"
36,1,3.219705044,101.6294093,20.8503,"BIG TREE CORNER"
37,1,3.213731,101.6341568,21.0064,"PAN HEONG BAK KUT TEH"
38,1,3.196037479,101.6420222,21.0137,"AGRO 19 BERHAD"
39,1,3.028178,101.625312,21.0211,"ARL SUPER MART (Mon-Sat: 9am-5.30pm)"
40,1,3.212824,101.6379809,21.3424,"RING ZHI VAGETARIAN RESTAURANT (11AM-7PM)"
41,1,3.212679,101.6385787,21.3950,"RESTORAN FERN HEONG (8.30AM-4.30PM)"
42,1,3.063017,101.647217,21.5071,"TWO SIX DELIGHT GARDEN CATERERS"
43,1,3.215355,101.639214,21.5894,"JODAN WORLD SDN BHD"
44,1,3.212531,101.64315,21.8460,"WONG YEE HUEK (THURSDAY OFF)"
45,1,3.3161076,101.5338966,22.1735,"IPOH ROAD HAKKA YONG TAU FU RESTAURANT"
46,1,3.206207093,101.6533077,22.5948,"BEN MART TRADING SDN BHD"
47,1,3.2105831,101.2785965,22.6110,"CB FROZEN FOOD SDN. BHD. - SUNGAI BULOH (Monday-Saturday: 8am-5pm)"
48,1,3.2105831,101.2785965,22.6110,"CB WHOLESALE MART SDN BHD - SUNGAI BULOH"
49,1,3.198416112,101.6579334,22.7621,"ATHILAKSHMI CASH & CARRY SDN BHD"
50,1,2.995582,101.621139,22.8024,"GAJA STORE PLT (Mon-Sat: 9am-7pm)"
51,1,3.170735565,101.6664263,22.8316,"CHIN SWEE FOOD SDN BHD (10am-5pm) (RABU TUTUP)"
52,1,3.109566523,101.6708643,22.9470,"CEMPAKA ROSINAR ENTERPRISE (Fri close)"
53,1,3.214863859,101.653769,23.0248,"CHOP HONG CHAN (Open 8am)"
54,1,3.2204941,101.6517953,23.0948,"PARK LOKE YUN SUPERMARKET"
55,1,2.974097,101.6074419,23.3689,"JW GLOBAL JAYA TRADING"
56,1,3.196440575,101.6646699,23.3955,"126 RESTAURANT (9AM-3.30PM)"
57,1,2.962411,101.330055,23.8238,"ZUHAIRINA FAMILY ENTERPRISE (Mon-Sat: 9am-6pm|Fri: No delivery)"
58,1,3.237704,101.650428,23.8691,"JIT XING TRADING (DELIVERY MON-FRI : 10AM-5.30PM)"
59,1,3.316964,101.571058,23.9933,"JAYA CASH & CARRY SDN BHD"
60,1,3.305566,101.591379,24.1339,"ELIXIR IMPEX SDN. BHD. (Mon-Sat: 9am-6pm|Fri: 12pm-3pm)"
61,1,2.909877,101.469573,24.3593,"SAI VINA CASH & CARRY (Mon-Sat: 9am-6pm|Sat close at 1pm)"
62,1,3.093567658,101.6816377,24.3613,"1 JUTA NASI LEMAK ENTERPRISE (K88 Food COURT)"
63,1,3.185554228,101.6774922,24.4081,"ALI FOOD CORNER - RESTORAN ALI FOOD'S CORNER (SEGAMBUT)"
64,1,3.327003,101.561192,24.4753,"PALANI MINI MARKET"
65,1,3.121364778,101.6854691,24.4818,"51 GROCER (8AM-8PM)"
66,1,2.989558,101.638945,24.7523,"PASAR SEGAR ARIFFIN ARAFAT (Mon-Sat: 9am-6pm)"
67,1,3.323323,101.577413,24.9569,"MK GROCERY MART (Mon close)"
68,1,3.323644,101.578322,25.0383,"SOON LEE & WTC SDN BHD (Monday off; 12pm-2pm lunch)"
69,1,3.177282,101.687117,25.2300,"PASARAYA DANIYA SDN BHD - sunday closed ( business hour 11.00 am- 08.00 pm)"
70,1,3.087866,101.692126,25.6166,"CHIA HUNG LI - KILANG KUIH-MUIH (No big truck)"
71,1,3.086921,101.692362,25.6613,"RESTORAN CHON SAI KEI"
72,1,3.188843,101.691243,25.9774,"KEDAI UBAT DAN RUNCIT HUAKSON"
73,1,3.195193933,101.6916745,26.2134,"AS BISMI MINI MART (9am-9pm|Fri: 12pm-3pm)"
74,1,3.275233,101.650625,26.2489,"YOW SENG SDN BHD"
75,1,3.098239,101.701066,26.4204,"PASARAYA T.S MEGA"
76,1,3.339879,101.577612,26.5779,"ANDA MINI MARKET"
77,1,3.132408666,101.7111244,27.3186,"CHAMPION FOOD SDN. BHD. (open 9am - 2pm)"
78,1,3.086685362,101.7078735,27.3611,"AI KOPI ENTERPRISE (DELIVERY BY 4BY4)"
79,1,3.15983,101.713936,27.8409,"SAKTI SRI AMBAL MAJU TRADING"
80,1,3.046177,101.703246,27.9964,"MAKANAN LAUT YOKE HENG (Monday close|Delivery time: 8am-11.30am)"
81,1,3.196506,101.709813,28.1902,"SHAN MGT ENTERPRISE (Fri: 1pm-5pm close)"
82,1,3.162200822,101.7176114,28.2792,"AFIA MARIAM TRADING SDN BHD (LORI KECIL)"
83,1,3.164167089,101.7175381,28.3005,"A MART SUPERSTORE SDN BHD"
84,1,3.197221,101.712079,28.4539,"MAKASSAR FRESH MARKET SDN BHD"
85,1,3.2472475,101.2358762,28.6502,"RESTORAN SIDDIQ"
86,1,3.073115126,101.7185008,28.8113,"AMAN RAHIM ENTERPRISE"
87,1,3.20193959,101.7157807,28.9927,"7 PELANGI SDN BHD"
88,1,3.110411007,101.7301672,29.5022,"AMRI & HARTINI ENTERPRISE (Fri: 12pm-3pm close)"
89,1,3.198387,101.722557,29.6102,"QCPLUS SDN. BHD. - SETAPAK (HQ)"
90,1,3.199519,101.725462,29.9544,"TOPZELLER (M) SDN BHD - SUPER SEVEN SETAPAK"
91,1,3.017334,101.712136,30.1045,"HASIL LAUT SEONG KEE SDN BHD - SERI KEMBANGAN"
92,1,3.009313,101.710221,30.2918,"WIGNES MINI MARKET SDN BHD."
93,1,3.00698,101.709171,30.3023,"PASARAYA JUST RIGHT SDN BHD"
94,1,3.147212,101.739155,30.4959,"PASARAYA MADEENA"
95,1,3.200736131,101.7304739,30.5268,"CB FROZEN FOOD SDN. BHD. - SRI RAMPAI"
96,1,3.195203231,101.7329516,30.6387,"810 SPEEDMART SDN BHD (open 8am-4pm) (close 1pm-2pm) - SAT CLOSED"
97,1,3.027898,101.722515,30.7093,"PASAR MINI BERKAT BONDA (Mon-Sat: 9.30am-6pm|Fri:12pm-3pm)"
98,1,3.135418376,101.7421538,30.7695,"CB FROZEN FOOD SDN. BHD. - PANDAN JAYA (Monday-Saturday: 8am-5pm)"
99,1,3.156252,101.741978,30.8912,"PROFIT BEST TRADING (DELIVERY TO CUSTOMER'S HOUSE, PLEASE CALL 30 MINS BEFORE DELIVERY)"
100,1,3.392907,101.552295,30.9110,"FANAAS BISTRO (Restoran Alinas-Prima Beruntung)"
101,1,3.026672,101.724401,30.9541,"B CART TRADING"
102,1,3.028052,101.726036,31.0673,"PASAR MINI UMA"
103,1,3.3027231,101.2459559,31.0725,"PASARAYA HIJRAH (PELITA HIJRAH SDN BHD)"
104,1,3.015506777,101.7211052,31.0965,"CHAW ENTERPRISE (SJK (C) KUNG MAN) - (Mon to Fri - After 2pm) (4pm Close)"
105,1,3.088609843,101.7434149,31.2247,"BIG TREE PLT (24 Hrs - Every 2 weeks off 1 day)"
106,1,3.088366,101.743564,31.2450,"RESTORAN SEGAR PERTAMA"
107,1,3.10863638,101.7459843,31.2679,"CB FROZEN FOOD SDN BHD - CHERAS BRANCH  8AM-5PM"
108,1,3.156144,101.745755,31.3074,"NEW XUN FATT ENTERPRISE (Morning - Lori besar tak boleh masuk)"
109,1,3.049089,101.735535,31.3113,"SUPER SEVEN (M) SDN BHD - SG BULOH"
110,1,3.054135,101.738171,31.4390,"SHAHRUL FRESH & FROZEN (M) SDN BHD (Fri: Close during Jumaat prayer)"
111,1,3.158203235,101.7475888,31.5329,"AMPANG GROCERS SDN BHD"
112,1,3.217327111,101.7381495,31.8699,"BESTA CORPORATION SDN BHD"
