cluster_id,sequence_order,store_name,lat,lon,tonnage,haversine_dist_km,haversine_cumulative_km,road_dist_km,cumulative_dist_km,drive_min_no_traffic,drive_min_with_traffic,delay_min,fuel_liters_leg,cumulative_fuel_liters,return_dist_km,weather,temp_c
1,1,"PASAR MINI PAYA JARAS",3.2002098,101.5507472,"50",0.86,0.86,1.98,1.98,5,5,0,0.69,0.69,,"Scattered clouds. Extremely hot.",34.00
1,2,"NAD SAMUDERA ENTERPRISE (Fri: Close 12pm-3pm)",3.1932652,101.5458882,"52",1.79,1.80,1.85,3.83,5,5,0,0.65,1.34,,"Scattered clouds. Extremely hot.",34.00
1,3,"RESTORAN LEE HONG KEE SDN. BHD.OPEN-12-3PM MONDAY HALF DAY ONLY",3.1827378,101.5401381,"48",3.10,3.14,3.94,7.77,11,11,0,1.38,2.72,,"Scattered clouds. Extremely hot.",34.00
1,4,"MITAJAYA TRADING",3.1928766,101.5291471,"52",3.35,4.80,2.75,10.52,8,8,0,0.96,3.68,,"Scattered clouds. Extremely hot.",34.00
1,5,"KEDAI BORONG DAN RUNCIT YUSOF MAJU (OPEN 9AM-5PM) (FRIDAY CLOSE) (12PM-2PM REHAT)",3.1972137,101.5324219,"54",2.83,5.40,0.88,11.40,3,3,0,0.31,3.99,,"Scattered clouds. Extremely hot.",34.00
1,6,"KEDAI RUNCIT MOHD FADZIL HAIRI",3.1993666,101.5352935,"54",2.46,5.80,0.81,12.21,3,3,0,0.28,4.27,,"Scattered clouds. Extremely hot.",34.00
1,7,"KEDAI RUNCIT MOHD FADZIL HAIRI (12pm-3pm close)",3.1993666,101.5352935,"54",2.46,5.80,0.00,12.21,0,0,0,0.00,4.27,,"Scattered clouds. Extremely hot.",34.00
1,8,"ISKANDAR BIN HUSAINI (Open 9am-6pm|Fri: 12pm-3pm rest)",3.2018728,101.5349002,"55",2.44,6.08,0.84,13.05,2,2,0,0.29,4.57,,"Scattered clouds. Extremely hot.",34.00
1,9,"KEDAI RUNCIT ZULKIFLY (OPEN 7AM-6 PM) (CLOSE ON FRIDAY 12PM-3PM)",3.1993933,101.5275686,"54",3.29,6.94,2.14,15.19,5,6,0,0.75,5.32,,"Scattered clouds. Extremely hot.",34.00
1,10,"BINTANG HU TRADING(FRIDAY CLOSED)",3.2118755,101.5300983,"82",3.03,8.36,6.17,21.36,12,15,3,2.16,7.48,,"Scattered clouds. Extremely hot.",34.00
1,11,"NORLYS KITCHEN & CATERING",3.2134363,101.5321978,"51",2.86,8.65,1.63,22.99,6,6,0,0.57,8.05,,"Scattered clouds. Extremely hot.",34.00
1,12,"NASI KANDAR ALI NAS MAJU (Restoran Alinas Aman Putri)",3.2174739,101.520213,"52",4.26,10.05,3.63,26.62,6,7,1,1.27,9.32,,"Scattered clouds. Extremely hot.",34.00
1,13,"PEMBORONG & PERUNCIT LINA (Sat: Close)",3.2219337,101.5197575,"49",4.49,10.55,1.06,27.68,2,3,0,0.37,9.69,,"Scattered clouds. Extremely hot.",34.00
1,14,"NASABE ENTERPRISE (12pm-3pm close)",3.2250317,101.4981694,"52",6.85,12.97,3.96,31.64,5,7,1,1.39,11.07,,"Scattered clouds. Extremely hot.",34.00
1,15,"BINTANG HU TRADING (FRIDAY CLOSED)",3.2073436,101.4969526,"57",6.63,14.94,4.86,36.50,9,10,0,1.70,12.77,,"Scattered clouds. Extremely hot.",34.00
1,16,"RESTORAN NURI AL NISAR",3.2032786,101.4843394,"48",8.03,16.42,3.48,39.98,7,8,0,1.22,13.99,,"Scattered clouds. Extremely hot.",34.00
1,17,"AMA WORLDWIDE SDN BHD (Open 8am-8pm) Friday closed",3.2009369,101.4766868,"10",8.89,17.30,3.04,43.02,8,8,0,1.06,15.06,,"Scattered clouds. Extremely hot.",34.00
1,18,"KS SMART MART SDN. BHD. (Mon-Sat: 9am-7pm)",3.1995828,101.4554655,"53",11.25,19.67,7.25,50.27,16,17,0,2.54,17.59,,"Scattered clouds. Extremely hot.",34.00
1,19,"KZ KIOSK (Mon-Fri: 8am-6pm| Fri: 12pm-3pm rest| Sat: 3pm close)",3.239434,101.447236,"53",12.72,24.19,7.62,57.89,17,17,1,2.67,20.26,,"Scattered clouds. Extremely hot.",34.00
1,20,"SINAR TEGUH RESOURCES (Mon-Sat: 9.30am-6pm| Fri: NO DELIVERY)",3.251992,101.448689,"47",13.06,25.60,1.82,59.71,5,5,0,0.64,20.90,,"Scattered clouds. Extremely hot.",34.00
1,21,"RS VALLEY TRADING & SERVICES - PPAJ (Fri: 12pm-3pm rest)",3.25282,101.446804,"48",13.29,25.82,0.33,60.04,1,1,0,0.12,21.01,,"Scattered clouds. Extremely hot.",34.00
1,22,"BABAU SENTOSA ENTERPRISE (SELANGA FRESH MART) (Open 7am-10pm | Close Fri:12pm-2.30pm)",3.245137,101.426723,"64",15.08,28.21,3.77,63.81,10,10,0,1.32,22.33,,"Scattered clouds. Extremely hot.",34.00
1,23,"BI IZNILLAH ENTERPRISE (Open 9am - 7pm)",3.2465493,101.4728759,"74",10.37,33.34,9.29,73.10,16,19,3,3.25,25.59,,"Scattered clouds. Extremely hot.",34.00
1,24,"PASAR RAYA ASS SETIA",3.301924,101.493232,"50",12.84,39.90,9.98,83.08,17,18,1,3.49,29.08,,"Scattered clouds. Extremely hot.",34.00
1,25,"IPOH ROAD HAKKA YONG TAU FU RESTAURANT",3.3161076,101.5338966,"55",12.58,44.68,6.05,89.13,11,13,2,2.12,31.20,,"Scattered clouds. Extremely hot.",34.00
1,26,"PALANI MINI MARKET",3.327003,101.561192,"51",13.54,47.94,6.67,95.80,12,15,3,2.33,33.53,,"Scattered clouds. Extremely hot.",34.00
1,27,"JAYA CASH & CARRY SDN BHD",3.316964,101.571058,"55",12.52,49.51,2.15,97.95,6,6,0,0.75,34.28,23.25,"Scattered clouds. Extremely hot.",34.00
2,1,"HAI SOON HENG TRADING (Delivery after 12pm)",3.21061,101.566028,"56",1.20,1.20,2.58,2.58,6,8,2,0.90,0.90,,"Scattered clouds. Extremely hot.",34.00
2,2,"ADA CASH & CARRY SDN BHD (Mon: No delivery after 2 pm)",3.210918,101.567095,"96",1.32,1.33,0.20,2.78,1,1,0,0.07,0.97,,"Scattered clouds. Extremely hot.",34.00
2,3,"AURA NURILHAM ENTERPRISE",3.2153632,101.5662228,"45",1.55,1.83,1.16,3.94,4,4,0,0.41,1.38,,"Scattered clouds. Extremely hot.",34.00
2,4,"RAJDHANI SDN BHD",3.2121628,101.5726418,"49",1.94,2.63,3.68,7.62,7,8,1,1.29,2.67,,"Scattered clouds. Extremely hot.",34.00
2,5,"RESTORAN BAK KUT TEH KIM KEE",3.1982949,101.5732,"49",2.00,4.17,2.84,10.46,7,9,2,0.99,3.66,,"Scattered clouds. Extremely hot.",34.00
2,6,"CHIA SHING FOOD INDUSTRIES SDN BHD",3.198458,101.5692969,"53",1.60,4.60,0.45,10.91,1,2,0,0.16,3.82,,"Scattered clouds. Extremely hot.",34.00
2,7,"KS MART SDN BHD",3.197716,101.568073,"53",1.53,4.76,0.19,11.10,0,0,0,0.07,3.88,,"Scattered clouds. Extremely hot.",34.00
2,8,"ST.MARK'S COZY HOME",3.197425,101.56801,"47",1.54,4.79,0.03,11.13,0,0,0,0.01,3.90,,"Scattered clouds. Extremely hot.",34.00
2,9,"AZIZI MINI MARKET",3.1973148,101.567381,"58",1.49,4.87,0.20,11.33,1,1,0,0.07,3.97,,"Scattered clouds. Extremely hot.",34.00
2,10,"SUN THONG HING SDN BHD",3.196536,101.567435,"47",1.55,4.95,0.88,12.21,2,2,0,0.31,4.27,,"Scattered clouds. Extremely hot.",34.00
2,11,"ENG SIANG GROCER (Mon: Close|Loading at 9.30am-7.30pm)",3.1968201,101.5667535,"57",1.47,5.03,0.89,13.10,2,2,0,0.31,4.58,,"Scattered clouds. Extremely hot.",34.00
2,12,"RESTORAN C&Y - (OPEN 7AM-12PM)",3.1968558,101.5657222,"49",1.38,5.15,0.11,13.21,0,0,0,0.04,4.62,,"Scattered clouds. Extremely hot.",34.00
2,13,"RESTORAN KONG MAH SDN BHD (open 7am - 4pm)(tuesday closed)",3.1975612,101.5654258,"48",1.30,5.23,0.46,13.67,2,2,0,0.16,4.78,,"Scattered clouds. Extremely hot.",34.00
2,14,"PASAR MINI KURNIA MAJU - JUMAAT TUTUP",3.1984813,101.5670179,"50",1.38,5.44,0.38,14.05,1,1,0,0.13,4.92,,"Scattered clouds. Extremely hot.",34.00
2,15,"LASHIKA SPICES - OPEN 7AM-10PM & 2PM-4:30PM - (11AM-2PM TAK BOLEH DELIVERY)",3.1957531,101.5645649,"53",1.38,5.85,0.72,14.77,2,2,0,0.25,5.17,,"Scattered clouds. Extremely hot.",34.00
2,16,"NUR SAKINAH TRADING",3.192631,101.5625203,"51",1.55,6.26,0.56,15.33,1,1,0,0.20,5.37,,"Scattered clouds. Extremely hot.",34.00
2,17,"BERAS AGRO (M) SDN BHD",3.1899834,101.5649231,"40",1.94,6.66,0.57,15.90,1,1,0,0.20,5.56,,"Scattered clouds. Extremely hot.",34.00
2,18,"FK SALMA ENTERPRISE",3.1905493,101.565561,"56",1.92,6.75,0.12,16.02,1,1,0,0.04,5.61,,"Scattered clouds. Extremely hot.",34.00
2,19,"RESTORAN SERI RASA",3.1905466,101.5658297,"48",1.93,6.78,0.02,16.04,0,0,0,0.01,5.61,,"Scattered clouds. Extremely hot.",34.00
2,20,"PINNACLE FOODS (M) SDN BHD",3.1882442,101.5649721,"49",2.11,7.06,0.33,16.37,1,1,0,0.12,5.73,,"Scattered clouds. Extremely hot.",34.00
2,21,"MOITTRY INFINITY SDN BHD",3.187388,101.5666542,"52",2.28,7.26,2.64,19.01,8,8,0,0.92,6.65,,"Scattered clouds. Extremely hot.",34.00
2,22,"PASA RAYA TOP CIRCUITS SDN BHD",3.1882925,101.5686546,"51",2.32,7.51,0.44,19.45,1,1,0,0.15,6.81,,"Scattered clouds. Extremely hot.",34.00
2,23,"ASIAN DINE SDN BHD",3.187566,101.571467,"94",2.57,7.83,0.31,19.76,1,1,0,0.11,6.92,,"Scattered clouds. Extremely hot.",34.00
2,24,"ENG HUP SENG SESAME OIL & SAUCE FACTORY SDN BHD-DELIVER BY FORKLIFT",3.188169,101.572788,"57",2.62,7.99,0.15,19.91,0,0,0,0.05,6.97,,"Scattered clouds. Extremely hot.",34.00
2,25,"RESTORAN MEI JING (Open 2pm-10pm,KHAMIS TUTUP)",3.188149,101.573081,"48",2.64,8.03,0.03,19.94,0,0,0,0.01,6.98,,"Scattered clouds. Extremely hot.",34.00
2,26,"BUMI SEHATI FROZEN FOOD SDN BHD",3.188154,101.573128,"85",2.65,8.03,0.01,19.95,0,0,0,0.00,6.98,,"Scattered clouds. Extremely hot.",34.00
2,27,"SRI RANTAU FOOD MART (8.00am – 12.00pm / 2.00pm – 5.00pm) (Tue & Sun Off)",3.188163,101.573131,"47",2.65,8.03,0.00,19.95,0,0,0,0.00,6.98,,"Scattered clouds. Extremely hot.",34.00
2,28,"PANTAI SELAMAT (IM) S/B",3.188202,101.573154,"51",2.64,8.04,0.00,19.95,0,0,0,0.00,6.98,,"Scattered clouds. Extremely hot.",34.00
2,29,"SEMAQ IQHLAS SDN BHD",3.188219,101.57318,"48",2.64,8.04,0.00,19.95,0,0,0,0.00,6.98,,"Scattered clouds. Extremely hot.",34.00
2,30,"HO KIM WEI (1pm - 3pm : no delivery)",3.188286,101.573236,"55",2.64,8.05,0.01,19.96,0,0,0,0.00,6.99,,"Scattered clouds. Extremely hot.",34.00
2,31,"PERNIAGAAN HE SOON (no delivery on Monday)",3.188298,101.573231,"49",2.64,8.05,0.00,19.96,0,0,0,0.00,6.99,,"Scattered clouds. Extremely hot.",34.00
2,32,"OLIVAS BAKERY INGREDIENTS SDN BHD",3.1881,101.573205,"51",2.66,8.07,0.02,19.98,0,0,0,0.01,6.99,,"Scattered clouds. Extremely hot.",34.00
2,33,"YOW SENG SDN BHD",3.1881,101.573155,"46",2.65,8.08,0.02,20.00,0,0,0,0.01,7.00,,"Scattered clouds. Extremely hot.",34.00
2,34,"DISTINCTIVE MODEL SDN BHD (TOYOTA SERVIS CENTRE)",3.1877839,101.5758332,"66",2.89,8.38,0.28,20.28,1,1,0,0.10,7.10,,"Scattered clouds. Extremely hot.",34.00
2,35,"HOCK SOON BAK KUT TEH (MONDAY OFF)",3.1927097,101.5748633,"55",2.46,8.94,1.26,21.54,3,3,0,0.44,7.54,,"Scattered clouds. Extremely hot.",34.00
2,36,"A&Z BARKAT MAJU MARKETING (12pm-3pm close)",3.1909023,101.5884752,"93",3.88,10.46,5.41,26.95,11,13,2,1.89,9.43,,"Scattered clouds. Extremely hot.",34.00
2,37,"NASABE ENTERPRISE (12pm-3pm close)",3.190733,101.5889367,"52",3.94,10.52,0.16,27.11,0,0,0,0.06,9.49,,"Scattered clouds. Extremely hot.",34.00
2,38,"DAMANSARA DAMAI ENTERPRISE (12pm-3pm close)",3.1893964,101.5883007,"39",3.94,10.68,2.28,29.39,6,6,0,0.80,10.29,,"Scattered clouds. Extremely hot.",34.00
2,39,"L & P MINI MARKET (khamis tutup)",3.1987847,101.590422,"53",3.82,11.75,1.98,31.37,5,5,0,0.69,10.98,,"Scattered clouds. Extremely hot.",34.00
2,40,"RAYYAN SPEEDMART(MOHD LUKMAN)",3.1981898,101.5948604,"49",4.32,12.25,0.92,32.29,4,4,0,0.32,11.30,,"Scattered clouds. Extremely hot.",34.00
2,41,"REZAL TRADING - AL FALAH MART (Fri-Sat close)",3.19172,101.600144,"48",5.06,13.18,1.73,34.02,4,4,0,0.61,11.91,,"Scattered clouds. Extremely hot.",34.00
2,42,"KAMPONG KOH SAUCE (M) SDN BHD - (DELIVERY BEFORE 12PM)",3.20282,101.604827,"54",5.36,14.52,4.95,38.97,12,13,1,1.73,13.64,,"Scattered clouds. Extremely hot.",34.00
2,43,"WHITE HERON PRARMACEUTICAL SDN BHD",3.20331,101.603463,"46",5.21,14.68,0.18,39.15,1,1,0,0.06,13.70,,"Scattered clouds. Extremely hot.",34.00
2,44,"K.I.P FRESH MART ( ALL DAY OPEN )",3.206097,101.607407,"54",5.64,15.21,0.99,40.14,3,3,0,0.35,14.05,,"Scattered clouds. Extremely hot.",34.00
2,45,"IPOH ROAD HAKKA YONG TAU FU",3.207375,101.615795,"55",6.58,16.15,1.80,41.94,5,5,0,0.63,14.68,,"Scattered clouds. Extremely hot.",34.00
2,46,"RESTORAN IPOH ROAD YTF",3.206805,101.616135,"48",6.61,16.23,2.94,44.88,5,7,2,1.03,15.71,,"Scattered clouds. Extremely hot.",34.00
2,47,"TONG SIANG KITCHEN SDN BHD (Thursday Close)",3.208827,101.615782,"46",6.58,16.46,1.37,46.25,4,4,1,0.48,16.19,,"Scattered clouds. Extremely hot.",34.00
2,48,"FOONG YUEN DIM SUM SDN BHD",3.210003,101.6172518,"56",6.75,16.67,1.55,47.80,5,6,1,0.54,16.73,,"Scattered clouds. Extremely hot.",34.00
2,49,"SETAPAK YONG TAU FU ENTERPRISE",3.212016,101.616831,"48",6.73,16.89,0.71,48.51,2,3,0,0.25,16.98,,"Scattered clouds. Extremely hot.",34.00
2,50,"FOOK XIN TANG HERBS SDN. BHD.",3.212526,101.615695,"56",6.61,17.03,0.60,49.11,3,3,0,0.21,17.19,,"Scattered clouds. Extremely hot.",34.00
2,51,"KEDAI UBAT & RUNCIT HONG NING DESA AMAN PURI SDN BHD",3.212419,101.615643,"54",6.60,17.05,0.15,49.26,1,1,0,0.05,17.24,,"Scattered clouds. Extremely hot.",34.00
2,52,"FOOK XIN TANG MINI MARKET SDN. BHD. (After 5pm: NO DELIVERY)",3.212246,101.615597,"56",6.60,17.07,0.20,49.46,1,1,0,0.07,17.31,,"Scattered clouds. Extremely hot.",34.00
2,53,"K.H.H. DOUBLE LION FRUIT JUICE MANUFACTURING SDN BHD",3.2169131,101.6188698,"54",7.03,17.70,1.21,50.67,3,3,0,0.42,17.73,,"Scattered clouds. Extremely hot.",34.00
2,54,"PERNIAGAAN MAHAMAS (Tue-Sun:7.30am-7pm|Except Mon 7.30am-2pm)",3.2168783,101.6255266,"49",7.76,18.44,1.29,51.96,4,4,0,0.45,18.19,,"Scattered clouds. Extremely hot.",34.00
2,55,"MKR STORE",3.2160498,101.6258664,"52",7.78,18.54,0.12,52.08,1,1,0,0.04,18.23,,"Scattered clouds. Extremely hot.",34.00
2,56,"BIG TREE CORNER",3.219705044,101.6294093,"74",8.24,19.10,0.77,52.85,3,3,0,0.27,18.50,,"Scattered clouds. Extremely hot.",34.00
2,57,"CAMP FOREST RESTAURANT (Open 11.30am-10.30pm)",3.214478948,101.6320953,"64",8.44,19.76,0.95,53.80,4,4,0,0.33,18.83,,"Scattered clouds. Extremely hot.",34.00
2,58,"PAN HEONG BAK KUT TEH",3.213731,101.6341568,"51",8.66,20.00,0.96,54.76,2,3,1,0.34,19.17,,"Scattered clouds. Extremely hot.",34.00
2,59,"RING ZHI VAGETARIAN RESTAURANT (11AM-7PM)",3.212824,101.6379809,"48",9.07,20.44,1.85,56.61,5,7,2,0.65,19.81,,"Scattered clouds. Extremely hot.",34.00
2,60,"RESTORAN FERN HEONG (8.30AM-4.30PM)",3.212679,101.6385787,"49",9.14,20.50,1.18,57.79,4,4,1,0.41,20.23,,"Scattered clouds. Extremely hot.",34.00
2,61,"JODAN WORLD SDN BHD",3.215355,101.639214,"54",9.24,20.81,1.06,58.85,3,3,1,0.37,20.60,,"Scattered clouds. Extremely hot.",34.00
2,62,"WONG YEE HUEK (THURSDAY OFF)",3.212531,101.64315,"46",9.64,21.35,0.97,59.82,3,3,0,0.34,20.94,,"Scattered clouds. Extremely hot.",34.00
2,63,"CHOP HONG CHAN (Open 8am)",3.214863859,101.653769,"82",10.84,22.56,3.52,63.34,9,10,2,1.23,22.17,,"Scattered clouds. Extremely hot.",34.00
2,64,"PARK LOKE YUN SUPERMARKET",3.2204941,101.6517953,"51",10.70,23.22,2.09,65.43,6,6,0,0.73,22.90,,"Scattered clouds. Extremely hot.",34.00
2,65,"BEN MART TRADING SDN BHD",3.206207093,101.6533077,"71",10.74,24.82,2.93,68.36,8,9,1,1.03,23.93,,"Scattered clouds. Extremely hot.",34.00
2,66,"ATHILAKSHMI CASH & CARRY SDN BHD",3.198416112,101.6579334,"99",11.28,25.82,1.58,69.94,5,5,0,0.55,24.48,,"Scattered clouds. Extremely hot.",34.00
2,67,"126 RESTAURANT (9AM-3.30PM)",3.196440575,101.6646699,"99",12.04,26.60,1.69,71.63,6,6,0,0.59,25.07,,"Scattered clouds. Extremely hot.",34.00
2,68,"ALI FOOD CORNER - RESTORAN ALI FOOD'S CORNER (SEGAMBUT)",3.185554228,101.6774922,"65",13.60,28.47,3.06,74.69,7,8,1,1.07,26.14,,"Scattered clouds. Extremely hot.",34.00
2,69,"PASARAYA DANIYA SDN BHD - sunday closed ( business hour 11.00 am- 08.00 pm)",3.177282,101.687117,"50",14.82,29.88,2.07,76.76,5,6,1,0.72,26.87,,"Scattered clouds. Extremely hot.",34.00
2,70,"KEDAI UBAT DAN RUNCIT HUAKSON",3.188843,101.691243,"54",15.06,31.25,2.50,79.26,4,6,2,0.88,27.74,,"Scattered clouds. Extremely hot.",34.00
2,71,"AS BISMI MINI MART (9am-9pm|Fri: 12pm-3pm)",3.195193933,101.6916745,"46",15.04,31.95,0.82,80.08,2,2,1,0.29,28.03,,"Scattered clouds. Extremely hot.",34.00
2,72,"SHAN MGT ENTERPRISE (Fri: 1pm-5pm close)",3.196506,101.709813,"48",17.04,33.97,5.20,85.28,11,13,2,1.82,29.85,,"Scattered clouds. Extremely hot.",34.00
2,73,"MAKASSAR FRESH MARKET SDN BHD",3.197221,101.712079,"53",17.28,34.24,1.73,87.01,5,5,0,0.61,30.45,,"Scattered clouds. Extremely hot.",34.00
2,74,"7 PELANGI SDN BHD",3.20193959,101.7157807,"56",17.68,34.90,1.42,88.43,3,4,1,0.50,30.95,,"Scattered clouds. Extremely hot.",34.00
2,75,"QCPLUS SDN. BHD. - SETAPAK (HQ)",3.198387,101.722557,"49",18.44,35.75,1.82,90.25,5,7,1,0.64,31.59,,"Scattered clouds. Extremely hot.",34.00
2,76,"TOPZELLER (M) SDN BHD - SUPER SEVEN SETAPAK",3.199519,101.725462,"46",18.76,36.10,0.50,90.75,3,3,0,0.17,31.76,,"Scattered clouds. Extremely hot.",34.00
2,77,"CB FROZEN FOOD SDN. BHD. - SRI RAMPAI",3.200736131,101.7304739,"19",19.31,36.67,1.17,91.92,4,4,1,0.41,32.17,,"Scattered clouds. Extremely hot.",34.00
2,78,"810 SPEEDMART SDN BHD (open 8am-4pm) (close 1pm-2pm) - SAT CLOSED",3.195203231,101.7329516,"78",19.61,37.35,1.72,93.64,5,6,1,0.60,32.77,,"Scattered clouds. Extremely hot.",34.00
2,79,"BESTA CORPORATION SDN BHD",3.217327111,101.7381495,"22",20.20,39.87,5.60,99.24,9,11,2,1.96,34.73,,"Scattered clouds. Extremely hot.",34.00
2,80,"ACCESS FOUR TRADING (Fri: Halfday for prayer)",3.196925,101.759184,"62",22.51,43.13,5.15,104.39,8,9,1,1.80,36.54,,"Scattered clouds. Extremely hot.",34.00
2,81,"PASAR MINI BERLIAN (Mon-Sat: 9am-6pm| Fri: 12pm-3pm rest| Sat: 3pm close)",3.158593,101.760915,"51",23.27,47.40,6.15,110.54,11,13,2,2.15,38.69,,"Scattered clouds. Extremely hot.",34.00
2,82,"PASAR MINI RASMI (Mon-Sat: 8.30am-6pm| Fri: 12pm-3pm rest| Sat: 3pm close)",3.152606,101.770132,"50",24.42,48.62,1.62,112.16,5,5,0,0.57,39.26,32.08,"Scattered clouds. Extremely hot.",34.00
3,1,"PERNIAGAAN SUNGHO FOOD SDN BHD",3.224367,101.5631572,"49",2.24,2.24,6.38,6.38,12,15,4,2.23,2.23,,"Scattered clouds. Extremely hot.",34.00
3,2,"SOON CHEONG MARINE PRODUCTS SDN BHD(SG BULOH)",3.225815,101.56779,"47",2.60,2.78,1.45,7.83,5,5,0,0.51,2.74,,"Scattered clouds. Extremely hot.",34.00
3,3,"MB RETAIL ENTERPRISE (9AM - 5PM)",3.1773599,101.5776437,"53",3.89,8.28,7.42,15.25,12,14,2,2.60,5.34,,"Scattered clouds. Extremely hot.",34.00
3,4,"PASAR RAYA BORONG DAN RUNCIT SURIA (SATURDAY AFTER 2PM NO RECEIVED GOOD)",3.173116,101.576215,"50",4.19,8.78,1.24,16.49,4,4,0,0.43,5.77,,"Scattered clouds. Extremely hot.",34.00
3,5,"FALAM ENTERPRISE (PASAR MINI SIRAJANE)",3.1673444,101.5674932,"57",4.39,9.94,1.90,18.39,4,5,1,0.66,6.44,,"Scattered clouds. Extremely hot.",34.00
3,6,"JW GROCERY STORE (Mon-Sat: 9.30am-6pm|Fri: 12pm-3pm rest)",3.153636,101.603084,"54",7.72,14.17,6.57,24.96,10,16,6,2.30,8.74,,"Scattered clouds. Extremely hot.",34.00
3,7,"PD DAILY FRESH",3.153949,101.60333,"49",7.71,14.22,1.20,26.16,2,2,0,0.42,9.16,,"Scattered clouds. Extremely hot.",34.00
3,8,"YAYA NEW FLAVOURS SDN BHD (CLOSE: TUESDAY)",3.164639,101.6083,"46",7.31,15.53,2.52,28.68,6,7,1,0.88,10.04,,"Scattered clouds. Extremely hot.",34.00
3,9,"SRI RANTAU SPEED MART - 3pm close every day",3.183843,101.613623,"47",6.77,17.74,5.87,34.55,10,11,1,2.05,12.09,,"Scattered clouds. Extremely hot.",34.00
3,10,"TMS SUPER STORE",3.183918,101.613631,"47",6.76,17.75,0.23,34.78,1,1,0,0.08,12.17,,"Scattered clouds. Extremely hot.",34.00
3,11,"PD DELIMEE FOOD INDUSTRIES",3.183922,101.61362,"49",6.76,17.75,0.23,35.01,1,1,0,0.08,12.25,,"Scattered clouds. Extremely hot.",34.00
3,12,"JIN HUANG",3.183931,101.613617,"55",6.76,17.75,0.10,35.11,0,0,0,0.03,12.29,,"Scattered clouds. Extremely hot.",34.00
3,13,"H AND C FRESH SDN. BHD. (SAT-Closed, 1pm-3pm lunch)",3.183922,101.613608,"56",6.76,17.76,0.13,35.24,0,0,0,0.05,12.33,,"Scattered clouds. Extremely hot.",34.00
3,14,"HAJI SHARIFF CENDOL",3.183945,101.61364,"56",6.76,17.76,0.10,35.34,0,0,0,0.03,12.37,,"Scattered clouds. Extremely hot.",34.00
3,15,"JT FOOD MART",3.183989,101.613656,"54",6.76,17.77,0.00,35.34,0,0,0,0.00,12.37,,"Scattered clouds. Extremely hot.",34.00
3,16,"SOON CHEONG MARINE PRODUCTS SDN BHD",3.199847,101.617757,"47",6.82,19.59,4.25,39.59,9,10,1,1.49,13.86,,"Scattered clouds. Extremely hot.",34.00
3,17,"BEST RETAIL SDN BHD (BR INGREDIENTS) (Mon to Sat 9.30am-6.30pm) (Sun & PH 9.30am-3pm)",3.20312424,101.6210952,"98",7.16,20.11,4.04,43.63,7,9,2,1.41,15.27,,"Scattered clouds. Extremely hot.",34.00
3,18,"KINDNESS ENTERPRISE (CLOSED MONDAY)",3.201396,101.631682,"53",8.35,21.30,2.92,46.55,6,8,2,1.02,16.29,,"Scattered clouds. Extremely hot.",34.00
3,19,"OVAL LAKE DEVELOPMENT SDN BHD (Mon-Fri: 9am-4pm|Lunch: 12pm-2pm)",3.1972327,101.636834,"51",8.95,22.03,1.74,48.29,4,4,0,0.61,16.90,,"Scattered clouds. Extremely hot.",34.00
3,20,"AGRO 19 BERHAD",3.196037479,101.6420222,"25",9.54,22.62,0.96,49.25,3,3,0,0.34,17.24,,"Scattered clouds. Extremely hot.",34.00
3,21,"HAPPY SAM VEGE GARDEN",3.1885897,101.6387798,"55",9.31,23.53,2.29,51.54,6,7,1,0.80,18.04,,"Scattered clouds. Extremely hot.",34.00
3,22,"CHIN SWEE FOOD SDN BHD (10am-5pm) (RABU TUTUP)",3.170735565,101.6664263,"100",12.78,27.18,9.93,61.47,15,16,1,3.48,21.51,,"Scattered clouds. Extremely hot.",34.00
3,23,"ABT FRESH & FROZEN FOOD SUPPLY S/B (MON-FRI 8AM-5 PM) (SAT 8AM-1PM)",3.156204699,101.6279132,"55",9.62,31.75,7.93,69.40,11,12,1,2.78,24.29,,"Scattered clouds. Extremely hot.",34.00
3,24,"RESTORAN AL-RIFAAHY MAJU",3.138613,101.624039,"49",10.54,33.76,4.45,73.85,7,9,2,1.56,25.85,,"Scattered clouds. Extremely hot.",34.00
3,25,"PENG SOON",3.128451,101.634727,"49",12.18,35.40,8.66,82.51,12,16,4,3.03,28.88,,"Scattered clouds. Extremely hot.",34.00
3,26,"BRICK HOUSE SDN. BHD.",3.118793521,101.6493211,"76",14.09,37.34,3.54,86.05,6,7,1,1.24,30.12,,"Scattered clouds. Extremely hot.",34.00
3,27,"CEMPAKA ROSINAR ENTERPRISE (Fri close)",3.109566523,101.6708643,"75",16.56,39.94,5.46,91.51,10,13,3,1.91,32.03,,"Scattered clouds. Extremely hot.",34.00
3,28,"51 GROCER (8AM-8PM)",3.121364778,101.6854691,"40",17.08,42.03,6.96,98.47,12,13,2,2.44,34.46,,"Scattered clouds. Extremely hot.",34.00
3,29,"PASARAYA T.S MEGA",3.098239,101.701066,"50",19.97,45.13,10.48,108.95,14,15,1,3.67,38.13,,"Scattered clouds. Extremely hot.",34.00
3,30,"AI KOPI ENTERPRISE (DELIVERY BY 4BY4)",3.086685362,101.7078735,"12",21.36,46.62,8.39,117.34,11,13,2,2.94,41.07,,"Scattered clouds. Extremely hot.",34.00
3,31,"RESTORAN CHON SAI KEI",3.086921,101.692362,"49",20.01,48.34,2.93,120.27,6,6,0,1.03,42.09,,"Scattered clouds. Extremely hot.",34.00
3,32,"CHIA HUNG LI - KILANG KUIH-MUIH (No big truck)",3.087866,101.692126,"50",19.92,48.45,0.43,120.70,2,2,0,0.15,42.25,,"Scattered clouds. Extremely hot.",34.00
3,33,"1 JUTA NASI LEMAK ENTERPRISE (K88 Food COURT)",3.093567658,101.6816377,"30",18.63,49.78,1.89,122.59,4,5,0,0.66,42.91,27.77,"Scattered clouds. Extremely hot.",34.00
4,1,"JIT XING TRADING (DELIVERY MON-FRI : 10AM-5.30PM)",3.237704,101.650428,"55",11.02,11.02,14.88,14.88,17,21,4,5.21,5.21,,"Scattered clouds. Extremely hot.",34.00
4,2,"YOW SENG SDN BHD",3.275233,101.650625,"46",13.02,15.20,6.17,21.05,8,11,3,2.16,7.37,,"Scattered clouds. Extremely hot.",34.00
4,3,"ELIXIR IMPEX SDN. BHD. (Mon-Sat: 9am-6pm|Fri: 12pm-3pm)",3.305566,101.591379,"57",11.80,22.59,8.04,29.09,7,10,3,2.81,10.18,,"Scattered clouds. Extremely hot.",34.00
4,4,"SOON LEE & WTC SDN BHD (Monday off; 12pm-2pm lunch)",3.323644,101.578322,"47",13.38,25.07,4.11,33.20,7,9,3,1.44,11.62,,"Scattered clouds. Extremely hot.",34.00
4,5,"MK GROCERY MART (Mon close)",3.323323,101.577413,"52",13.33,25.17,0.12,33.32,0,0,0,0.04,11.66,,"Scattered clouds. Extremely hot.",34.00
4,6,"ANDA MINI MARKET",3.339879,101.577612,"99",15.15,27.01,2.63,35.95,5,7,2,0.92,12.58,,"Scattered clouds. Extremely hot.",34.00
4,7,"FANAAS BISTRO (Restoran Alinas-Prima Beruntung)",3.392907,101.552295,"57",20.87,33.55,11.76,47.71,14,18,4,4.12,16.70,38.44,"Scattered clouds. Extremely hot.",34.00
5,1,"LAVANIZ FRESH MART",3.129195,101.465181,"53",13.21,13.21,36.84,36.84,38,42,4,12.89,12.89,,"Scattered clouds. Extremely hot.",34.00
5,2,"RS VALLEY TRADING & SERVICES - TIAJ (Fri: 12pm-3pm rest)",3.129189,101.465156,"48",13.22,13.22,0.00,36.84,0,0,0,0.00,12.89,,"Scattered clouds. Extremely hot.",34.00
5,3,"GAYA BUMI ENTERPRISE (Mon-Sat: 9am-6pm)",3.129132,101.465112,"56",13.23,13.23,0.01,36.85,0,0,0,0.00,12.90,,"Scattered clouds. Extremely hot.",34.00
5,4,"CHOP LIAN HUP (SUNDAY CLOSE) MON-SAT 7AM-7PM",3.129092,101.465103,"27",13.23,13.23,0.04,36.89,0,0,0,0.01,12.91,,"Scattered clouds. Extremely hot.",34.00
5,5,"MINI MARKET NIRMALA (Mon-Sat: 9.30am-6pm)",3.129083,101.465105,"52",13.23,13.23,0.00,36.89,0,0,0,0.00,12.91,,"Scattered clouds. Extremely hot.",34.00
5,6,"PASAR MINI FAIRPRICE TAMAN SENTOSA (Mon-Sat: 9am-6pm)",3.129071,101.465099,"51",13.23,13.23,0.00,36.89,0,0,0,0.00,12.91,,"Scattered clouds. Extremely hot.",34.00
5,7,"PASAR RAYA SMART (Fri: 1pm-3pm rest)",3.129065,101.465087,"50",13.23,13.23,0.00,36.89,0,0,0,0.00,12.91,,"Scattered clouds. Extremely hot.",34.00
5,8,"JANNAH MAMA ENTERPRISE (Mon-Fri: 8am-6pm| Fri: 12pm-3pm rest| Sat: 5pm close)",3.129043,101.465079,"55",13.23,13.24,0.00,36.89,0,0,0,0.00,12.91,,"Scattered clouds. Extremely hot.",34.00
5,9,"CRESCENT STAR IMPEX SDN. BHD.",3.129036,101.465082,"69",13.23,13.24,0.00,36.89,0,0,0,0.00,12.91,,"Scattered clouds. Extremely hot.",34.00
5,10,"AZVA GLOBAL SDN BHD (Mon-Fri: 8am-6pm|Fri: 12pm-3pm rest|Sat: 4pm close)",3.129033,101.465084,"92",13.23,13.24,0.00,36.89,0,0,0,0.00,12.91,,"Scattered clouds. Extremely hot.",34.00
5,11,"KEDAI RUNCIT AMIRUDDIN (Fri: 12pm-3pm rest)",3.129018,101.465089,"54",13.24,13.24,0.00,36.89,0,0,0,0.00,12.91,,"Scattered clouds. Extremely hot.",34.00
5,12,"DWELLING MAKERS SDN BHD - WYNDHAM (ACMAR KLANG) (Mon-Fri: 9am-12pm, 2pm-5pm)",3.128992,101.465101,"98",13.24,13.24,0.00,36.89,0,0,0,0.00,12.91,,"Scattered clouds. Extremely hot.",34.00
5,13,"DIYA AL DIN ENTERPRISE (Mon-fri : 8am-6pm | Fri 12pm-3pm closed)",3.128986,101.465091,"43",13.24,13.24,0.00,36.89,0,0,0,0.00,12.91,,"Scattered clouds. Extremely hot.",34.00
5,14,"88 FRESHMART SDN. BHD. (Mon-Sat: 9.30am-8pm|Fri: 12pm-3pm rest)",3.128969,101.465095,"71",13.24,13.25,0.00,36.89,0,0,0,0.00,12.91,,"Scattered clouds. Extremely hot.",34.00
5,15,"CHETTIES MART (Mon-Sat:10am-6pm)",3.128959,101.465107,"36",13.24,13.25,0.00,36.89,0,0,0,0.00,12.91,,"Scattered clouds. Extremely hot.",34.00
5,16,"GUNA CASH & CARRY (Mon-Sat: 9.30am-6pm)",3.128959,101.465107,"56",13.24,13.25,0.00,36.89,0,0,0,0.00,12.91,,"Scattered clouds. Extremely hot.",34.00
5,17,"RAHIMA STORE (Mon-Fri: 8am-6pm|Fri: 12pm close|Sat: 3pm close)",3.128959,101.465107,"49",13.24,13.25,0.00,36.89,0,0,0,0.00,12.91,,"Scattered clouds. Extremely hot.",34.00
5,18,"A&T ASTAKA MART-PORT KLANG (Mon-Sat: 9am-6m)",3.128957,101.465118,"90",13.24,13.25,0.00,36.89,0,0,0,0.00,12.91,,"Scattered clouds. Extremely hot.",34.00
